Entry,City,Country code,Edition,Country,Continent
"ARCHTREASURER, the great treafurer of the German empire. This office was created with the eighth deflorate, in favour of the eleflor Pala¬ tine, who had loft his former deflorate, which was given to the duke of Bavaria, by the emperor Fer¬ dinand II. who took it away from Frederic V. eleftor Palatine, after the battle of Prague, where he was de¬ feated in maintaining his eleflion to the crown of Bo¬ hemia. The dignity of archtreafurer was contefted be-/ K k tween ARC [ 258 ] ARC Archilute tween the eledtor of Brunfwick, who ckimed it in II r virtue of his defcent from the ele&or of Frederic and . Ar<^lc- . the eledlor Palatine","Pala, Palatine, Prague, Bo, Palatine","US,TD,CZ,SL,DE",3,"United States,Chad,Czechia,Sierra Leone,Germany","North America,Africa,Europe,Africa,Europe"
"ARCTOPUS, in botany : A genus of the polyga- mia dioecia clafs ; and in the natural method ranking under the 45th order, Umbe/latcx. The umbella of the male is compound ; the involucrum confills of five leaves; the. corolla has five petals; the Itamina are five; and two piltilli : The umbella of the herma¬ phrodite is Ample ; the involucrum is divided into four parts, is fpinous, large, and contains many male flowers in the dilk. There is but one fpecies of ardlo- pus, viz. the echinatus, a native of Ethiopia",,ET,3,Ethiopia,Africa
"The fpecies are 11 ; all of them natives of Ethiopia, or the Cape of Good Hope. Of thele the anguflifo- lia with fpear-ffiaped leaves, and the alpera with wing- fhaped woolly leaves, are moll remarkable for their beauty, having rays of a fine yellow or deep gold co¬ lour. They flower in May and June",Of,"ET,TR",3,"Ethiopia,Turkey","Africa,Asia"
"ARDEA, in ornithology, a genus of the order of The fportfman finds, in courfe, much difficulty in ap- grallae. The general characters of this order are preaching them within gun-(Jiot j for, as they Hand thefe : The bill is ftraight, (harp, long, and fomewhat near five feet high from the ground, they are enabled compreffed, with a furrow that runs from the noftrils to efpy him at a greater diftance. Sometimes indeed towards the point; the noftrils are linear; and the he approaches them under cover of a ftalking-horfe, or feet have four toes. Under this genus Linnaeus com- other objeft ; at other times a fmall dog will divert prebends the grus or crane, the ciconia or ftork, and their attention, as they will without fear attack the the ardea or heron, of other authors. See plates LIV. dog, while his mailer gets within reach. In breeding LV. time, however, they are more bold, as they will defend 1. The firft fpecies is the pavonia, or crowned crane, their young even againft men, fo as to make it dange- which has an ereifl briftly creft, with the temples and rous to come near their haunts. The male and fe- two wattles naked. The head is black ; the creft is male are faid to guard the neft by turns, yellowifti, and tipped with black at the top ; the wings 4. The grus, or common crane of Englilh authors, are white ; and the feathers of the tail black, and of has a naked papillous crown ; the prime feathers of the an equal length. It is a native of Africa, particularly wings are black ; the body is alh-coloured ; the prime the coaft of Guinea, as far as cape Verd; at this laft feathers of the tad are ragged. This Ipecies is far (pread, place they are faid to be exceedingly tame, and will being met with in great flocks throughout northern often come into the court-yards to feed with the poul- Europe and Afia; in Sweden, Ruffia throughout, and try. fhefe birds are often kept in our menageries, Siberia as far as the river Anadyr, migrating even to an.d> w*1"" belter 0f njghts, live a good while. Their the ar£tic circle. In Kamtfchatka they are only feen chief food is fuppofed to be worms, and fuch other on the fouthern promontory; are migratory, returning K. k 2 north- A R D r 260 1 A R Ardea. northward to breed in the fpring, and generally choo- fing the fame places which Had been occupied by them the feafon before. In the winter they,inhabit the warm¬ er regions, fuch as Egypt, Aleppo, India, &c. they are alfo met with at the Cape of Good Hope, changing place with the feafon. In their migrations they fre¬ quently Hy fo high as not to be vifible ; their palling only being known by the noife they make, which is louder than any other bird. In France they are feen in fpring and autumn ; but for the mod part are mere padengers.—This fpecies leems to have been formerly a native of Britain ; as we find in Willoughby, page 52","Ardea, Aleppo, Willoughby","GN,SE,EG,IN,IT,SY,US",3,"Guinea,Sweden,Egypt,India,Italy,Syrian Arab Republic,United States","Africa,Europe,Africa,Asia,Europe,Asia,North America"
"Stories are birds of padage ; they f'pend the dimmer in It is lour feet and a half when eretd j the bill is about 'V t^ eight incites from the angle of the mouth to the end of it j and the cred is made up of long, narrow, brown feathers, the longed being dve inches in lenglh, which it can erect and let fall at pleasure. It is a native of Virginia, and feeds not only upon filh and frogs, but on lizards, efts, &c",Virginia,ZA,3,South Africa,Africa
"11. I he dtlLris, or bittern, has a fmooth head; it is variegated through the whole body with dark-colour- Europe, and difappear all at once, and go off to Egypt, Ethiopia, &c. before winter, amd do not return till a- bout the middle of March",March,"EG,ET,GB",3,"Egypt,Ethiopia,United Kingdom","Africa,Africa,Europe"
"ARDRAH, a fmall territory or kingdom of Africa, in Guinea properly fo called. It lies at the bottom of ARE of the gulph of St Thomas, and has a town called Ar- dres, fuppoled to be the capital. The inhabitants are very licentious, and have neither temple nor any place for religious worihip. However, they are very courage¬ ous; and their king was abfolute till lately that the king of Dahomay made war upon this and the neigh¬ bouring territories, brought them under fubjedtion, and burnt the towns, particularly Ardres. The air is very unwholefome to Europeans j yet the natives live to a great age ; but the fmall-pox makes great deftrudlion among them. This country is fertile in Indian corn, palm-wine, plants, and fruits, which iaft all the year 3 and they make a great deal of fait",,"GN,IN",3,"Guinea,India","Africa,Asia"
"again. The Europeans who live at Batavia, or Mala- ca, and in the Sunda and Molucca iflands, ule pinang as much as the Indians do ; and by walking their teeth they preferve them white. Some pretend that areca ftrengthens the ilomach, when the juice of it is fwallowed, as moft of the Indians do. Another pro¬ perty afcribed to it is, its curing or carrying off all that might be unwholefome or corrupt in the gums.- When eaten by itfelf, as is fometimes done by the In¬ dians, it impoverilhes the blood, and caufes the jaun- AREBO, or Aaebon, a town on the flave-coaft of dice) but is not attended with thefe inconveniences Guinea, in Africa, feated at the mouth of the river Formofo. The Englilh had once a faCIory there, as the Dutch have ftill. It is a large oblong place, indif¬ ferently well peopled, and furnilhed with houfes built of reeds and leaves. E. Long. 5. 5. N. Lat. 5, o",Batavia,"GN,US,NL",3,"Guinea,United States,Netherlands","Africa,North America,Europe"
"By the Greeks the people were called Argcii, from Argior Argos; by the Romans, Argivi, Argives. They were a colony who migrated, it is faid, from Egypt, un¬ der the command of Inachus. Polemon and Ptolemy Mendefius, ancient Greek writers, inform us, that Ina¬ chus was contemporary with Ampfis, who demoliffied Avaris, and expelled the fliepherds out of Egypt. If, with fome learned chronologtrs, we fuppofe Inachus to have begun to reform the Argives B. C. iSy6, and to have died B. C. 1808, he muft have been coeval with Amofis who reigned in Upper Egypt 15 years before A R G [ 272 ] ARC the expulfion of the fhepherds, and 10 years after that event, which happened B. C. 1806. Inachus was ftyled the Son of the Ocean, becaufe his origin was not known, or becaufe he had come by fea into Greece. Before his arrival the inhabitants were rude and barbarous. Thele he united and civilized, and inftru&ed in various arts",Ina,"EG,GR,JP",3,"Egypt,Greece,Japan","Africa,Europe,Asia"
"Dr Bryant, however, rejedts the hiftory of the Ar¬ gonautic expedition as a Grecian fable, founded indeed on a tradition derived from Egypt, and ultimately re¬ ferring to Noah’s prefervation, &c. in the ark. But although.we are not to believe all the romantic ftories which poets, and even fome grave hiftorians, have told us of thofe famous adventurers, yet it feems unreafon- able to diferedit entirely the Argonautic expedition",,EG,3,Egypt,Africa
"The occafion of this expedition is thus reprelented by Greek writers. Phryxus, flying with his fifttr Helle from the rage of their flep-mother Ino, the daughter of Cadmus, went on board a fliip, whole en- fign was a golden ram, and failed to Colchis (now, Mingrelia, part of Georgia). Helle was drowned by the way, in that fea which from her was called the Hellefpont, now the Dardanelles. This, according to fome, was the ground of the poetical fable, that a ram with a golden fleece fwam away with them to Colchis j and that the Argonauts undertook their famed expe¬ dition, in order to find that fleece. But Strabo and Arrian informs us, that it was a practice of the Col- chians to colledf gold on mount Caucafus by ex¬ tending fleeces acrofs the beds of the torrents 5 and as the water pafled, the metallic particles remain¬ ed entangled in the wool : hence"", according to thofe hiftorians, the adventure was named the expedition of the golden fleece. Sir Ifaac Newton thinks that this expedition was really an embaffy fent by the Greeks, during the inteftine divifions of Egypt in the reign of Amenophis, to perfuade the nations upon the coafts of the Euxine and Mediterranean feas, to take that op¬ portunity of fliaking off the yoke of Egypt, which Se- foftris had laid upon them ; and that fetching the gol¬ den fleece, was only , a pretence to cover their true defign","Ino, Newton","EG,GE,JP,US,GR",3,"Egypt,Georgia,Japan,United States,Greece","Africa,Asia,Asia,North America,Europe"
"“ Thefe adventures, however, have been too much adorned by the graces of poetry, to be the proper fub- jedts of hiftorical compofition. The defigns of the Ar¬ gonauts are veiled under the allegorical, or at lead: doubtful, phrale, of carrying off the goldenfleece y which,, though ealily explained, if we admit the report that the inhabitants of the eaftern banks of the Euxine ex¬ tended fleeces of wool, in order to colled the golden particles which were carried down by the torrents from Mount Caucafus, is yet defcribed in fuch various lan¬ guage by ancient writers, that almoft every modern who examines the fubjed, thinks himfelf entitled to offer, by way of explanation, lome new conjedure of his own. But in oppofition to the moft approved of thefe conjedures, we may venture to affirm, that the voyage to Colchis was not undertaken with a view to eftablifh extenfive plans of commerce, or to learch for mines of gold, far lefs to learn the imaginary art of converting other fubftances into that precious metal j all fuch motives fuppofing a degree of /peculation and refinement unknown in that age to the gallant but un- inftrudfed youth of Tneflaly. The real objed of the expedition may be difcovered by its coniequences. The Argonauts fought, conquered, and plundered ; they fettled a colony on the fhores of the Euxine 5 and car¬ ried into Greece a daughter of the King of Colchis, the celebrated Medea, a princels of Egyptian extrac¬ tion, whofe crimes and enchantments are condemned to eternal infamy in the immortal lines of Euripides.” Argonauts of St Nicholas, was the name of a mili¬ tary order inftituted by Charles HI. king of Naples, in the year 1382, for the advancement of navigation, or, as feme fay, merely for preferving amity among the nobles. They wore a collar of (hells, inclofed in a fil- ver crefcent, whence hung a flnp with this device, Non credo tempori, “ 1 do not truft time.” Hence thefe * I , Argonaut i A R G [ 5 Argophyl- Argonaut knights came to be called knights of the lam, Jhell. They received the order of St Bafd, archbifliop , rs°s' of Naples $ and held their aflemblies in the church of St Nicholas, their patron","Naples, Naples","US,GR,EG",3,"United States,Greece,Egypt","North America,Europe,Africa"
"Aria, and Ariana (anc. geog.), whether the fame or diftinct countries authors are not agreed. Ptolemy has only Aria, and knows nothing about Ariana. Pliny mentions only Ariana, and fays nothing about Ariaj but diftinguithes between the Arii and Ariani : Par- thia, he fays, has the Arii to the eaft, Carmania and the Ariani to the fouth 5 from which it is conjectured, the Ariani extended farther than the Arii, and compri- fed the Gedrofii and the Drangse. Arrian has only Aria and Arii, and is filent about Ariana. But Strabo gives more extenfive bounds to Ariana than to Aria, without particularly defining them : only in general he fays, that Ariana begins from India, and quotes Era- tofthenes 5 according to whom, Ariana is bounded by the Indus on the eaft ; on the fouth by the Great Sea ; by Paropamifus on the florth, and by the mountains, quite to Portae Cafpiai j on the weft by the fame boun¬ daries by which Parthia is feparated from Media, Car- mania from Parsetacene and Perfia : and thus Ariana is extremely extenfive.—Aria has its limits thus de- fcribed by Ptolemy : On the north, fome parts of Mar- giana and Badriana ; on the eaft, the Paropamifidae $ on the fouth, the Drangiana : and Strabo fays, the A- rii adjoin to the Paropamifidm on the weft","Ariana, Ariana, Ariana, Ariana, Ariana, Ariana, Ariana, Ariana","TN,IN",3,"Tunisia,India","Africa,Asia"
"ARIANNA, a fmall village fix miles N. E. from the city of Tunis. Here is a beautiful range of the ancient Carthaginian aqueduft, 74 feet high, fupport- ed by columns 16 feet fquare, and which Hill increafed in grandeur the nearer it approached Carthage. The ftones are all diamond-cut. Near this fpot feveral an¬ cient mattamones, or fubterraneous magazines for corn, have been difcovered within thefe few years, capable of containing 100 bufliels, ftrongly arched with large fquare fiones. The Moors have already begun to de- moliih them, it being their cuftom to do fo with every thing beautiful as foon as it comes to light","Tunis, Carthage",TN,3,Tunisia,Africa
"Authors fpeak variourty of his origin, tho’ they agree in giving him a divine one. His produdlion is moft commonly aferibed to Neptune. This god, according to fbme, railed him out of the ground by a ftroke of his trident: according to others, he begot him upon the body of the fury Erynnys; according to others, upon that of Ceres, whom he ravilhed in the form of a horfe, fhe having previoufly aftumed the form of a mare to elude his purfuit. This horfe was nurfed by the Nereids; and being fometimes yoked with the fea- horfes of Neptune to the chariot of this god, he drew him with incredible fwiftnefs through the lea. He had this Angularity in him, that his right feet refembjed thofe of a man. Neptune gavfe him to Capreus king of Haliartus. Capreus made a prefent of him to Her¬ cules ; who mounted him when he took the city of E- lis, gained the prize with him in the race againftCyg- nus the fon of Mars near Traecena, and at fall made a prefent of him to Adraftus. It is under this laft mafter that Arion has fignalized himfelf the moft : he won the prize for racing at the Nemean games, which the princes who went to befiege Thebes inftituted in the honour of Archemorus ; and was the caufe that Adra¬ ftus did not perilh in this famous expedition as all the other chiefs did","Ceres, Adra","ZA,IN",3,"South Africa,India","Africa,Asia"
"To one who alked him what his Ion would be the bet¬ ter for being a fcholar ? ” If for nothing elfe (faid he), yet for this alone, that when he comes into the theatre, one ftone will not fit upon another.” When a certain perfon recommended his fon to him, he demanded 500 drachmas; and upon the father’s replying, that he could buy a Have for that fum, “ Do fo (faid he), and then you’ll be mafter of a couple.” Being reproach¬ ed, becaule, having a luit of law depending, hefee’d a lawyer to plead for him, “ Juft fo (faid he), when I have a great fupper to make, I always hire a cook.” Being alked what was the difference between a wile man and a fool, he replied, “ Send both of them toge¬ ther naked to thofe who are acquainted with neither of them, and then you’ll know.” Beir.g’reproved by a cer¬ tain perfon (who, according to Mr*Stanley, was Plato) for his coftly and voluptubus feaft, “ I warrant you (faid he), that you would not have bellowed three far¬ things-upon fuch a dinner which the other confef- fing, “ Why, then (faid he), I find myfelf lels indul¬ gent to my palate than you are to your covetous hu¬ mour or, as it is otherwife reptelented, “ I find, that 1 love my belly, and you love your money.” When Simus, treafurer to Dionyfius, Ihowed him his houfe magnificently fufnilhed, and paved with coflly marble, (for he was a Phrygian, and confequently profufe) ; A- riftippus fpit in his face : upon which the other grow¬ ing angry, ” Why, truly (faid he), I could not find a fitter place.” His fervant carrying after him a great weight of money, and being ready to fink upon the N n 2 road A R I [ 284 ] A R I Ariftippus. roacj under his burden, he bid him throw away all that ' v ' was too much for him to carry. Horace mentions this faff in his third fatire of the fecond book :  Quid fimile ifti Graecus Ariftippus ? qui lervos projicere aurum In media juffit Libya, quia tardius irent Propter onus legnes","Stanley, Plato","LY,GB,CO",3,"Libya,United Kingdom,Colombia","Africa,Europe,South America"
"But he fell fick in his return home,, and died at Lipa- ra, an JEolian Hand. With regard to his principal opi¬ nions ; like Socrates, he rejedled the fciences as they were then taught, and pretended that logic alone was fufficient to teach truth and fix its bounds. He affert- ed, that pleafure and pain were the criterions by which we were to be determined ; that thefe alone made up all our paflions ; that the firlt produced all the foft emotions, and the latter all the violent ones. The af femblage of all pleafure, he afferted, made true happi- nefs, and that the beft way to attain this was to enjoy the prefent moments. He wrote a great many books : particularly the Hiftory of Libya, dedicated to Diony¬ fius ; leveral Dialogues j and four books of the Lux¬ ury of the Ancients. There are four epiftles of his extant in the Socratic Colledtion publifhed by Leo Allatius",,LY,3,Libya,Africa
"e of a pale purple colour, and are frequently fucceed¬ ed by feed-veflels like the other. 3. The fer pent aria, is a native of Virginia and Carolina, from whence the radix ferpentaria, or fnake-root, fo much ufed in me¬ dicine, is brought over. The plant rifes out of the ground in one, two, and fometimes three pliant ftalks, which at every little diftance are crooked or undulated","Virginia, Carolina","ZA,PR",3,"South Africa,Puerto Rico","Africa,North America"
"A round canulated capfule fucceeds the flower. It is filled with feeds, which are ripe in May. The ufual price of the root when dried is 6d. per pound, both in Virginia and Carolina, which is money hardly earned ; yet the negro flaves employ great part of the time al¬ lowed them by their mafters in fearch of it, which is the reafon that there are feldom found any but very externally for deanfing and drying wounds and ul¬ cers, and in cutaneous difeafes","Virginia, Carolina","ZA,PR",3,"South Africa,Puerto Rico","Africa,North America"
"but in a little time prove naufeoufly bitterilh j the long fomewhat the leaft fo. The root of the clematitis is long and (lender, jarely exceeding the thicknefs of a and Eur.ipides; and mpft of his plays were written during the Feloponnefian war. His imagination was warm and lively, and his genius particularly turned to raillery. He had alfo great fpirit and refolution ; and was a declared enemy to flavery, and to all thofe who wanted to opprefs their country. The Athenians fuf- fered tliemfelves in his time to be governed .by men who had no other views than to make themfelves ma¬ fters of the commonwealth. Ariftophanes expofed the defigns of thefe men, with great wit and feverity, upon the ftage. Cleo was the firft whom he attacked, in his comedy of the Equites ; and as there was not one of the comedians who would venture to perfonate a man of his great authority, Ariftophanes played the charader himfelf, and with ib much fuccefs, that the Athenians obliged Cleo to pay a fine of five talents, which were given to the poet. He defcribed the af- fairs of the Athenians in fo exad a manner, that his comedies are a faithful hiftory of that people. For this reafon, when Dionyfius king of Syracule defired to learn the date and language of Athens, Plato fent him the comedies of Ariftophanes, telling him, thefe were the beftreprelentation thereof. He wrote above 50 comedies 5 but there are only 11 extant which are perfedf : thefe are, Plutus, the Clouds, the Frogs, E- quites, the Acharnenfes, theWafps, Peace, the Birds, the Ecclefiazufae or Female Orators, the Thefmopho- fiazufse or Prieftefles of Ceres, and Lyfiftrata. The Clouds, which he wrote in ridicule of Socrates*, is the mod celebratednf all his comedies. Madam Dacier tells us, (lie was (b much charmed with this perform¬ ance, that after (he had tranflated it, and read it over 200 times, it. did not become the leaft tedious to her, which","Athens, Plato, Ceres","US,CO,ZA",3,"United States,Colombia,South Africa","North America,South America,Africa"
"ARISTOTELIANS, a fed of Philofophers, other- ,Ariftotl* wife called Peripatetics. ¥"" "" ' The Ariftotelians and their dogmata prevailed for a long while in the fchools and univerfities; even in fpite of all the efforts of the Cartefians, Newtonians, and other corpufcularians. But the fyftems of the latter have at length gained the pre-eminence; and the New¬ tonian philofophy imparticular is now very generally received. The principles of Ariftotle’s philofophy, the learned agree, are chiefly laid down in the four books de Casio ; the eight books of Phyfcal Aufcultation, tpvo-Hcns etK^oxiriuf, belonging rather to logics, of meta- phyfics, than to phyfics. Inftead of the mote ancient fyftems, he introduced matter, form, and privation, as the principles of all things; but he does not feem to have derived much benefit from them in natural phi¬ lofophy. His dodrines are, for the moft part, fo ob- fcurely exp refled, that it has not yet been fatisfadorily afcertained what were his fentiments on fome of the moft important fubjeds. He attempted to refute the Pvthagoraean dodrine concerning the twofold motion of the earth 5 and pretended to demonftrate, that the matter of the heavens is ungenerated, incorruptible, and fubjed to no alteration : and he fuppofed that the ftars were carried round the earth in folid orbs. The reader will find a diftind account of the logical part of his philofophy, by Dr Reid profeflbr of moral phi¬ lofophy in the univerfity of Glafgow, in the fecond volume of Lord Karnes’s Sketches of the Hiftory of Man j and Mr Harris has publiftied a fenfible com¬ mentary on his Categories, under the title of Pbilofo- phical Arrangements",Man,CI,3,Côte d'Ivoire,Africa
