Entry,City,Country code,Edition,Country,Continent
"Arx alio denoted a confecrated place on the Pala¬ tine Mount, where the augurs publicly performed their office. Some will have the arx to have been the augural temple j but Varro exprefsly dilfinguifhes be¬ tween the two",Pala,TD,3,Chad,Africa
"Wormius aflures us, that the method of making cloth of atbeflos is now entirely unknown. And indeed one would fcarce imagine the thing practicable, with¬ out the mixture of tome other pliant matter, as wool, hemp, or flax, along with the atbeftos, the filaments of this latter appearing too coarfe and brittle to make any tolerable fine work. However this be, Bapt. Por¬ ta-affures us, that in his time the fpinning of afbeftos was a thing known to every body at Venice. Sig. Ca- ftagnatta, liiperintendant of fome mines in Italy, is faid to have carried the manufacture to fuch perfection, that his afbeffos was foft and trad able, much refcmbiing lamb-fkin dreffed white', he could thicken and thin it at pleafure, and thus either make it into a very white fkin or a very white paper","Venice, Sig","IT,US,DZ",3,"Italy,United States,Algeria","Europe,North America,Africa"
The ihorter filaments which feparate in wafting tin flone may be made into paper in the common mannen The afbeftos is found in Crete and Cyprus j in Tar tary j at Namur in the Low Countries ; in Thuringia among the mines j in the Old Noricum 5 in Egypt ; in the mountains of Arcadia ; at Puteoli > in the ifland ol Corfica 3 in the ifland of Anglefey in Wales j in Aberdeenlhire in Scotland ; at Montaubon in France > and in the kingdom of Siberia,"Namur, Arcadia","CY,EG,FR,BE,US",3,"Cyprus,Egypt,France,Belgium,United States","Asia,Africa,Europe,Europe,North America"
"ASIA, is one of the three general parts of our con¬ tinent, and one of the four of the whole earth. It is feparated from Europe by the Mediterranean fea, the Archipelago, the Black Sea, the Palus Meotjs, the Don, and the Dwina, which fall into the White Sea ; and from Africa, by the Arabic Gulph or Red Sea, and the Iflhmus of Suez. All the other parts are furround- ed by the ocean. The late difcoveries (how that it does not join to America, though it extends very near it : (See America, n°- 105.). It is fituated between 44 and 196 degrees of eaft longitude, and 1 and 74 de¬ grees of north latitude. From the Dardanelles to the moft eaftern ftiore of Tartary, it is 4740 miles in length 5 and from the moft fouthern point of Malacca to the moft northern point of Nova Zembla, it is 4380 miles in breadth","Suez, Malacca","EG,MY",3,"Egypt,Malaysia","Africa,Asia"
"ASMONEUS, A S O C 39i; J A S 0 ASMONEUS, or Assamoneus, the father of Si- ibrus, or Hazor, a town of GaliJee ; called the capi- mon, and chief of the Afmoneans, a family that reign- tal of all the kingdoms to the north of Paleftine. It ed over the Jews during 126 years. was taken by Jofhua ; the inhabitants were put to the ASNA, or Esna, a town in upper Egypt, feated fword, and their houfeis burnt. It was afterwards re- upon the Nile, believed by fome authors to be the an- built (Judges, 1 Sam.) ; but remained ftill in the hands cient Syena, though others fay the ruins of it are ftill to be feen near Aftuan. It is fo near the catarafls of the Nile, that they may be heard from thence. It con¬ tains feveral monuments of antiquity 5 and among the reft an ancient Egyptian temple, pretty entire, all painted throughout, except in fome places that are ef¬ faced by time. The columns are full of hieroglyphic figures. This fuperb ftrutfture is now made ufe of for a liable, wherein they put oxen, camels, and goats. A little way from thence are the ruins of an ancient nun¬ nery, faid to be built by St Helena, furrounded with tombs.—Afna is the principal town in thefe parts, and the inhabitants are rich in corn and cattle. They drive a confiderable trade into Lower Egypt and Nubia, by means of the Nile, and alfo by the caravans that pafs over the Defart. The inhabitants are all Arabs, ex¬ cept about 200 Copts, the ancient inhabitants, and of the Canaanites, though in the lot of the tribe of Naphthali, (jolTiua). It lay to the north of the La- cus Samachonites, called in Scripture the Waters of Merom, (Jofephus)",,EG,3,Egypt,Africa
"ASPERUGO, small wild dug loss, in botany: A genus of the pentandria monogynia clafs; and in the natural method ranking under the 49th order, Af- perifoHce. The calyx of the fruit is comprefled, with folds flatly parallel, and finuous. There are two fpe- ciers, viz. the procumbens, or wild buglos, a native of Britain j ASP [ 398 1 ASP Afpertila, Britain ; and the Egyptiaca, a native of Egypt. Hor- Afphaltites pes^ gCatS) (heep, and fwine eat the firft fpecies j cows v are not fond of it",,EG,3,Egypt,Africa
"ASPHALTUM, bitumen Judaicum, or Jews pitch, is a light folid bitumen, of a dulky colour on the outfide, and a deep fhining black within ; of very little tafte ; and having fcarcely any fmell, unlefs heat¬ ed, when it emits a ftrong pitchy one. It is found in a foft or liquid ftate on the iurface of the Dead Sea, and by age grows dry and hard. The fame kind of bitu¬ men is met with likewife in the earth, in other parts of the world, in China, America, and in fome places of Europe, as the Carpathian hills, France, Neufchatel, &cs ASP [ 400 ] A S P Afph V]tum» &c. There are feveral kinds of Jews pitch in the Afphode- (hops : but none of them are the genuine fort, and have , 118 little other title to their name than their being artifi- “‘v’” dally compounded by Jews ; and as they are a medley of we know not what ingredients, their medicinal ule begins to be defervedly laid afide, notwithdanding the dii'catient, refolvent, pectoral, and other virtues, attri¬ buted to this bitumen by the ancients. The true af- phaltum was formerly uled in embalming the bodies of the dead. The thick and folid afphalta are at prefent employed in Egypt, Arabia, and Perfia, as pitch for (hips ; as the fluid ones, for burning in lamps, and for varnilhes. Some writers relate, that the walls of Ba¬ bylon, and the temple of Jerufalem, were cemented with bitumen inftead of mortar. This much is cer¬ tain, that a true natural bitumen, that for inftance which is found in the diflrid of Neufch&rel, proves an excellent cement for walls, pavements, and other pur- pofes, uncommonly firm, very durable in the air, and not penetrable by water. The watch and clock makers yfe a compofition of afphaltum, fine lamp black, and oilof fpike or turpentine, for drawing the black figures on dial-plates : this compofition is prepared chTefly by certain perfons at Augfburg and Nuremberg. See the preceding article",,"CN,FR,EG",3,"China,France,Egypt","Asia,Europe,Africa"
"The word ajfafm is faid by fome to have been brought from the Levant, where it took its rife from a certain prince of the family of the Arfacidee ; popularly called AJfaftns, living in a caftle between Antioch and Da- raafco, and bringing up a number of young men, ready to pay a blind obedience to his commands ; whom he employed in murdering the princes with whom he was at enmity. But according to Mr Volney, the word Hajfajfin (from the rooi hafs, “ to kill, to affaf- finate,'to iiflen, to furprife,”) in the vulgar Arabic fignifies “ Robbers of the night,” perfons who lie in ambujh to kill; arid is very univerfally underftood in this fenfe at Cairo and in Syria. Hence it was applied to the Batenians, who flew by furprife. See the next ar¬ ticle","Antioch, Cairo","SY,US,EG",3,"Syrian Arab Republic,United States,Egypt","Asia,North America,Africa"
"firft dynafty were the fame with the kings of Afiyria, of whom Zohah, or Nimrod, was the founder of Babe', ( Hcrbelot Orient. Bib!, v. Bagdad). It does not, how¬ ever, appear, that Nimrod reigned in Affyria, The kingdoms of Babylon and Affyria were originally di- ftinft and feparate (Micah v. 6.) ; and in this ftate they remained until Ninus conquered Babylon, and - made it tributary to the AfTyrian empire. Ninus, the- fucceffor of Afhur (Gen. x. u., Diod. Sic. L. i.), feized on Chaldaea, after the death of Nimrod, and united the kingdoms of Affyria and Babylon. This great prince is faid to have fubdued Afia, Perfia, Me¬ dia, Egypt, &c. If he did fo, the effe&s of his conquefts were of no duration ; for, in the days of A- "" braham, we do not find that any of the neighbour¬ ing kingdoms were fubjeft to Affyria. He was fuc- ceeded by Semiramis ; a princefs of an heroic mind j bold, enterprifing, fortunate ; but of whom many fa¬ bulous things have been recorded. It appears, how¬ ever, that there were two princeffes of the fame namc> who flourifhed at very different periods. One of them was the confort of Ninus ; and the other lived five ge¬ nerations before Nitocris queen of Nebuchadnezzar (Eufeb. Chron. p. 58. Herod. L. i. c. 184.) This fa£t has not been attended to by many, writers",,EG,3,Egypt,Africa
"Some fufpicion has ariien, that the lift which Ctefias has given of the Affyrian kings is not genuine ; for many names in it are of Perfian, Egyptian, and Gre¬ cian extraction",,EG,3,Egypt,Africa
"Judicial aftrology is commonly faid to have been in¬ vented in Chaldea, and thence tranfmitted ro the Egyptians, Greeks, and Romans ; though fome will have it of Egyptian origin, and afcribe the invention to Cham. But it is to the Arabs that we owe it. At Rome the people were fo infatuated with it, that the aftrologers, or, as they were then called, the mathema¬ ticians, maintained their ground in fpite of all the edicts of the emperors to expel them out of the city","Cham, Rome","DE,US,EG",3,"Germany,United States,Egypt","Europe,North America,Africa"
"It is evident, indeed, that the countries both of Chaldea and Egypt were exceedingly proper for aftro- nomical obfervatrons, on account of the general puri¬ ty and ferenity of the air. The tower or temple of Belus, which was of an extraordinary height, with flairs winding round it up to the top, is fuppofed to have been an artronomical obfervatory; and the lofty pyramids of Egypt, whatever they were ori¬ ginally defigne.l for, might poflibly anfwer the fame purpofe. Indeed thefe very ancient monuments ftiow the fkill of this people in practical aftronomy, as they are all fituated with their four fronts exadtly facing the cardinal points. Herodotus aferibes the Egyptian knowledge in aftronomy to Sefoftris, whom Vox,. U. Part IL",,EG,3,Egypt,Africa
"Thales the Milefian, who travelled into Egypt, and brought from thence the firft. principles of the fcience",,EG,3,Egypt,Africa
"Eudoxus the Cnidian was a cotemporary with A- riftotle, though confiderably older, and is greatly cele¬ brated on account of his Ikill in aftronomy. He was the firft who introduced geometry into the fcience, and he is fuppofed to be the inventor of many propofitions attributed to Euclid. Having travelled into Egypt in the earlier part of his life, and obtained a recom¬ mendation from Agefilaus to Nedianebus king of Egypt, he, by his means, got accefs to the priefts, who had the knowledge of aftronomy entirely among them, after which he taught in Afia and Italy. Se¬ neca tells us that he brought the knowledge of the planetary motions from Egypt into Greece ; and Ar¬ chimedes, that he believed the diameter of the fun to be nine times that of the moon. He was alfo well acquainted with the method of drawing a fun-dial up¬ on a plane; from whence it may be inferred that he underftood the dodtrine of the projedlion of the fphere ; yet, notwithftanding what has been faid concerning the obfervations of Eudoxus, it is not certain that his fphere was not taken from one much more ancient, afcribed to Chiron the Centaur. The reafon given for this fuppofition is, that had the places of the ftars been taken from his own obfervations, the conftella- tions muft have been half a fign farther advanced than they are faid to be in his writings",Euclid,"EG,IT,GR,US",3,"Egypt,Italy,Greece,United States","Africa,Europe,Europe,North America"
"Soon after Eudoxus, Calippus flouriftied, whofe fy¬ ftem of the celeftial fphere is mentioned by Ariftotle; but he is better known from a period of 76 years, con¬ taining four corredled metonic periods, and which had its beginning at the fummer folftice in the year 330, before Chrift. But about this time, or rather earlier, the Greeks having begun to plant colonies in Italy, Gaul, and Egypt, thefe became acquainted with the Pythagorean fyftem, and ahe notions of the ancient Druids concerning aftronomy. Julius Csefar informs us, that the latter were /killed in this fcience ; and that the Gauls in general were able failors, which at that time they could not be without a competent know¬ ledge of aftronomy : and it is related of Pytheas, who lived at Marfeilles in the time of Alexander the Great, that he obferved the altitude of the fun at the fummer folftice by means of a gnomon. He is alfo faid to have travelled as far as Thule to fettle the climates. I4 After the death of Alexander the Great, fciences State of flouriftied in Egypt more than in any other part of theaftronoiny world ; and a famous fchool was fet up at ■^^exan^r'aIaft^gtytu:t under the aufpices of Ptolemy Philadelphus, a Prince death of inftru&ed ip all kinds of learning, and the patron of Aiexander",,"EG,IT",3,"Egypt,Italy","Africa,Europe"
"By comparing his own obfervations on the fpica Virginia with thofe of Timochares at Alexandria made too years before, he difcovered that the fixed ftars changed their places, and had a flow motion of their own from weft: to eaft. He corre&ed the Calippic period, and point¬ ed out fome errors in the method laid down by Era- tofthenes for meafuring the circumference of the earth","Virginia, Alexandria","ZA,US",3,"South Africa,United States","Africa,North America"
"in the firft century. The principles on which his fy- ftem is built are indeed erroneous ; but his work will always be valuable on account of the number of ancient obfervations it contains. It was firft tranflated out of the Greek into Arabic in the year 827, and into Latin from the Arabic in 1230. The Greek original was unknown in Europe till the beginning of the 15th century, when it was brought from Conftantinople, then taken by the Turks, by George a monk of Trapezond, who tranflated it into Latin. . Various editions were afterwards publifhed ; but little or no im¬ provement was made by the Greeks in this fcience. ^ ",George,"ZA,GR",3,"South Africa,Greece","Africa,Europe"
"After his time, though feveral eminent aftronomers ap¬ peared among the Saracens, hone made any very va¬ luable obfervations for feveral centuries, excepting Ebn Younis aftronomer to the caliph of Egypt; who ob- ferved three eclipfes with fuch care, that by means of them we are enabled to determine the quantity of the moon’s acceleration fince that time",,EG,3,Egypt,Africa
"Gemma Frifius wrote a commentary on a work of Ap- pian, intitled his Cofmography, with many obfervations of eclipfes. He invented alfo the aftronomical ring, and feveral other inftruments, which, though they could not boaft of much exatlnefs fuperior to others, were yet of confiderable utility in taking obfervations at 421 422 ASTRO at fea 5 and lie is alfo memorable for being the firft who propofed a time keeper for determining the lon¬ gitude at fea.—George Joachim Rheticus was a fcho- lar of Copernicus, to attend whofe le&ures he gave up his profeflbrlhip of mathematics at Wittemberg. For the improvement of aftronomical calculations, he began to conftrufit a table of fines, tangents, and fecants, for every minute and ten feconds of the quadrant. In this work he firft fhowed the ufe of fecants in trigonometry, and greatly enlarged the ufe of tangents, firft invented by Regiomontanus ; but he afligned for the radius a much larger number of places than had been done be¬ fore, for the greater exaftnefs of calculation. This great work he did not live to accomplifti ; but it was completed by his difciple Valentine Otho, and publifti- ed at Heidelberg in 1594",Heidelberg,ZA,3,South Africa,Africa
"Appearan- on the weftern fide. In thefe two obfervations, I was -ofCelc;, doubt whether it was not a fatelliteof Venus of fuch , ia Bo ics. a conf,^ence as not to be very well fitted to refleft the light of the fun ; and which, in magnitude, bore near¬ ly the fame proportion to Venus as the moon does to the earth, being at the fame diftance from the fun and the earth as Venus was, the phafes whereof it refem- bled. Notwithftanding all the pains I took in looking for it after thefe two obfervations,''and at divert other times, in order to complete fo confiderable adifcovery, I was never able to fee it. I therefore fufpend my judgment of this phenomenon. If it fhould return of¬ ten, there will be thefe two epochas, which, compared with other obfervations, may be of ufe to find out the periodical time of its return, if it can be reduced to any rule.” Difcovercd A fimilar obfervation was made by Mr Short on the plfo hy Mr 23d of Odlober 1740, about funrife. He ufed at this Short. a refle£ing telefcope of about 16.5 inches, which magnified between 50 and 60 times, with which he perceived a fmall ftar at about 10' diftance from Ve¬ nus, as meafured by the micrometer ; and, putting on a magnifying power of 240 times, he found the ftar put on the fame appearance with the planet herfelf",Bo,SL,3,Sierra Leone,Africa
".This is all the evidence which has yet been publifh- ed concerning the exiftence of the fatellite of Venus as it does not appear that, during the tranfit of any of the obfervers had the good fortune to perceive it. In the Philofophica! Tranfadtions for 1761, Mr Hirft gives an account of his having obferved an at- mofphere round the planet Venus. The obfervations were made at Fort St George; and locking atten- Obfcrva— lively at that part of the fun’s diflt where he expedtedduns con- the planet would enter, he plainly perceived a faint C£rni“g the' (hade or penumbra ; on which he called out to his two afiiftants, “’Tis a coming i” and two or three feconds after, the firft external contadt took place, in the mo¬ ment whereof all the three agreed ; but he could not fee the penumbra after the egrefs : and of the other two gentlemen, one had gone home, and the other loft the planet out of the field of his telefcope. Mr Dunn at Chdfea fitw a genumbra, or fmall diminution ofi light,",George,ZA,3,South Africa,Africa
"Thus it is fcarcely to be imagined that we can err in concluding, that the eyes, ears, legs, wings, and other parts of animals, were ftiade for the purpofes of feeing, hearing, walking, flying, and fo forth. Neither can we avoid inferring, that the Power who conftrudfed li¬ ving creatures with mouths, teeth, and organs to digeft- and afilmilate food for their nutriment, did likewife form other organized bodies, which we call vegetables, for the exprefs purpofe of affording that food. It is N O M Y. 461 needlefs to multiply inftances. We cannot avoid fee-Conclufions ing them every moment ; an’d their effedl is fo ftriking, £rom ^he that we are infenfibly forced from analogy t0 ah°w the Appe°ra® _ exiftence of a final caufe in all cafes, whether we areces, able to difcover it or not. ^--y- > “ On this ground, an inquiry into the final caufes 161 of the planetary bodies offers itfelf to our confidera-9f the ,va' tion. The earth is Ihown to be a planet in eireum-^^*^^ ftances very fimilar to the other five: we know 'ts tjje pianets: final caufe—to fupport a number of inhabitants : And by analogy we may conclude, that the others are alfo habitable worlds ; though, from their different pro¬ portions of heat, it is credible that beings of our make and temperature could not live upon them. However, even that can fcarcely be affirmed of all the planets; for the warmelt climate on the planet Mars is not colder than many parts of Norway or Lapland are in the fpring or autumn. Jupiter, Saturn, and the Geor¬ gium Sidus, it muft be granted, are colder than any of the inhabited parts of our globe. The greateit heat on the planet Venus exceeds the heat on the ifland of St Thomas on the coaft of Guinea, or Sumatra in the Eaft Indies, about as much as the heat in thofe places exceeds that of the Orkney iflands, or the city of Stockholm in Sweden : therefore, at 6o° north latitude on that planet, if its axis were perpendicular to the plane of its orbit, the heat would not exceed the greateft heat on the earth ; and of courfe vegeta¬ tion like ours might be there carried on, and animals of the fpecies on earth might fubfift. If Mercury’s axis be fuppofed to have a like pofition, a circle of about 2c0 diameter round each pole would enjoy the fame temperature as the warmer regions of the earth, though in its hotteft climate water would continually boil, and moil inflammable fubilances would be parch¬ ed up, deftroyed, or converted into vapour. But it is not at all neceffary that the planets Ihould be peopled with animals like thofe on the earth ; the Creator has doubtlefs adapted the inhabitants of each to their fitu- ation","Jupiter, Orkney, Stockholm","SE,NO,GN,US,ZA",3,"Sweden,Norway,Guinea,United States,South Africa","Europe,Europe,Africa,North America,Africa"
"Thefe opinions were probably brought from Egypt, from whence the Greeks borrowed great part of their 1^4 learning. However, it feems not to have been gene- Ariflotle’s ra]]y received ; for Arifiotle, who mentions it, afierted epmion t|iat tj,e heavens were unchangeable, and not liable to *hci*rn,nS genii'3*'011 or corruption. Comets, therefore, which he believed to be generated when they firft made their appearance, and deftroyed when they vanilhed from our fight, he maintained could not be heavenly bodies, but rather meteors or exhalations raifed into the upper regions of the atmbfpbere, where they blazed out for a while, and difnppeared when the matter of which they were formed was confumed. Seneca, who lived jn the firft century, mentions Apollonius of Myndus, a very careful obferver of natural caufes, to have been of the fame fentiments w ith the moil ancient Greek philofophers with regard to comets^ He himfelf had feen two : one in the reign of Claudius, the other in that of JSiero ; beftdes another which he faw while a boy, before the death of Auguftus. He plainly inti¬ mates, that he thought them above the moon ; and argues ftrongly againft thore who fuppofed them to be meteors, or held other abfurd opinions concerning them i declaring his belief that they were not fires fuddenly kindled, but the eternal productions of na¬ ture. He points out alfo the only way to come at a oertainty on this fubjeft, viz. by collecting a number of cbfervations concerning their appearance, in order to difeover whether they return periodically or not",,"EG,GR",3,"Egypt,Greece","Africa,Europe"
"that time appears to have been the opinion of only a few detached individuals of Greece. As the Greeks borrowed many things from the Egyptians,- and Py¬ thagoras had travelled into Egypt and Phenice, it is probable he. might receive an account- of this -hypothe-* fia.from thence : but whether he did fo.or not, we have • 3 P.2 ",,"GR,EG",3,"Greece,Egypt","Europe,Africa"
