Entry,City,Country code,Edition,Country,Continent
"At Port Aethwy, the moft general ferry into the ifland, there is a great paffage of cattle. It is computed that the ifland fends forth annually from 12,000 to 15,000 heads, and multitudes of ftieep and hogs. It is alfo computed that the remaining ftock of cattle is 30,000. In 1770 upwards of 90,000 buftiels of corn were exported, exclufive of wheat. The improvement in hufbandry has greatly increafed fmee the fuppreffion qf fmuggling from the Ifle of Man : before that time every farmer was mounted on fome high promontory, expe&ing the veffel with illicit trade; but fince that period, he fets in earneft to induftry and cultivation",Man,CI,3,Côte d'Ivoire,Africa
body of copper ore perhaps ever known. The part of —‘v—ai Tryfclwyn which contains it is called Parys mountain,Parys,ZA,3,South Africa,Africa
"“ In the year 1762, one Alexander Frazier came into Anglefey in fearch of mines. He vifited Parys mountain; called on Sir Nicholas Bayley, and gave him fo flattering an account of the profpeft,. as indu¬ ced him to make a trial, and fink lhafts. Ore was difeovered; but before any quantity could be gotten, th/e mines were overpowered with water. In about two years after, Meff. Roe and Co. of Macclesfield applied to Sir Nicholas for a leafe of Penrhyn ddu mine in Caernarvonlhire; with which they were, much againft their wills, compelled to take a leafe of part of this mountain, and to carry on a level, and make a fair trial. The trial was accordingly made ; ore was dif¬ eovered ; but the expences overbalanced the profits","Parys, Macclesfield","ZA,GB",3,"South Africa,United Kingdom","Africa,Europe"
"“ This difcovery is far from new : it has been praCli- fed long in the Wicklow mines in Ireland ; and above a century in thofe of Hern-grundt in Hungary, where it is called ziment copper. The waters of the Hunga¬ rian mines are much more ftrongly impregnated with copper than thofe of Parys mountain. The firft effefts its operation in 12 or about 20 days, the laft requires two months. Horfe-fhoes, iron made in ihape of hearts, and other forms, are put into the foreign wa¬ ters ; and when perfe&ly tranfmuted, are given as prefents to curious ilrangers",Parys,"IE,HU,ZA",3,"Ireland,Hungary,South Africa","Europe,Europe,Africa"
"7 ] A N G He publiflied his Supplicatio pojiulativa juJUtia, in op- AngoL pofition to their cenfure; wherein he complains that Angola, they had given him a vague undetermined cenfure, ''““’""V"""" without taxing any particular propofition. He died fome time after the reftoration of Charles II. but in what year is uncertain",,AO,3,Angola,Africa
"ANGOLA, a kingdom on the weftern coaft of A- frica, lying, according to the moft probable accounts, between Lat. 8. 30. and 16. 21. South, forming a coaft of upwards of 480 miles ; but how far it extends from weft to eaft, has never been exadly determined. An¬ gola Proper is bounded on the north by the river Dan- da, which feparates it from Congo ; and on the fouth by the Coanza, by which it is feparated from Benguela",Benguela,AO,3,Angola,Africa
"This laft, however, is now included in the kingdom of Angola, having been conquered by its monarchs, tho* it ftill retains the name of kingdom, and is included in the dimenfions we have juft now given The air here is very hot and unwholefome, and the country moun¬ tainous ; there being but few plains to be met with in it, except on the fea-coaft, and between the huge ridges of mountains. j That part of the kingdom which we have diftinguilhed Originallya by the name of Angola Proper, was fubjedl to the kings province of of Congo in the year 1484, when the Portuguefe firft^onS°- difcovered the country : but how long it had been fo before that time, is not known ; the inhabitants being utterly deftitute of chronology, and have no other way of diftinguiftiing paft events, but by faying they hap¬ pened in fuch a king’s reign. Neither, though Ango¬ la became a diftinft kingdom fince its difcovery by the Portuguefe, is it known with more certainty at what time that revolution happened ; or whether the Portu- uefe were not concerned in affifting the viceroy of the ing of Congo, who governed the province of Angola, to fet up fo’- himfelf- T All accounts agree, that this kingdom was founded Tradition by one Ngola, or Angola, from whom it took its name, concerning According to the tradition of the country, this Ngola kcc°^",,AO,3,Angola,Africa
"In confequence of this, he became exceeding rich, not in gold, filver, or ftiell-money, which were not at that time in ufe, but in corn, cattle, and fruits, which were then exchanged in traffic. The country being not long after vifited by a grievous famine, Ngola generoufly re¬ lieved his diftreffed countrymen, and laved the lives of fome thoufands. In gratitude for this generofity, he was unanimoufty chofen king ; and hence the fmith’s trade is reckoned among the royal arts of Angola. j- According to other accounts which can be more de- More au— pended upon, Ngola was the king of Congo’s viceroy; thentic ao- who, having become powerful by the redu&ion of feve- count, ral of the neighbouring ftates, was induced to fet up for himfelf. Dreading, neverthelefs, the power of his old mafter, he chofe to fend him the ufual tribute and prefents annually, till he reckoned himfelf firmly feat- ed on the throne, and had fecured it to his defeendents",,AO,3,Angola,Africa
"8 ] A N G They were waited for by Queen Zunda at the head of t Angola. * a numerous army ; but, no fooner did her foldiers per- '""■’’■V- "" ceive the parents of the deceafed prince, than they im¬ mediately abandoned the queen to their refentment. * Tumba immediately ruSHed upon her fifter, and Stab- bed her to the heart; after which. She commanded herb her entrails to be taken out, and thrown into the hole in£jfter, which her Ton’s body had been call. Upon this Tumba was crowned queen of Angola, and invited her huf- band to participate with her in the managetheut of public affairs. This offer he was too wife to accept j and Tumba, upon his refufal, refigned the crown into the hands of her furviving fon, named Angola Cbilvagni","Tumba, Tumba, Tumba","SE,AO",3,"Sweden,Angola","Europe,Africa"
"A N G [ Angola, grave. His fon Bandi Angola, who fucceeded him, ~v—~<l proved yet a greater tyrant than his father ; fo that he Ia foon became intolerable to his fubje&s. A general re- ainftBan v0't enfuec^> in which his fubjefts called in the cannibal df Angola! Giagas to their afliftance. Thefe immediately poured in like a band of hungry dogs haftening to feed upon a carcafe ; and having defeated and devoured the forces of the tyrant, befieged him in an inacceffible mountain ; where, not being able to come at him, they refolved to 13 reduce him by famine. Bandi Angola applied to the Quelled by king of Congo for affiftance. As it was the interell the alfift- Qf pr;nce hinder the ravenous Giagas from en- kin6 'of1 eter‘ng *nto the Angolic dominions, whence they could Congo andfo eafily pafs into his own, he did not hefitate at grant- the Portu- ing his requeft; and ordered a ftrong reinforcement of guefe. the Portuguefe, of whofe valour he had a high opinion, and of whom he entertained a great number at his _ court, to march to the affiftance of the king of Ango¬ la. The command of the army was given to one of the moft experienced Portuguefe officers; who, depend¬ ing more oh the handful of Europeans he had under his command than on the Congoefe, attacked the re¬ bels, though greatly fuperior in number ; and, having utterly defeated them, reftored the king of Angola to his throne",,AO,3,Angola,Africa
"Such violent meafures, however, could not be concert- 15 ed fo privately but the princefs got fome intelligence of to CorTo68*15 anc* appnfed her lover of his danger, he im- 0 3°' mediately withdrew into Congo, taking with him as many of his countrymen as he conveniently could. The king of Congo expreffed fuch ftrong refentment againft Bandi Angola for his ingratitude, that the Portuguefe general would have probably prevailed upon him to de¬ clare war againft Angola, had he not been obliged to defend his own dominions againft a nei 'hbouring prince who then made an invafion. This afforded that gene¬ ral a fair pretence of afldng leave to return home ; pro- mifing to come with fuch reinforcements as would en¬ able the king of Congo to reven ^e himfelf for the af¬ front put upon him by the Angolic monarch. His real intention, however, was, to give the king of Portugal an opportunity of feizing upon the kingdom of An- 16 gola",,"AO,PT",3,"Angola,Portugal","Africa,Europe"
"Thefe were no fooner gone than the admiral failed up the Coanza ; and, landing without oppofition in the kingdom of Angola, let about eredling a fortrefs in Vol. II. Part I",,AO,3,Angola,Africa
"9 ] A N G a convenient fituation, which was completed in a few Angola",,AO,3,Angola,Africa
"Bandi Angola was fucceeded by his fon Ngola Ban¬ di, whofe mother had been a flave, and whofe title to the crown was confequently difputable, according to the. 1? laws of the country. Of this the new king being well Cruelty of apprifed, thought proper to begin his reign by mur- new dering every perfon who had oppcfed his ele&ion. Hekin^‘ began with the Tendula, or commander of the king’s rear-guard ; who, by his office, is the chief of the elec¬ tors, and the perfon who governs the kingdom during the interregnum. Him he ordered to be put to death, with all his family. Thefe were followed by the prin¬ cipal officers of his father’s court; all his concubines, together with their parents and near relations, whom he caufed to be butchered ; together with his half- brother, his father’s fon by a favourite concubine, and then but an infant. He did not fpare even the fon of his fifter Zingha Bandi, whom fhe had by one of her paramours. The intereft of his fiftev had contributed greatly to raife this tyrant to the throne; and his in- B gratitude, A N G [ io ]| A N G Angola, gratitude, with the murder of her fon, fo exafperated Zingha was fo taken with the honours done her by Angola",Of,"AO,TR",3,"Angola,Turkey","Africa,Asia"
"far as to defire the viceroy to fend him fome proper perfons to inftruft him in the Chriftian religion, which he faid he was very defirous of embracing. This re- queft was immediately granted; and Don Denis de Faria, a negro prieft, a native of Angola, was dif- patched, along with an officer of diftinftion, to Hand godfather to the king. Thefe met at firft with a gra¬ cious reception : but when they came to talk of bap- The king being informed of this, fent an embaffy to tifm, Ngola altered his tone, and told them it was too treat of their ranfom and an exchange of prifoners",,AO,3,Angola,Africa
"zl The propofal was readily agreed to ; and the princef- His treach-fes were fent back, laden with prefents. The king, cry however, refufed to perform his part of the agreement, and thereby plunged himfelf into ftill greater difficul¬ ties. A new Portuguefe viceroy being arrived about much below his'dignity to receive it from the fon of one of his {laves, and fent them both back. This was cried up by the courtiers as a princely aft : but Zingha reprefented, that it could not fail to exafperate the vice¬ roy ; and tried all poffible means to diffuade him from it, but in vain. He fuffered, however, his other two this time, Ngola was quite at a lofs howto excufe the fifters, Cambi and Fungi, to be baptized; which was non-performance of his part of the treaty. At laft he Sends his had recourfe to his exafperated lifter Zingha ; and ha- fiiler Zing-ving excufed, as well as he could, the murder of her 13 fon, propofed to fend her on a fplendid embaffy to the viceroy. Having confented, but without forgetting her refentment, fixe fet out, as plenipotentiary for the king of Angola, with a magnificent retinue, was re- enibaffy",,AO,3,Angola,Africa
"1 ler liaugh- At the firft audience Zingha had of Don John (the t v beha- Portuguefe viceroy), {he was greatly furprized to find mow. a ftately elbow-chair prepared for him to fit upon, and for herfelf only a rich tapeftry fpread on the floor, with a velvet cufliion embroidered with gold, and placed over againft the chair of ftate. Diffembling her difpleafure, however, fhe beckoned to one of the ladies of her re¬ tinue, commanded her to lay herfelf down on her el¬ bows and knees upon the carpet, and fat herfelf upon her back during the whole time of the audience. She behaved with fuch addrefs and dignity, as to gain the admiration of the whole council. A propofal was made of entering into an alliance offenfive and defenfive with the king of Angola, provided he acknowledged him¬ felf the vaffal of the king of Portugal, and fubmitted to pay a yearly tribute To this Zingha replied, that fuch conditions were indeed fit to be impofed upon thofe the Coanza, about a mile long, and two bow-fliots in breadth; whither the Portuguefe purfued and furround- ed him ; fo that he had no other chance, but either to fall into their hands, or be devoured by the wild beafts with which the place fwarmed. From both thefe dan- 26 gers he was relieved by a dofe of poifon, given him, as The king was fuppofed, by his fifter Zingha. Before this time,P01fr,ne<k however, he had taken care to fend his eldeft fon to the country of the Giagas, and put him under the care of one of their chiefs, called Giaga Caza, whom he be- fought to take care of him, and proteft him from his aunt Zingha, as he rightly imagined {he would not fail of attempting his life, in order to fecure herfelf on the throne. 47 Zingha Band! was crowned queen of Angola, with- Zingha out oppofition, in 1627.—She was a very artful woman,Bandi endowed with great prefence of mind, firm in her refolu-crowne tions, of an intrepid courage, and a great miftrefs in the^ who had been conquered by the fword ; but not upon, art of diffimulation. She inherited a large {hare of her a great and powerful monarch, who only fought their friendlhip and allianci : upon which the treaty was concluded on both fides, without any other conditions than the exchange of prifoners. The audience being over, Don John took notice to Zingha, as he conduft- ed her out of the hall, that the lady who had ferved her as a feat, continued ftill in the fame pofture; up¬ on which fhe replied. That it did not become the am- baffadrefs of a great monarch to make ufe of the fame chair twice, fo file looked upon her as a piece of caft- off goods not worthy of further notice",,"AO,PT",3,"Angola,Portugal","Africa,Europe"
"brother’s jealous and cruel temper, to which ffie would not hefitate to facrifice her neareft relations, if they gave her the leaft umbrage.—To this jealoufy, there¬ fore, (he refolved to facrifice her nephew, as well know¬ ing he had a better title to the crown than herfelf. She made ufe of the moft folemn oaths to draw him out of the hands of his guardian, protefting that fhe had ac¬ cepted of the throne with no other view than to pre- ferve it for him. But Giaga, being well acquainted with her temper, was proof againft all her oaths and fair fpeeches.— Zingha, finding this metliod ineffeftual, pretended A N G [ i Angola, pretended a defire of refigning the crown to her nephew; «V—«^to which fhe faid fhe had no other objection, than that fhe was afraid he was yet incapable of afluming the reins of government. She therefore defired an interview with him, though ever fb (hort, that (he might fatisfy her- felf in this particular, and promifed to detain him no longer than Giaga (hould think neceflary. Giaga thought there could be no danger in contenting to a {hort interview; and therefore fent the unfortunate ag prince to her, attended by a magnificent retinue. The She tnixr- cruel queen no fooner got him in her power, than (he dersherne-murdered him with her own hand, andcaufedhis body phew. to be thrown into the Coanza, ridding herfelf, by that inhuman a&, of a dangerous rival, as well as reveng¬ ing herfelf on her brother, as (he had fworn to do, for the murder of her fon",,AO,3,Angola,Africa
"With this combined force (he attacked the Portuguefe fo fuddenly and unexpeftedly, that (lie gained fome advantages over them ; and the Dutch made them¬ felves mailers of San Paulo de Loando, and foon after of fome of the bed provinces in the kingdom. This happened in the year 1641 ; and the Portuguefe did not- recover thefe places till the year 1648, when the 30> Dutch were entirely driven out of Angola",,"NL,AO",3,"Netherlands,Angola","Europe,Africa"
"mod dreadful dangers, and to engage in the mod def- perate enterprizes. She now made many drenuous and daring efforts to drive out the Portuguefe ; but though (he had, in all probability, more valour and (kill than her enemies, the fire-arms gave them fuch an advantage, that (he was always defeated with great lofs. Per¬ ceiving therefore the folly of attempts of this kind, (Ire contented herfelf with making continual inroads into their country', carrying off or dedroying every thing that fell in her way. Though* (he (pared nei-Her’terriblie‘ ther Europeans, nor blacks, who were fubje&s of theravages- mock-monarchs fet up by the Portnguefe, yet the cafe of the former was peculiarly dreadful w-hen they hap¬ pened to be taken prifoners. They w'ere either roaded B 2 by A N G [ i: Angola, a {]ow {jre> or their flefli cut off in pieces, and devoured before their faces, in the manner related by * See Abyf- yir Bruce of the Abyffinian oxen *. In this manner J‘ma' Ihe infefted the Portugucfe territories for 28 years, fcarce ever allowing them a moment’s ceffation of arms",,AO,3,Angola,Africa
"Zingha ftaid lip longer in the province whither fhe had retired, tlijh|?. till fhe was affured that the Portu¬ guefe were retried from the Coanza ; and then, croffing that river once more, marched dire&ly towards the kingdom of Metamba, which had been invaded by lome of the neighbouring princes. The fpeed with which fhe led her forces thither, and recruited her army with multitudes of Giagas, who were all emulous of 37. fighting under her banner, quickly enabled her to re- Hercompli-cover fome of her territories in that kingdom. Begin- cated rnif- n;ng n0w to think herfelf fuccefsful, file again attacked tortunes. tjje Portuguefe ; but was defeated with great lofs, fo as to be obliged to fend for frefh troOps. To complete her misfortune, fhe received news that the Giaga Caf- L ] A N G fangi had taken the advantage of her abfence, to en-. Angola, ter the kingdom of Metamba with a numerous army, had carried off the greateft part of the inhabitants, de- ftroyed ail the ftuits of the earth, plundered the towns of all that was valuable, and fet fire to the reft, lea¬ ving that kingdom in a manner defolate. To add to all this, her troops, exafperated at the lofs of their wives, children, and goods, which were carried to the fartheft corner of Benguela, were all on the point of revolting. 38",Benguela,AO,3,Angola,Africa
"Borgia, vainly imagining that he had now obtained enough, fet off immediately for Loanda San Paulo ; but left the prieft, on fome pretence or other, to fee whether, in the time of fickuefs, he could make any A N G [ : Angola, impreffion on the inflexible mind of Zingha, who now W—laboured under a lingering difeafe. Coglio, however, found all his arts to no purpofe ; and, upon the queen’s recovery, flie recommenced the war with more fury than Zingha’s For fotne time hoftilities were carried on with va- narrow e- nous fuccefs ; Zingha being fometimes vi&orious and fcape. fometimes defeated. In one attempt of the latter kind, before the fortrefs of Maflangana, fhe not only loft a great number of men, but had her two' lifters Cambi and Fungi taken prifoners, Ihe herfelf efcaping with the utmoft difficulty. Exafperated by this lofs, fhe led her troops into fome of the beft provinces of the Portu- guefe, and reduced them to a mere wildernefs. Still, however, Ihe had the mortification to find her Ioffes vaftly greater than what fhe gained; and had now the additional misfortune of lofing her After Fungi, who was put to death by the Portugugfe for treachery, and feeing her allies the Dutch totally expelled out of An- 41 gola",,"AO,NL",3,"Angola,Netherlands","Africa,Europe"
"The viceroy, being now afraid that Zingha might make an alliance againft him with the king of Congo, firft raifed a powerful army, and then acquainted that monarch, that, if he defigned to prevent the total ruin of his dominions, he muft immediately make repara¬ tion for all the damage he had caufed to the Portuguefe by his alliance with the Dutch. The fame of the Por¬ tuguefe valour fo intimidated the king, that he fubmit- ted to a treaty almoft on the viceroy’s own terms; and as foon as this treaty was concluded, Don Ruy Pegado, an old experienced officer, \yas difpatched to Zingha, offering a firm and lafting alliance with her, provided fire renounced the Giagan fedt, and returned to the bo- fom of the church. To this embaffy fhe returned the old anfwer, namely, that the Portuguefe themfelves had been the occafion of all that had happened; as they had not only ftripped her of her hereditary dominions, but dared to proclaim one of her vafials king of Angola ; but, provided thefe dominions were reftored, fhe would immediately embrace Chriftianity.",,"AO,NL",3,"Angola,Netherlands","Africa,Europe"
"'3 } A N G All this time the furious Queen Zingha went on with Angola, her ravages, notwithftanding the viceroy kept plying —v—-J her with letters for near three years. At laft he had 43 ■ recourfe to the artifice of taking advantage of the re-Thcir infa* morfe for her crimes with which Zingha was fometimes du(ci.< affedted, in order to procure the peaceable enjoyment of his own ill-gotten conquefts",,AO,3,Angola,Africa
"The Portuguefe now imagining they would .at laft gain their point, propofed to her the following terms, as the bafis of a lafting treaty between the two nations. 4s 1. “ That they fhould yield to her, as a prefent, fome The Portu- of the countries of which they had already robbed her.guel’eterm31 2. That, in confideration of the faid prefent, which fhould in noways be interpreted as an invefliture, the queen fhould pay yearly a certain acknowledgement to the A N G [ H ] A N G Angola, the king of Portugal, who fiiould be at liberty to with- draw t.he faid prefent whenever the failed of making the faid acknowledgement. 3. That a free commerce fhould be opened between thofe two ftates, as well for (laves as for other merchandizes. 4. That the queen fhould moled none of the lords that were feudatory to •the Portuguefe, whatever damages and ravages they • might have committed during the late wars between them. 5. That fhe fhould reftore all the Portuguefe flaves that had taken refuge in her dominions. 6. That (he (hould deliver up the Giaga Colanda, who had re¬ volted from the Portuguefe, upon condition that his crime fhould go unpunifhed.” The queen, having now a thorough view of the deep- rooted villany of thofe with whom fhe had to do, con¬ ceived fuch difpleafure againft the Portuguefe, that fhe •fell fick. During this fickr.efs, father Anthony, her chief confident, and a creature of the viceroy, never left off foliciting her to make her peace with God, and to accept of the terms offered her by the Portuguefe : but Zingha, though worn out with age and ficknefs, had dill the’good fenfe to perceive, that there was no connection between making her peace with God and complying with fuch infamous terms; and therefore gave the following anfwer, which, under fuch circum- 47 dances, (hows a magnanimity fcarce equalled in any Thequeen’sage or in any country, f. “ That as to her conver- fwer6 ^ ^10n’ 33 ^ WaS ne‘t^er ovv’ng to any defire of obtaining 'iwer’ a peace, or other worldly motives, but the Divine Grace by which fhe was recalled, fhe was refolved to perfevere in it to her lad breath. 2. That as to her going over to the Giagan fed, fhe had in a great mea- fure been forced to it by the Portuguefe viceroy",Wa,"AO,PT,GH",3,"Angola,Portugal,Ghana","Africa,Europe,Africa"
"The father having finifhed the mafs, read the letter at the altar in the Portuguefe language; and the fecretary interpreted it in that of the country. The queen, who had flood all the while it was reading, went towards the A N G [ Angola, the altar, and on her knees received it from the fa- V— ther : and having kifled it, and fvvorn afrefh upon the 53 gofpel to continue in obedience to the church of Rome, Ceremoniest]ie ietter agra;nj. pUt it into the purfe, and re- aIeteterfr!Mnturne^ t0 Pa^ace amidft the (houts and acclamations the Pope. many thoufands of her fubjefts. On that day fhe gave a magnificent treat to the Portuguefe refident, and to all her court, in two great porticos, and file herfelf vouchfafed to eat after the European manner ; that is, fitting on a fiately elbow chair, with a high table be¬ fore her, covered with the fined linen, and with difiies, plates, knives, and forks, all of filver gilt. She be¬ llowed fome largefles upon her chief officers, releafed a good number of flaves, and at night appeared at the head of her ladies of honour, both Ihe and they drefled in the Amazonian manner. They performed a kind of combat, in which the queen, though upwards of eighty years of age, behaved with the great vigour and a£ti- 54 vity of a woman of thirty",Rome,"AO,US",3,"Angola,United States","Africa,North America"
