Entry,City,Country code,Edition,Country,Continent
"The inferior portion of the external nofe is compofed of feveral cartilages, which are commonly five in num¬ ber, and of a pretty regular figure. The reft are only additional, fmaller, more irregular, and the number of them more uncertain. Of the five ordinary cartilages, one is fituated in the middle, the other four laterally",Of,TR,1,Turkey,Asia
"The external ear is fixed to the cranium, not only by the cartilaginous portion of the' meatus auditorius, but alfo by ligaments, which are two ih number, one anterior, the other pefterior. The anterior ligament is fixed by one extremity to the root of the apophyfis zygomatlca of the es temporis, at the anterior and a little toward the fuperior part of the meatus clTeiis, clofe to the cor¬ ner of the glenoid cavity; and by the other extremity, to the anterior and faperior pan of the cattilaginous me- The pofiericr ligament is fixed by one end to the root of the maftoid apophyfis, and by the other to the pofte'rior part of the convexity of the concha,, fo that it is oppofite to the anterior ligament. , Of the mufcles of the external ear, fame go between the cartilages and the os temporis, others are confined to the cat tilages alone. Both kinds vary in different fub- jefts, and are foiuetimes fo very thin, as to Icok more like ligaments than mufcles. The mufcles of the firft kind are generally three in number, one fuperior, cr.e pofterior, and ere anterior. T he fuperior mufcle is fix¬ ed in the convexity ef the foffii navicularis, and of the fnperior portion of the concha; from whence it tuns up to the fejuamoas portion of the ps temporis, expanding in a. radiated manner, and is inferred principally in the Jigamentary apOneUrofis, which covers the poftetior poi- tion of the temporal rnufele",Of,TR,1,Turkey,Asia
"Both of them are clofely joined to the fpindle, being thicker there than in any other place. Tire common feptum is complete, and feparates the turns entirely from each other; whereas the half-feptum in the llceleton is only a fpiral lami'na, the breadth of which is terminated all round by a very thin border lying in the middle cavity of the cochlea. In the natural ftate, there is a membra¬ nous half-feptum, which completes the partition between the two dufts",Tire,TR,1,Turkey,Asia
"The two upper parts or quarters are bony; and of thefe the innermoft is formed by the fide of the apophy-: fis petrofa, the outermoft by the fide of the apophyfis fpinalis of the os fphenoides, fo that the upper half of this portion of the tube is bony. Of the two inferior parts, the internal is cartilaginous, and the external mem¬ branous ; fo that the lower half of this portion of the tube is partly cartilaginous next the os fphenoidale, and part¬ ly membranous next the apophyfis petrofa",Of,TR,1,Turkey,Asia
"ANDANAGAR, a town of the peninfula in India, on this fide the Ganges, in the kingdom of Decan",,IN,1,India,Asia
"ANDRACHNE, in botany, 4 genus of the monoecia gynandiia clafs. The calix of the male confifts of live leaves ; the corolla has five petals; and the ftami- na, which are alfo five in number, are inferred into ) AND the ftylus. The calix of the female is divided into five leaves; it has no corolla; the ftyli are. three'; the capfule is trilocular, c#.itaining two feeds. There are only two fpecies of the andrachne,' viz. the telephe- oides, a native of Italy; and the fruticofa, a native of China",,"IT,CN",1,"Italy,China","Europe,Asia"
"ANGAMALA, a fmall city of India, fituated upon the river Aicotta, on the Malabar coaft",,IN,1,India,Asia
"ANIMACHA, a river of India, in the kingdom of Ma¬ labar. It rifes in the kingdom of Calicut, and falls into the ocean fix leagues from Cranganor. It is alfo the name of a town upon the river",,IN,1,India,Asia
"ANINGA, in commerce, a root which grows in the An¬ tilles ifilands, and is pretty much like the China plant",,CN,1,China,Asia
"ANNUNClADA, Annuntiada, or Annuntiata, an order of knighthood in Savoy, firft inftituted by Amadeus I. in the year 1409 ; their collar was of 15 links, interwoven one with another, in form of a true lover’s knot, and the motto, F. E. R. T-. fignifying, Fortitude ejus Rkodutn tenuit. Amadeus VIII. gave the name Annunciada to this order, which was. for¬ merly known by that of ths knot of love, changing at the fame time the image of St Maurice patron of Savoy, which hung at the collar, for that of the Vir¬ gin Mary, and, inftead of the motto above-mentioned, fubfiituting the words of the angel’s falutation",Mary,TM,1,Turkmenistan,Asia
"Anta, in geopraphy, a little city with a* harbour, on the coaft of Guinea in Africa",Anta,"GN,IN",1,"Guinea,India","Africa,Asia"
"ANTEAMBULONES, in Roman antiquity, fervar.ts who went before perfons of diftindion to clear the way before them. They ufed this formula. Date lo¬ cum domino meo, i. e. Make room, or way, for my mafter","Roman, Date","RO,JP",1,"Romania,Japan","Europe,Asia"
"ANTHOXANTHUM, in botany, a genus of the dian- dria digynia clafs. The calix is abivalved gluma, with one flower; the corolla is bivalved,. obtufe, and with¬ out any awn. There are three fpecies of antboxan- thum, viz. the odoratum, or fpring-grafs, a native of Britain; the indicum, a native of India; and the pa- nicula'tum, a native of the fouthern parts of Europe",,IN,1,India,Asia
"ANTICUS, a term ufed by anatomifts, importing, that the part; with which it is joined Hands before fome others : Thus, we meet with ferratus amicus, pero- nceus amicus. - ANTIDESMA, in botany, a genus of the dioecia pen- tandria clafs. The ca-lix of the male confifts of 5 leaves ; it has no corolla : The calix of the female is entire, gaping a little on one fide ; it has no corolla, but two ttyii, and, a double valved capfule inclofed in the calix. There is but one fpscies of the antidefma, viz. - the alexeteria, a native of India",,IN,1,India,Asia
"ANTIMONY, in natural hiHory, one cf the femi-me- tals. See Chemistry, title, Of metals",Of,TR,1,Turkey,Asia
"ANTIOCH, a town of Syria, formerly its capital, but now in a ruinous condition ; fituated on the river. Oron- tes, in 370 E. long, and 36° N. lat",,SY,1,Syrian Arab Republic,Asia
"ANZUGUI, a town in the ifland of Japan, upon the bay of Mecao",,JP,1,Japan,Asia
"APAMEA, or Hama, a town of Syria, fituated on the river Orontes, in 38° 30/ E. long, and 340 N. lat",,SY,1,Syrian Arab Republic,Asia
"Aqua forth, a corrofive liquor, made by difiilling puri¬ fied nitre with calcined vitriol, or redified oil of vi¬ triol, in a ftrong heat; the liquor, which rifes in fumes red as blood, being col left ed; is the fpirit of nitre or aqua fonts; which ferves as a menftruurn for diflbl- ving of filver, and all other metals, except gold. But if fea-falt, or fal ammoniac bo added to aqua fortis, it commences aqua regia. Aqua fortis is commonly held to have been invented about the year 1300; though others will have it to have been known in the time of Mofes. It is ferviceable to refiners, in feparating filver from gold and copper: to the workers in mofaic, for ftaining and colouring their woods ; to dyers, in their colours, particularly fcarlet; and to other artifis, for colouring bone and ivory. With aqua fortis book¬ binders marble the covers of books, and diamond- cutters feparate diamonds from metalline powders It is aHb ufed in etching copper or brafs plates. See Chemistry, Of the nitrous acid",Of,TR,1,Turkey,Asia
"Aqjua regia, an acid corrofive fpirit, fo called, bacaufc it ferves as a menftruum to difiblvc gold, common¬ ly efteemed the king of metals. Its bafis, or efien- tiak ingredient, is common fea-falt, the only fait in nature which will operate-on gold. It is commonly prepared by mixing common fea-falt, or fal ammoniac, or the fpirit of them, with fpirit of nitre., or common aquafortis. See Chemistry, title. Of aqua regia",Of,TR,1,Turkey,Asia
"ARABIA, a large country of Afia, having Turky on the north, Perfia and the gulf of Perfia on the eaft, the Indian ocean on the fouth, and the Red fea and ifthmus of Suez on the weft; and fituated between 350 and 6o° E. long, and between 120 and 30° N. lat",Suez,"EG,IN",1,"Egypt,India","Africa,Asia"
"ARABISM, in language, an idiom peculiar to the Ara¬ bian language",Ara,IN,1,India,Asia
"ARACK, Arrack, or Rack, a fpirituous liquor im¬ ported from the E. Indies, ufed by way of dram and in punch. The word arack is an Indian name for ftrong waters of all kinds; for they call our fpirits and brandy Englijh arack. But what we underftand by the name arack, is really no other than a fpirit procu¬ red by diftillation from a vegetable juice called toddy, which flows by incifion out of the cocoa-nut tree",,IN,1,India,Asia
"There are divers kinds of it; Angle, double, and tre¬ ble diftilled. The double ciiftilled is commonly fent abroad, and is preferred to all other aracks of India",,IN,1,India,Asia
"ARAFAT, a mountain of Arabia, near Mecca, where the Mahometans believe that Abraham offered to fa- crifice Iflimael",Mecca,SA,1,Saudi Arabia,Asia
"24. The fexpundata, has an oblong belly, and three pair of hollow points. It lives in woods, 25. The flaviflima, has a fmooth oblong belly of a very yellow colour. It is a native of Egypt. 26. The bimaculata, has a ehefnut-coloured roundifh belly, with two white- points. 27. The clavipes, has an oblong belly,, and the laft joints of the legs, excepting the third pair, are hairy and clavated. It is a native of America. 28. The quadripundata, has a black oblong belly, and four hoh- A R A C 344 ) ARB low points. -It is to bo met with in -windows, 29. The holofericea, has an ovallifh belly cpvered with a down like velvet; at the bafe, or under part, it has two yellow Ipots. It is found in the folded leaves of plants. 30. The fenoculata, is difHnguilhed from the reft by having only fix eyes. 31. The avicularia, has a convex round bread, hollowed tranfverfely in the middle. It is a native of America, and feeds upon Fmall birds, infe&s, 6""c. The bite of this fpider is as venomous as that of the ferpent. 32. The fpinimobilis, has moveable black fpines on its legs.. It is a native of Surinam. 33. The venatoria, is a hairy fpider, with a round convex breaft, about the fame fize with the belly, which is oval. It is a native of America. 34. The ocellata, has three pair of eyes on its thighs. It is a- bout the fame fize with the tarantula, of a pale colour, with a black ring round the belly, and two large black fpots on the fides of the breaft. It is a native of China",,"EG,CN",1,"Egypt,China","Africa,Asia"
"35. The tarantula, PlateXXIII. fig. 10. The breaft (1), and belly (2), are of an alh-colour; the legs (3) are likewife aftircolourcd, with blackiih rings on the under part; the fangs, or nippers (4), are red on the inner fide, the reft being blackilh; (5) is the antennse or feel¬ ers : Two of its eyes are larger than the other, red, and placed in the front; four other eyes are placed in a tranf- verfe dir eft ion towards the mouth ; the other two are nearer the back. It is a native of Italy, Cyprus, Bar¬ bary, and the E. Indies. The breaft and belly are a- bout two inches long, terminated by two ftiort tails. This figure was taken from the life, in the ifland of Cyprus, by Alexr Drummond, Efq; late conful at Aleppo. The bite of the tarantula is faid to occafion an inflammation in the part, which in a few hours brings on ficknefs, faint¬ ing, and difficulty of breathing : The perfon afterwards is affefted with a delirium, putting himfelf into the moft extravagant poftures. However, this is not always the cafe; for they are fometimes feized with a deep melan¬ choly. The fame fyroptoms return annually, in fome cafes, for feveral years, and at laft terminate in death","Bar, Aleppo","CY,IT,UA,SY",1,"Cyprus,Italy,Ukraine,Syrian Arab Republic","Asia,Europe,Europe,Asia"
"ARCHETYPE, the firft model of a work, which is co¬ pied after to make another like it. Among minters, it is ufed for the ftandard weight by which the others are adjufted. The archetypal world, among Plato- A R C H I T A RCHITECTURE, or the art of building, ought JiA to be confidered in a twofold light, as an object of tafle, and as a mechanical art. An examination of its principles improves our tafle; the practical part contains SEC OF ARCHITECTURE AS T^/TAny ages muff have elapfed before architenure ^ -*• came to be confidered as a fine ait. Utility was its original deflination, and nill continues to be its prin¬ cipal end. Experience, however, has taught us, that tirchitedure is capable of exciting a variety of agreeable feelings. Of thefe, utility, grandeur, regularity, or¬ der, and proportion, are the chief",Of,TR,1,Turkey,Asia
"With refpedt to buildings of every kind, one rule, ditfhted by utility, is, that they be firm and liable. An- S E C OF ARCHITECTURE AS Of the Origin o/’Buildings",Of,TR,1,Turkey,Asia
Of 35r architecture,Of,TR,1,Turkey,Asia
"Of the Farts that compofe an Order, and their Ornament*, The parts that compofe an ordef may be diftributed into two different claffes. In the firji may be ranged all that have^any analogy to the primitive huts, and re- prefent i'ome part that was neceffary in their conftiudion",Of,TR,1,Turkey,Asia
Of the Orders of Architecture,Of,TR,1,Turkey,Asia
"ent parts of buildings with reprefentations of the human body. Thus the ancients adorned their temples, baths, theatres* with llatues of their deities, heroes, and legiflators. The moderns Hill preferve the fame cuftom, placing in their churches, palaces, &c. flames of illu- ftrious perfons, and even groups compofed of various fi¬ gures, reprefenting occurrences coile&ed from hitrory, fables, 61c. Sometimes thefe flames or groups are de¬ tached, raifed on pedeftals, and placed contiguous to the walls of a building, or in the middle of a room, court, or public fquare. But they are moft frequently placed in cavities made in the walls, called niches. Of thefe there are two forts; the one formed like an arch in its elevation, and femicircuiar or femielliptieal in its plan; the other is a parallelogram both in its plan and ele¬ vation",Of,TR,1,Turkey,Asia
"There are many kinds of flair-cafes ; for in fome the fleps are made flraight; in others, winding; in others mixt of both. Of ftraight flairs, fome fly dire&ly forward; Others are fquare; others triangular. Others are called French flights, or winding-flairs, (which in general are called fpiral or cockle-flairs); of which fome are fquare; fome circular, or round; and fome elliptical, or oval; and thefe again are various; for fome wind about a fo- lid, others about an open newel. Stairs mixt of llraight and winding Heps are alfo of various kinds; fome are called dog-legged; fome there are that wind about a folid newel ; and others that fly about a fquare open newel",Of,"TR,FR",1,"Turkey,France","Asia,Europe"
"v/inters in Lithuania, Padolia : Trans Pontum fugat et terris immittit apricis. Virg. This bird com¬ monly reds upon' one foot. 5. The americana, or hooping crane of Edwards, is a native of America: The crown of the head and temples are naked and papilious; the forehead, nape of the neck, and prime wing- A II D ( 3<S3 ) ARE ■ring-feathers are' black; but the body is white: The under part of the head, as far as the lower chap, is red ; the beak is yeilowilh, and jagged at the point; the feet are red, and the prime tail-feathers white. 6. The An¬ tigone, or greareit Indian crane of Edwards, has a na¬ ked head, and papilious collar ; the body is a(h-coloured, and the prime wing-feathers .black. Behind the eyes, there is a ftnall white fpot, and the crown of the head is alfo white. The breafl: is of a greenilh yellow co¬ lour; the feet are red. and the prime tail-feathers alh- coloured. It is a native of Alia. 7. The dconia, or white ftork of Ray, has naked eye-balls, and black prime wing-feathers. The Ikin below the feathers, as alfo the beak, feet, and claws, are of a blood-colour",,"LT,IN",1,"Lithuania,India","Europe,Asia"
"breaft fpeckled with oblong black fpots. It is a native of America. 16. The.viofacea has a white creft; the body is variegated with black and white, and bluifh be¬ low. It is a native of America.. 17. The cserulea has a creft behind,, and a bluifh body. It is a native of N. America. 18. The hudfonias has a black creft on the top of the head; the body' is dufky-coloured, and white below. It frequents HndfonV Bay. 19. The ftriata has a fmall creft on the back-part of the head ; the back is of. a.hoary grey colour, and afh-coloured be¬ low ; the long wing feathers are tipped with white. It is a native of Surinam. 20. The virefeens has a fmali creft on the back part of the head, a green Ihining back, and dufky-coloured breaft. It is a native of America, 21. The ftellaris, or bittern, has a fmooth head ; it is variegated through the whole body with dark-co¬ loured fpots of different figures and fizes. It is a na live of Europe, and inhabits chiefly the fen-countries",Bay,PH,1,Philippines,Asia
"It is a native of Europe. 25. Tire acquinoftialis has a fmooth head, , and a white body. It is a native of America. 26. The minuta has a fmooth head,, a dark-coloured body, and a yellowifh belly. It is about the fize of the turdus, and is a native of. Switzerland and the Eaft; ARDENBURG, a fortified town of Dutch Flanders,, lituated about 12 miles N. E. of Bruges, m30 20' E. long, and ;i° 15' N. lat",Tire,"CH,TR",1,"Switzerland,Turkey","Europe,Asia"
"There is only one fpecies, viz. the cathecu, a native . of India",,IN,1,India,Asia
"See Astronomy, Of the fixed Jiars",Of,TR,1,Turkey,Asia
"ARISI, the Indian name for the plant which produces the rice. SccOrysa",,IN,1,India,Asia
"A w unit, or unity, is that number by which any thing is called one of its kind. It is the firft number; and if to it be added another unit, we fttall have another num¬ ber called two; and if to this laft another unit be add¬ ed, we {hall have another number called three ; and thus, by the continual addition of an unit, therewill a- rife an infinite increafe of numbers. On the otherhand, if from unity any part be fubtraCled, and again from that part another part be taken away, and this Be done continually, we {hall have an infinite decreafe of num¬ bers. But though number, with-relpeCl: to increafe-and decreafe, be infinite, and knows no limits ; yet ten fi¬ gures, varioufly combined or repeated, are found fuffi- dent to exp refs any number, whatfoever. Theft,, with the method of notation by them, were originally invent¬ ed by fome of the eaftern nations, probably the Indians; afterwards improved by the Arabians; and at laft brought over to Europe, particularly into Britain, betwixt the tenth and twelfth century. From the ten fingers of the hands, on which it hath been ufual to compute num¬ bers, figures were called digiti. Their form, order, and value, are as follows : 1 One, an unit, or unity, 2lvtwo, 3 three, 4 four, j five, 6 fix, 7 feven, 8 eight, 9 nine, o cipher, nought, null, or nothing. Of theft, the firft nine, in contradi- ftinCtion to the cipher, are ca\\ed. Jignificant figures",Of,TR,1,Turkey,Asia
"pence byway of fradMon, as in the mar- 74 18 n|",Mon,IN,1,India,Asia
2. What fradtion of a C. is of a pound ? T 18. is -J- Of vy - = yyyC,Of,TR,1,Turkey,Asia
"Of infinite or interminate decimals, there are two forts. For fome conftantly repeat the fame figure; and are called repeating decimals, repeaters, or fingle repe- tends. Others repeat a circle of figures ; and on that account are called circulating decimals, circulates, or compound repetends",Of,TR,1,Turkey,Asia
"C an integer, A mixt number may multiply or divide -< a mixt number, Ca pure decimal, C an integer, A pure decimal may multiply or divide < a mixt number, Ca pore decimal, ■ Of thefe.varieties, the firft belongs' properly to vulgar arithmetic, the other eight occur in decimal operations",Of,TR,1,Turkey,Asia
"The reafon of Rule 1. is plain. For if in Ex. 1. we make the longeft fadtor the multiplier, and the total produdt will be the fame either way, it is'obvious,••that in this cafe we (hall have fix part(:ular produdts, in each Of which the right-hand figure will be uncertain, and 5 K confequently 4o6 A II I T H M confequentjy we ftiail have fix uncertain places in the to¬ tal product toward the right, and alfo one uncertain place more on account of the uncertain carriage from the co¬ lumn in which the right-hand figure of the lalt particular product Hands",Of,TR,1,Turkey,Asia
"The wood whereof the ark was built, is called in the Hebrew Gopher-wood, and in the Septuagint fqxare timbers. Some tranflate Ahe original cedar, others pine, others'* ARK (42 others lox. See. Pelletier .prefers cedar, on account of its incorruptibility, and the great plenty of it in Alia; whence Herodotus and Theophraftus relate, that the kings of Egypt and Syria built whole fleets thereof, inftead of deal",,"EG,SY",1,"Egypt,Syrian Arab Republic","Africa,Asia"
"ARMENIANS, in church-hidory, a fedl among the eadern Chridians ; thus called from Armenia, the country anciently inhabit*! by them. There are two ",,AM,1,Armenia,Asia
"Arras, or Araxes, is alfo the name of a river of Georgia, which difeharges itfelf into the Cafpian fea",Arras,"GE,FR",1,"Georgia,France","Asia,Europe"
"ARSCHIN, in commerce, a long meafure ufed in China to meafure fluffs. Four arfehins make three yards of London; ARSCHOT, a town of the Auftrian Netherlands,’ fi¬ tuated about fourteen miles eaft of the city of Mech¬ lin, in 40 45' E. long, and f N. lat",London,"CN,GB",1,"China,United Kingdom","Asia,Europe"
"The lumbricoides is the worm which is moft commcn - ly found in the human inteftines. For the method of expelling thefe two kinds of infedts, fee Medicine, Of 'worms",Of,TR,1,Turkey,Asia
"They have one fort of religion in China, and another in India, whofe priefts aie the Brachmins; not to mention the 7ews> Chriftians, and Mahometans, whofe beginnings are fufficiently known to all the world. This was the feat of feveral ancient empires or monarchies; fuch as that of the Aflyrians, Medes, Perfians, and Greeks.. It is 4740 miles in length from the Dardanels on the W. to the eaftern fhore of Tartary ; and 4380 in breadth from the moft fouthern part of Malacca, to the moft northern cape of Nova Zembla. It may be divided into ten great parts, namely, Turky in Afia, Arabia, Perfia, the Mogul’s empire, with the two peninfulas of India, Thibet, China, and Corea; Great and Little Bocharia, with Carazm, Little and Great Tartary, Siberia, and the Iflands. The governments of Afia are generally mo¬ narchical ; and Turky, Ptrfia, the Mogul’s Empire, Thibet, and China, are fubjedt to fingle monarchs; but the reft is divided among feveral fovereigns ; info- much that there are reckoned feven emperors, and 30 kings, befides petty princes, and the rajas of India, which are very numerous. With regard to the extent of their religions, the Chriftian is but finall in refpedt of the Mahometan, which comprehends one third of Afia; and the Pagan is near twice as much extended as the Mahometan. Befide thefe, fome pretend there is the natural religion, which has about as many fol¬ lowers as the Chriftian. The languages are fo many and fo various, that it is impoflible to enumerate them ^ but the chief are the Turkifh, the Grecian, the Ara¬ bic, the Chinefe, the Perfian, and the Old Indian","Malacca, Ara","IN,CN,MY",1,"India,China,Malaysia","Asia,Asia,Asia"
"ASMER, a province of India, on this fide the Ganges",,IN,1,India,Asia
"Of this feries of fofiils, there are only five bodies, each of which makes a diftinft genus; and thefe bo¬ dies are antimony, bifmuth, cobalt, zinc, or quickfil- ver. See Chemistry",Of,TR,1,Turkey,Asia
"ASTRONOMICALS, a name fometimes given to fex- agefimal fractions. See Arithmetic, Of fexagefi- v.als",Of,TR,1,Turkey,Asia
Chap. II. Of the Solar System,Of,TR,1,Turkey,Asia
". Part of the paths of three comets are delineated in the fcheme of the folar fyftem, and the years marked in which they made their appearance. It is believed that la?^r <y' ■.»V ASTRO that there are at leafl 21'comets belonging to ourfyftem, moving in all forts of dire&ions ; and all thofe which have j been obferved, have moved through the etherial regions and the orbits of the planets without fuffering the lead fenfible refiftance in their motions; which plainly proves that the planets do not move in folid orbs. Of all the comets, the periods of the above mentioned three only are known with^any degree of certainty. The firft of thefe comets appeared in the years 1531, 1607, and 1682; was expeded to appear again in the year 1758, and every 75th year afterwards. The fecond of them appeared in 1532 and 1661, and maybe expected to re¬ turn in 1789, and every 129th year afterwards. The third, having laft appeared in 1680, and its period being no lefs than 575 years, cannot return until the year 2225",Of,TR,1,Turkey,Asia
"The orbits of all the planets are ellipfes, very little different from circles; but the orbits of the comets are very long ellipfes, and the lower focus'of them all is in the fun. If we fuppofe the mean diftance (br middle between the greateft and leaft) of every planet and co¬ met from the fun to be divided into 1000 equal parts, the excentricities of their orbits, both in fuch parts and in Englilh miles, will be as follow. Mercury’s 210 parts, or 6,720,000 miles; Venus’s, 7 parts, or 413,000 miles; the earth’s, 17 parts, or 1,377,000 miles; Mars’s, 93 parts, or 11,439,000 miles; Jupiter’s, 48 parts, or 20,352.000 miles; Saturn’s, 55 parts, or 42,735,000 miles. Of the neareft of the three Tore- mentioned comets, 1,458,000 miles; of the middle- moft, 2,025,000,000 miles; and of the outermoft, 6,600,000,000","Jupiter, Of","US,TR",1,"United States,Turkey","North America,Asia"
Chap. XI. Of the Equation of Time,Of,TR,1,Turkey,Asia
