Entry,City,Country code,Edition,Country,Continent
"ABA lament its defolation. The lamp of the fanfluary, m the time of Ahaz, was extinguifhed on the night of the 18th, for which reafon the Jews fall that day. See Astronomy, Of the divijion of time",Of,TR,1,Turkey,Asia
"' See Surgery, Of fraftures",Of,TR,1,Turkey,Asia
"ABOMASUS, Abomasum, or Abomasius, names of the fourth domach of ruminating animals. The fird domach is called venter, the fecond reticulum, the third omafus, and the fourth abonuifts. Tire third domach, omafis, is endued with the lingular quality of curdling milk. But the truth is, the domachs of aimed all animals, whether they ruminate or not, will produce the fame effedt, though, not perhaps in an e- qual degree, as the domachs of calves or lambs",Tire,TR,1,Turkey,Asia
"ABORTION, in midw'ifery, the birth of a foetus before., it. has acquired a fufficient degree of perfedtion to en¬ able it to perform refpiration and the other vital func¬ tions. See Midwife;ry, title, Of abortions",Of,TR,1,Turkey,Asia
"Abridgement, inlaw, fignifies the making a declara¬ tion or plaint Ihorter by leaving out fomething Abridgement, in arithmetic. See Arithmetic, 6/' vulgar frattions Abridgement, in algebra. See Aegebra, Of equa¬ tions",Of,TR,1,Turkey,Asia
"ABSCESS, in medicine and furgery, an impofthume, or any tumor or cavity containing purulent matter. See Surgery, Of tumours or abfcefes",Of,TR,1,Turkey,Asia
"AC AC IANS, in ecdefialHcal hilfory, the name of fe¬ veral fe&s of heretics; fonae of whom maintained, that the Son was only a fimilar, not the fame, fub- ftattce with the Father; and others, that he was not only a diftinit, but a diffimilar fublfance. Two of thefe feds had their denomination from Acacias bifhop of Ctefarta, who lived in the fourth century, and changed his opinions, fo as, at different times, to be head of both. Another was named from Acacius.patriarch of Gonftantinople, who lived in the clofe Of the fifth cen¬ tury",Of,TR,1,Turkey,Asia
"ACADEMICS, or Acabemists, a denomination gi¬ ven to the cultivators of a fpecies of philofophy oiigk* eally derived from Sornates; aid afottwaids iliuflrsied Von. I. No i. 3 ) A C A and inforoedby Plato, who taught in a grove near A- thens, confecrated to the memory of Academus an A- thenian hero; from which circumffance this philofophy received the name of academical. Before the days of Plato, philofophy had, in a great meafure, fallen into contempt. The conttadidory fyfleitis and hypothefes that had fuccellively been urged upon the world, Were become fo numerous, that, from a view of this ineon- ftancy and uncertainty of human opinions, many were led to conclude, that truth lay beyond the reach of our comprehenfion. Abfolute and univerfal feeptieifm was the natural confequeftce of this conciufion. In otder to remedy this abufe of philofophy and of the hufnan Faculties, Plato laid hold of the principles of th’e aca¬ demical philofophy, and, in his Phaedo, reafonS m the following manner: “ If we ate unable to difeover “ truth, (fays he), it mnft be owing to two circtam- “ (lances; either there is no truth in the nature df “ things, or the mind, from a defed in its powers, “ is not able to apprehend it. Upon the latter luppo- “ (ition, all the uncertainly and fiuduation in the opi- “ nions and judgments of mankind admit of an eafy “ folution: Let us therefore be model!, and afefibe “ our errors to the real weaknefs of our own rnirtds, “ and not to the nature of things tbremfelves. Truth “ is often difficult of acoefs: in order to come at ir, rt We mull proceed with camion and diffidence, care- *c fully examining every ftep ; and after all cur labdur, “ we will frequently find our greateft efforts difap- “ pointed, and be obliged to confefs Our ignorance “ and weaknefs.” Labour and caution in our refearcb.es, in oppofitioh to raffi and hafty decifions, were the diftinguifhing charac- teriftics of the difciples of the. anoient academy. A philofophcr pofTeffed of thefe principles, will be flow in his progrefs, but will fjridom fall into errors, or have occalion to alter his opinion after it is once form¬ ed. Vanity and precipitance are the great fourccs’of fcepticifm : hurried on by thefe, inftead of attending to the cool and deliberate principles recommended by the academy, feveral of our modern philofophers have plun¬ ged themfclves into ah abfurd and ridiculous kind of fcep¬ ticifm. They pretend to diferedit things that are plain, fimple, and eafily comprehended; but give peremptory and decifive judgments upon fubjetfs that evidently ex¬ ceed the limits of oor capacity. Of thefe Berkley ifnd Hume are the mod confiderable. Berkley denied the exigence of every thing, excepting his own ideas. Mr Hume has gone a (lep further, and quediohed even the CxiftenCe of ideas; but at the fame time has not htfi- tated to give determined opinions with regard to etfer- mty, providence, and a future (late, miraculous inttr- politions of the Deity, <bc. fubjedh far above the reach of our faculties. In his feffay on the academical or fceptical philofophy, he has confounded two vdry oppofite fpecies of pirilofephy. After the days :of Plato, indeed, the principles of the firfl academy weie grofsly corrupted by Arcefrlas, Carneades, &c. This might lead Mr Hume into the notion that the etcade- Tuical and fceptical philofophy were fynrouimous ternis","Plato, Plato, Plato, Of, Plato","CO,TR",1,"Colombia,Turkey","South America,Asia"
"In Germany, they have the Academy of Naturae Curioji, otherwife called the Leopoldine Academy^ founded in 1652 by Jo. Laur. Baufch a phyfician, and, in 1670, taken under the protection of the Em¬ peror Leopold. The defign of this fociety was to promote medical knowledge. They began in 1684 to publilh their obferv itions, under the title of Epheme- rides ; which publication has been continued annually, with fome interruptions, and under different titles",Laur,PH,1,Philippines,Asia
"Academy is alfo a term for fchools and other feminaries of learning among the Jews, where their rabbins and doctors inftruCted their youth in the Hebrew language, and explained to them the Talmud, and the fecrets of the Cabbala: Thofe of Tiberias and Babylon have been the moft: noted",Tiberias,IL,1,Israel,Asia
"It is a native of India. 2. The segyptius, is of an oval fhape, yellowilh colour, and a v/hite edge or margin. It is a native of the Halt. 3. The redu- vius is plain and oval, with an oval fpot at the bale",,IN,1,India,Asia
"ACCOUNTANT, or Accomptant, in the mod ge¬ neral fenfe, is a. perfon (killed in accounts. In a more redrifted fenfe, it is applied to a peifon, or officer, appointed to keep the accounts of a public company, or office, as the South-fea, the India company, the bank, the excife, be* ACCOUNTANTSHIP, the art of keeping and balan¬ cing accounts. See Book-keebing, •ACCOUNT- ACC ( 16 ) ACE ACCOUNTANT-GENERAL, a flew officer in the court of Chancery appointed by aft of parliament to receive all moneys lodged in court inftead of the ma- fters, and convey the fame to the bank of England for fecurity",,IN,1,India,Asia
"ACHAIA, a province of Turkey in Europe, now called Livadia, of which Athens was anciently the capital, at prefent named Saithinei or Setines. See Li- r VADIA",Athens,"TR,US",1,"Turkey,United States","Asia,North America"
"ACHAM, a country in the E. Indies, bounded on the N. by Bouton, on the E. by China, on the S. by A- va, and on the W. by Patan and Jefuat in Bengal",,CN,1,China,Asia
"Vol. I. No. 1. 3 ACHBALUG-MANGI, a town in the northern confines of China",,CN,1,China,Asia
"ACHILLJSA, in botany, a genus of plants belonging to the fyngenefia polygamia fuperflua clafs. Of this genus there are 21 fpecies, only two of which are natives of Britain, viz. the achilkea millefolium, or common yarrow, (fee Plate II. fig. 1.) and the achillaea ptar- mica, or fneezewort",Of,TR,1,Turkey,Asia
"ACIDS, fubftances which give a four, fharp, or tart tafte. Among the chemilis, the acid falls are dilfin- guifned into the nitrous, vitriolic, muriatic, and vege¬ table. See Chemistry, title. Of acids",Of,TR,1,Turkey,Asia
"ACRE, or Acra, a fea-port town in Syria. It was formerly called Ptolemais, and is a biihop’s fee. It was very famous in the time of the crufadoes, and un¬ derwent feveral lieges both by the Chrilbans and Sara¬ cens. It is now an inconfiderable town, being entire¬ ly fupported by its harbour, which is frequented by Ihips of feveral nations. It is 20 miles S. of Tyre, and 37 N. of Jerufalem, 39. 25. E. long. 32",Tyre,"SY,LB",1,"Syrian Arab Republic,Lebanon","Asia,Asia"
"ACRIDOPHAGI, fignifies locufl-eaters. It has been much difputed whether the inhabitants of Arabia, E- thiopia, tic. ever eat locufts. We (hall give the fub- ftance of what Hafl'elquift fays on this fubjecl, who travelled in Syria and Egypt fo late as the year 1752",,"SY,EG",1,"Syrian Arab Republic,Egypt","Asia,Africa"
"This ingenious gentleman, who travelled with a view to improve natural hiftory, informs us, that he allied Franks, and many other people who had lived long in thefe countries, whether they had ever heard that the inhabitants of Arabia and Ethiopia, tic. ufed locufts as food. They anfwered that they had. He like- wife arked the fame queftion of Armenians, Cophtes, and Syrians, who lived in Arabia, and had travelled in Syria and near the Red-fea; fome of whom faid they heard of fuch a pradtice, and others that they had often feen the people eat thefe infedts. He at laft obtained complete fatisfadtion on this head from a learned Iheck at Cairo, who had lived fix years in Mecca. This gentleman toldJhim, in prefence of M","Cairo, Mecca","ET,SY,EG,SA",1,"Ethiopia,Syrian Arab Republic,Egypt,Saudi Arabia","Africa,Asia,Africa,Asia"
"le Grand, the principal French interpreter at Cairo, and others, that a famine frequently rages at Mecca when there is a fcarcity of corn in Egypt, which obli¬ ges the inhabitants to live upon coarfer food than or¬ dinary: That when corn is fcarce, the Arabians grind the locufts in hand-mills, or ftone mortars, and bale them into cakes, and ufe thefe cakes in place of bread: That he has frequently feen locufts ufed by the Arabians, even when there was no fcarcity of corn; but then they boil them, itew them, with but¬ ter, and make them into a kind of fricaflee, which he fays is not difagreeably tailed; for he hid fometimes tailed thefe locuft-fricaffees out of curiofity. From this account, we may fee the folly of that difpute a- mong divines about the nature of St John’s food in the wildernefs. Some of them fay that locufts were the fruits of certain trees, others that they were a kind of birds, tic.; but thofe who adhered to the li¬ teral meaning of the text were at leaft the molt ortho-, dox, although their arguments were perhaps not fo ftrong as they might have been, had they had an op¬ portunity of quoting fucli an author as llaffclquift.","Cairo, Mecca","EG,SA,FR",1,"Egypt,Saudi Arabia,France","Africa,Asia,Europe"
"ACRIVIOLA, in botany, a fynonime of a fpecies of tropssolum or Indian crefs. See Tropjeolum",,IN,1,India,Asia
"ACROSPIP^E, a vulgar term for What the botanifts call the plume. See Agriculture, Of vegetation",Of,TR,1,Turkey,Asia
"See Surgery, title, Of. tumours",Of,TR,1,Turkey,Asia
"ADAMBOE, in botany, a fynonime of the ipomoea cam- panulata, an Indian plant, belonging to the pentandria monogynia clafs. See Ipomoea",,IN,1,India,Asia
"ADDOU, one of the Maldivian iHands",,MV,1,Maldives,Asia
"ADEL-ODAGAM, in botany, a fynonime of the jufti- cia biyalvis. See Justicia. , ADELIA, in botany, a genus of the dioecia monadel- phia clafs. Of this genus there are three fpecies ; the bernardia, a native of America; and the ricinella and acidoton, both natives of Jamaica",Of,"JM,TR",1,"Jamaica,Turkey","North America,Asia"
"ADEN, formerly a rich and confiderable town of Ara¬ bia the Happy It is feated by the fea-fide, a lit¬ tle eaftward of the llraits of Bebelmandel",Ara,IN,1,India,Asia
"ADENANTHERA, in botany, a genus of the decan- dria monogynia clafs. There are only two fpecies of this plant, the pavonina and the faleataria, both na¬ tives of India",,IN,1,India,Asia
"ADENOS, a kind of cotton otherwife called marine cotton. It comes from Aleppo by the way of Marfeilles, where it pays 20 percent, duty, according to the tariff of the year 1766. Its valuation, according to the fame tariff, is 76 livres i6fols",Aleppo,SY,1,Syrian Arab Republic,Asia
"ADHERGAT, a town of Syria, near the frontiers of Arabia",,SY,1,Syrian Arab Republic,Asia
"ADOPTIANI, in church hiftory, a fedt/Of antient he¬ retics, followers of Felix of Urgel, and Elipand of Toledo, who, towards the end of the eighth century, advanced the notion, that Jefus Chrift, in his human nature, is the Son of God, not by nature, but by adop¬ tion","Of, Toledo","TR,US",1,"Turkey,United States","Asia,North America"
"JEGILOPS, among phyficians, a lpecies of abfeefs. See Surgery, title. Of abfeeffes, oe tumors",Of,TR,1,Turkey,Asia
"ARA, in chronology, a feries of years commencing from a certain fixed point of time, called an epoeba ; thus we fay, the Chnftian aera, that is, the number of years elapfed fince the birth of Chrift. See Astronomy, Of the divifion of time",Of,TR,1,Turkey,Asia
"the cattanum, and the pavia, both- natives of India",,IN,1,India,Asia
"Let us next examine (fays the Dean) the great “ introducers of new fchemes in philofophy, and “ fearch till we can find from what faculty of the foul "" the difpofltion arifes in mortal man, of taking it into his head to- advance new fyftems, with fuch an “ eager zeal, in things agreed on all hands impofible “ to be known; from what feeds this difpofition “ fprings, and to what quality of human nature thefe “ grand innovators have been indebted for their num- “ ber of difciples ; becaufe it is plain, that feveral of “ the chief among them-, both ancient and modern, “ were ufually miftaken by their adverfaries, and ia- “ deed by all except their own followers, to havebeen “ perfons crazed, or out of their wits; having gene- “ rally proceeded, in the common courfe of their “ words and aftions, by a method very different from “ the vulgar didates of unrefined reafon ; agreeing, “ for the niatft part, in their feveral models, with “ their prefent undoubted fucceffors in the Acade- “ my of modern Bedlam. Of this kind were Epi- “ cunts, Diogenes, Apollonius, Lucretius, Paracel- , “ fus, Des Cartes, and others; who, if they were “ now in the world, tied fall, and leparated from “ their followers, would, in this undijlinguijhing age",Of,TR,1,Turkey,Asia
"Affinity of bodies. See Chemistry, chapter. Of eieflive attradions",Of,TR,1,Turkey,Asia
"AFRICA, one of the four principal 'divifiohs of ""the; AFT ( 36 ) A G A earth ; divided from Europe on die N. by the Medi¬ terranean fca ; from America on the W. by the At¬ lantic ocean ; from the countries towards die fouth- pole, by the Great South-fea ; from the ifland of Madagafcar in the E. by the Mozambique channel ; and from Alia alfo on the E. by the Red-fea. It is alfo joined to Afia by a narrow neck of land betwixt the Mediterranean and Red-fea, called the ijihmus of Suez : Hence Africa is a peninfula fomewhat refem- bling a pyramid, whofe bafe from Tangier to the ifthmus of Suez is about 2.000 miles; its perpendicular, from the vertex at the cape of Good Hope to Buria, 3600 miles; and from cape Verd, to cape Guard a Fui, it is 3500. The'fituation of this quarter on the globe is betwixt 35. o. S. and.36. o. N. lat. and betwixt 17. 35. W. and 53. 21. E. long. Hence it lies, for the mod: part, within the- tropics ; by which means, in many places, the heat is almotl infupporta- ble. Along the coafts, it is in general reckoned abun¬ dantly fruitful, and its produce excellent. The Ro¬ mans very jultly confidered Africa as the patria fc- r a rum, for there is no other place breeds the number or the variety. In this quarter there are feveral defarts, feme of them of vait extent, covered with fand, by Which whole caravans have been fometimes fmothered","Suez, Tangier, Suez, Along","EG,MZ,MA,IN",1,"Egypt,Mozambique,Morocco,India","Africa,Africa,Africa,Asia"
"At fird there was nothing fcandalous in thofe fo- cieties, though they gave great offence afterwards, and were wholly abolijhed by tbe council of Lateran, in II39- AGARENI, a name ufed by fome writers for the A- rabs, as being defeended from Agar, or Hagar, Abra¬ ham’s hand-maid",Agar,IN,1,India,Asia
"Agar i c o-pylorus, a fynonime of the boletus verficolor",Agar,IN,1,India,Asia
"AGARICUS, in botany, a genus of the cryptogamia fun¬ gi. Of this genus there are 28 fpecies, 24 of which are AGE (3 are natives of Britain^ Several fpecies of the agaric grow upon the trunks of the larch, the oak, and other trees. It is of a fpungy fubftance, refembling the jnulhroom, and irregular in its figure and fize. This plant has of late been tried for flopping haemorrhages after amputations : but the fuccefs has not been fo re¬ markable as to bring it into general ufe",Of,TR,1,Turkey,Asia
"AGAT, is a ftone refembling the onyx in colour, but, in place of zones, is adorned with lines or fpots of various colours, which run into fo many figures, as to referable trees, flowers, fruits, herbs, <bc. Of the agat there are feveral fpecies, diflinguifhed from each other chiefly by their colour; as, the white- veined agat, the lead-coloured agat, the flefh-colour- ed agat, tec",Of,TR,1,Turkey,Asia
"AGIGENSALON, a town of Turkey, upon the road from Conltandnople to Ifpahan, about a day’s journey from the city of Tocia",,TR,1,Turkey,Asia
42 A G R I C U S e c t. II. Of the Root,Of,TR,1,Turkey,Asia
"Sect. III. Of the Trunks Stalk, or Stem",Of,TR,1,Turkey,Asia
"For example, mezereon generally flowers in January; but thefe flowers were completely formed in the month of Auguft preceeding. Of this faft any one may fatis- fy himfelf by feparating the coats of a tulip root about the beginning of September; and he will find that the two innermoft form a kind of cell, in the centre of which (lands the young flower, which is not to make its appearance till the following April or May",Of,TR,1,Turkey,Asia
Sect. IV. Of the Leaves,Of,TR,1,Turkey,Asia
Sect. V. Of the Flower,Of,TR,1,Turkey,Asia
S E c T. VI. Of the Fruit,Of,TR,1,Turkey,Asia
Sect. VII. Of the nature and motion of the Sap,Of,TR,1,Turkey,Asia
Sect. VIII. Of the Food of Plants,Of,TR,1,Turkey,Asia
"Of the various Operations upon the Soil, in order to prepare it for the Recsp-' tion and Nourijhment of Plants",Of,TR,1,Turkey,Asia
"The foils moft common in Scotland are the black loamy, the clay, the fandy, and the moffy. Of thefe there are many varieties, according to the different pro¬ portions of that particular kind of earth from which they are denominated. Some foils are even fo blended, that it is difficult to determine what kind of earth moft pre¬ vails in them",Of,TR,1,Turkey,Asia
Of the black Loamy Soil,Of,TR,1,Turkey,Asia
Of the Clay-Soil,Of,TR,1,Turkey,Asia
Of the Sandy Soil,Of,TR,1,Turkey,Asia
Of the Moffy Soil,Of,TR,1,Turkey,Asia
Sect. IV. Of the Impediments to Ve¬ getation,Of,TR,1,Turkey,Asia
i. Of the Scots Plough,Of,TR,1,Turkey,Asia
Of the Plough with the curved Mold-board,Of,TR,1,Turkey,Asia
Of the Plough with the feathered Sock,Of,TR,1,Turkey,Asia
Of the Wheeled Plough,Of,TR,1,Turkey,Asia
Of the Four-coultered Plinigh,Of,TR,1,Turkey,Asia
Of the Iron Plough,Of,TR,1,Turkey,Asia
Of yoking Cattle in Ploughs,Of,TR,1,Turkey,Asia
Of the Pofition of the Ridges,Of,TR,1,Turkey,Asia
Of ploughing in Ridges,Of,TR,1,Turkey,Asia
Of the Roller,Of,TR,1,Turkey,Asia
"When feed is fown thin, and placed at equal diftances by a drill, a lelfer quantity of it, by leaving room to fpread and branch out, will produce even a better crop than a larger quantity fown irregularly by the hand. The fad has been confirmed by repeated experiments both in our own country and in France, Sect. VI. Of the Culture of par¬ ticular Plants",Of,"FR,TR",1,"France,Turkey","Europe,Asia"
Of the Culture of Wheat,Of,TR,1,Turkey,Asia
A G R I C U Of the Culture of Rye,"Of, Rye","TR,US",1,"Turkey,United States","Asia,North America"
Of the Culture of Barley,Of,TR,1,Turkey,Asia
Of the Culture of Oats,Of,TR,1,Turkey,Asia
Of the Culture of Peafe,Of,TR,1,Turkey,Asia
Of the Culture of Beat:?,Of,TR,1,Turkey,Asia
Of the Culture of Rye-grafs,Of,TR,1,Turkey,Asia
Of the Culture of Clover,Of,TR,1,Turkey,Asia
"Of the Culture of Clover mixed with Rye-grafs, Red clover makes the beft green forage Tor cattle",Of,TR,1,Turkey,Asia
"An acre of it will maintain more cattle than three or four acres of common grafs: But then it is not fo proper for hay. Clover-hay is very troublefome in making, and is not reckoned fo good for feeding as fome other kinds of hay. It likewife hurts the land, by encouraging the grov/th of quickening:grafs. To remedy thefe difadvan¬ tages, it is common to fow rye-grafs along with it. Clo¬ ver, when mixed with rye-grafs, is eafier made into hay; the hay itfelf is much better; and the rye-grafs, by covering the furface, prevents the growth of the quickening-grafs. The quantity fown upon the acre in this way is from 8 to 12 lb. of clover, and from 1 to 3 firlots of rye-grafs. r r A G R I C U Of the Culture of St-Foin",Of,TR,1,Turkey,Asia
Of the Culture of Lucern,Of,TR,1,Turkey,Asia
"He does not give particular diredtions as to the times of horfe-hoeing; but only fays in general, that the in¬ tervals fhould be ftirred once in the month during the whole time that the lucern is in a growing ft ate. He likewife obferves, that great care ought to be taken not to fufter any weeds to grow among the plants, at leaft for the Arft two or three years; and for this purpofe, that the rows, as well as the edges of the intervals where the plough cannot go, fhould be weeded by the hand. _ Of the Culture of Potatoes",Of,TR,1,Turkey,Asia
Of the Culture of Turnips,Of,TR,1,Turkey,Asia
Of the Culture of Carrot,Of,TR,1,Turkey,Asia
A G R I C U Of4 Sowing,Of,TR,1,Turkey,Asia
"3. Tire land muft be prepared by four good plough- ings, given at different times, from the beginning of A- pril to the middle of September",Tire,TR,1,Turkey,Asia
"AGUE, axgeneral name for all kipds of periodical fe¬ vers. See Medicine, title. Of agues or intermit¬ tent s",Of,TR,1,Turkey,Asia
"Aguilar Del Campo, a town of Old Caftile, with the title of marquifate, about fifteen leagues north of the city of Burgos",Burgos,PH,1,Philippines,Asia
"AHICCYATLI, in zoology, the Indian name of a fer- pent refembling the rattle-fnake, only it wants the rattles. See Coluber",,IN,1,India,Asia
"AJAZZO, the name of two towns, the one in the ifland of Corfica; and the other in Leffer Afia, about fifty miles weft of Aleppo",Aleppo,SY,1,Syrian Arab Republic,Asia
"AJURU-ca/inga, in ornithology, the Indian name of a fpecies of the pfittacus or parrot. See PsittacuS",,IN,1,India,Asia
"AjvRU-curat/, in ornithology, the Indian name of two fpecies of Brafilian parrots, beautifully variegated with blue, green, red, yellow, and black",,IN,1,India,Asia
"ALADULIA, in geography, the moft eafterly divifion of Lefler Afia, comprehending the ancient Cappado¬ cia, and Armenia fylinor",,AM,1,Armenia,Asia
"ALATAMAHA, a large river of N. America, which, rifing in the Apalachian mountains, runs fouth-ead through the province of Georgia, and falls into the Atlantic ocean, below the town of Irederica",,GE,1,Georgia,Asia
"ALBUM, in antiquity, a kind of table, or regifter, wherein the names of certain magirtrates, public tranf- aefions, <bc. were entered. Of thefe there were va¬ rious forts; as the album fenatorum, album judicum, album prtetoris. See",Of,TR,1,Turkey,Asia
", The beglerbeg of Aleppo commands the whole ex¬ tent of country, between the Levant-fea and the Eu¬ phrates",Aleppo,SY,1,Syrian Arab Republic,Asia
C h a p. VI. Of the Involution of Qu ANTITIES,Of,TR,1,Turkey,Asia
"By comparing the given equations, you may always at length difcover an equation involving only one unknown quantity; which, if it is a fimple equation, may always be refolved by the rules of the Taft chapter. We may conclude then, that “ When there are as many fimple equations given as quantities required, thefe quantities may be difcovered by the application of the preceding rulesi” If indeed there are more quantities required than e- quations given, then the queftion is not limited to deter¬ minate quantities; but is capable of an infinite number of folutions. And, if there are more equations given than there are quantities required, it may be impoffible to find the quantities that will anfwer the conditions of the queftion ; becaufe fome of thefe conditions may be inconfiftent with, others",Taft,IR,1,"Iran, Islamic Republic of",Asia
"Thence »=5X2=iO, and Q34, and 4/A+BX4/Q^ °r /68+4/4J74X2 is nearly 7-r; again A4/Q^ or 68X 4/4=13 6X/1, that is, j=i, and ;' + or —' is nearly =4=/. Therefore ts—q, —/;=4/6, and 4/0^4/4—-'/2, whence the root to be tried is 4-/6 Chap. XIV. Of the Genesis ffwa? Resolu¬ tion of in general; and the number of Roots an Equation of any Degree may have",Of,TR,1,Turkey,Asia
"Chap. XV. Of the Signs and Coeffi¬ cients of Equal, ons",Of,TR,1,Turkey,Asia
"In quadratic equations, the two roots are either both pofitive, as in this (.v—rfX.v—b—) x2—ax+ab—o, —bx c'-Sriab+T.ac+'ibe; thatis,/>2=-5-|-2y. Anda+H-Hr^’ where there are two changes of the figns: Or they are that is, a- gain, p'—B+iq, or B—pz—2?. And fofor any other number of quantities. In general therefore, “ B the “ fum of the fquares of the roots may always be found “ by fubtra&ing, 2q from />2 ;” the quantities p and q being always known, fince they are the coefficients in the propofed equation",Anda,CN,1,China,Asia
