Entry,City,Country code,Edition,Country,Continent
Chap. XII. Of the PreceJJion of the Equinoxes,Of,TR,1,Turkey,Asia
Chaf. XV. Of the Ebbing and Flowing of the Sea,Of,TR,1,Turkey,Asia
"It being now near the folftice, this eclipfe, was vilible the very next return in 1694, in t‘ie evening; and in two periods more, which was in 1730, on the 4th of July, was feen about half eclipfed jult after fun-rife, and obferved both at Wirtemberg in Germany, and Pekin in China, foon after which it went off.",Pekin,"DE,CN,US",1,"Germany,China,United States","Europe,Asia,North America"
"The next vifible return happened on July 25th 1766, in the evening, about four digits-eclipfqd; and after two periods more, will happen on Auguft 16th 1802, early in the morning, about five digits, the centre coming from the north frozen continent, by the capes of Norway, through Tartary China and Japan, to the Ladrone ifldncTs, where it goes off",,"NO,JP",1,"Norway,Japan","Europe,Asia"
Chap. XVII. Of the fixed Stars,Of,TR,1,Turkey,Asia
"Along the middle of this zone or belt is the ecliptic, or circle which the earth defcribes annually as feen from the fun ; and which the fun appears to defcribe as feen from the earth. 2. All that region of the heavens, which is on the north fide of thd zodiac, containing twenty-one condellations. And, 3. That on the fouth fide, containing fifteen",Along,IN,1,India,Asia
"487 The Serpens Sagitta Aquila, Vullur Antinous Delphinus Equulus, Equi fetti Pegafas, Equus Andromeda Triangulum Aries Taurus Gemini Cancer Leo Coma Berenices Virgo Libra, Chelx Scorpius Sagittarius Capricornus Aquarius Pifces Cetus Orion Eridanus, Fluvius Lepus Canis major Canis minor Argo Navis Hydra Crater Corvus Centaurus Lupus Ara Corona Auflralis Eiicis Auftralis ancient Conftellations","Orion, Ara","PH,IN",1,"Philippines,India","Asia,Asia"
"The Serpent The Arrow The Eagle 7 Antinous 3 The Dolphin 0 The Horfe’s Head The Flying Horfe Andromeda The Triangle The Ram The Bull The Twins The Crab The Lion 7 Berenice’s Hair 3 The Virgin The Scales The Scorpion The Archer The Goat The Water-bearer The Fifties The Whale Orion Eridanus, the River The Hare The Great Dog The Little Dog The Ship The Hydra The Cup The Crow The Centaur The Wolf The Altar The Southern Crown The Southern Filh Ptolemy",Orion,PH,1,Philippines,Asia
"They look like dim ftars to the naked eye -; but through a telefcope they appear broad illuminated parts of the Iky ; in fome of which is one ftar, in others more.- Five of thefe are mentioned'by Ptolemy, i. One at the ex¬ tremity of the right hand of Perfeus. 2. One in thd middle of the Crab. 3. One unformed, near the fting of the Scorpion. 4. The eye of Sagittarius. 5. !One in the head of Orion. In the firft of thefe appear more ftars through the telefcope than in any of the reft, al¬ though 21 have been counted in the head of Orion, and above 40 in that of the Crab. Two are vifible in the eye of Sagittarius without a telefcope, and feveral more with it. Flamfteed obferved a cloudy ftar in the bow of Sagittarius, containing many fmall ftars ; and the ftar d above Sagittarius’s right (boulder is encompafled with feveral more. Both Caffini and Flamfteed difcovered one between the Great and Little Dog, which is very full of ftars vifible only by the teleicope. The two whitilh fpots near the fouth pole, called the Magellanic Clouds by Sailors, which to die bare eye refemble part of the Milky Way, appear through telefcopes to be a mixture of fmall clouds and ttars. But the moft re¬ markable of all the cloudy ftars is that in the middle of Orion’s Sword, where feven ftars (of which three are very clofe together) feem tolhine through a cloud, very lucid near the middle, but faint and ill defined about the edges. It looks like a gap in the (ley, through which one may fee (as it were) part of a much brighter re¬ gion. Although moft of thefe fpaces are but a few mi¬ nutes of a degree in breadth, yet, fince they are among the fixed ftars, they muft be fpaces larger than what is occupied by our folar fyftem ; and in which there feems to be a perpetual uninterrupted day among numberlefs worlds, which no human art ever can difeover","Orion, Orion, Orion",PH,1,Philippines,Asia
Chap. XVIII. Of the Divifion of Time. A ■perpetual Table of New Moons. The Times of the Birth and Death of Christ. A Table of remarkable JEras or Events,Of,TR,1,Turkey,Asia
"The Dionyfian or vulgar asra of Chrifl’s birth was a- bout the end of the year of the Julian.period 4713 ; and confequently the firft year of his age, according to that N O M Y. 493 account, was the 4714th year of the faid period. There¬ fore, if to the current year of Chrift we add 4713, the fum will be the year of the Julian period. So the year 1769 will be found to be the 64820! year Of that period",Of,TR,1,Turkey,Asia
"ASYMPTOTE, in geometry, a line which continually approaches nearer to another ; but, though;continued in¬ finitely, will never meet with it: Of thefe there are ma¬ ny kinds. In ftricknefs, however, the term afymptotes is appropriated to right lines, which approach nearer and nearer to fome curves of which they are faid to be afy?nptotes; but if they and their curve are indefinite¬ ly continued, they will never meet",Of,TR,1,Turkey,Asia
"ATHANOR, in chemiftry, a kind of fixed and large digefting furnace, made with a tower, fo contrived as to keep a Conftant moderate heat for a confiderable time, which may be increafed or diminiflied at plea- Vol. I. Numb. 2\y 3 ) A T H fure by {hutting the regifters. See Chemistry, Of furnaces",Of,TR,1,Turkey,Asia
"ATTOCK, a city on the eaftern frontiers of Perfia, capital of a province of the fame name, and fituated on the river Attock, in 720 E. long, and 330 N.lat",Attock,PK,1,Pakistan,Asia
"AVA, a kingdom of India, beyond the Ganges, fituated on the north eafl part of the bay pf Bengal, between the countries of Arracan on the north, and Pegu on the fouth",,IN,1,India,Asia
"AVAIL of marriage, in Scots law, that cafualty in ward-holding, by which the fuperior was intitled to a certain fum from his vaffal, upon his attaining the age of puberty, as the value or avail of his tocher. See Scots Law, tit. Of cafualties due to the fuperior",Of,TR,1,Turkey,Asia
"1. The fimple or particular average, which confifts in the extraordinary expences incurred for the ffiip alone, or for the merchandizes alone. Such is the lofs of an¬ chors, mafts, and rigging, occafioned by the common ac¬ cidents at fea ; the damages which happen to merchants by ftorm, prize, fhipwreck, wet, or rotting ; all which muft be born and paid by the thing which fuffered the damage. 2. The large and common average, being thofe expences incurred, and damages fuftained, for the common good and fecurity both of the merchandizes and veffels, confequently to be borne by the {hip,and cargo, and to be regulated upon the whole. Of this number are the goods or money given for the ranfom of the {hip and cargo, things thrown overboard for the fafety of the {hip, the expences of unloading for entering into a river or harbour, and the provifions and hire of the failors when the fhip is put under an embargo",Of,TR,1,Turkey,Asia
"AVERRHOA, in botany, a genus of the decandria pen- tagynia clafs. The calix has five leaves; the petals are five, open at top ; and the apple or fruit is pen¬ tagonal, and divided into five cells. The Ipecies arc three, all natives of India",,IN,1,India,Asia
"AUGUSTALIA, a fedival indituted by the Roman* in honour of Augudus Csefar, on his return to Rome, after having fettled peace in Sicily, Greece, Syria, Afia, and Parthia; on which occafion they like Wife built an altar to him, inferibed Fortur.x reduci","Roman, Rome","GR,SY,RO,US",1,"Greece,Syrian Arab Republic,Romania,United States","Europe,Asia,Europe,North America"
"AUGUSTINE, or St. Augustine, the capital town of Spanilh Florida in North America; fituated near the frontiers of Georgia, in 8u° W. long, and 30° N. lat",,GE,1,Georgia,Asia
"AUNIS, a maritime province of France, on the weft- ern fhore of the Bay of Bifcay, having the province of Poidtou on the north, and Santoigne on the fouth",Bay,"FR,PH",1,"France,Philippines","Europe,Asia"
"AURENGABAD, a large city in the province of Vi- fiapour in India, on this fide the Ganges; E. long",,IN,1,India,Asia
"AURUM, gold, in natural-hiftory. See Chemistry, Of metals",Of,TR,1,Turkey,Asia
"5, and wor/hipped by every nation. Thefe the La- AZYMITES, in church-hiftory, Chriflians who admi- called dii communes. Of *his fort were the fun, ni/ler the eucharifl with unleavened bread. This is rs, Luna, <bc",Of,TR,1,Turkey,Asia
"BABELMANDEL, a little i/land at the entr; the Red-fea, from the Indian ocean ; from win /Iraits of Babelmandel take their name",,IN,1,India,Asia
"BACCEM, or Baciaim, a feaporttown of Cambay a,"" in the Hither Peninfula of India. It belongs to the Portuguefe, and is fuuated in 730 E. long, and 19° 20' N. lat",,IN,1,India,Asia
"Along with them went cymbal-players and drummers, while they themfelves, feized with enthufiaftn, made hideous lamentations",Along,IN,1,India,Asia
"BADEN, the name of feyeral towns : 1. Of one about 20 miles north of Strafbourg, capital of the margra- viate of the fame name, and remarkable for its hot baths. 2. Of another town of Swabia, in the Brif- gow; where are likewife feveral hot baths. 3. Of one in Switzerland, about 14 miles north-weft of Zu¬ rich. 4. Of one in the circle of Auftria, about 15 miles fouth of Vienna. • BADENOCH, an inland coprttry of Invernefsrtiire in Scotland, lying between Aberdeenfliire and Lochaber","Of, Of, Of, Of, Vienna","TR,CH,US",1,"Turkey,Switzerland,United States","Asia,Europe,North America"
"BADIANE, or Bandian, the feed of a tree which grows in China, and fmells like anife-feed. The Chi- nefe, and the Dutch in imitation of them, fometimes ufethe badiane to give their tea an aromatic tafte",,"CN,NL",1,"China,Netherlands","Asia,Europe"
"BAFFIN’/ Bay, a gulph of North America, running north-eaft from Cape Farewell in Weft Greenland, from 6o° N. lat. to 8o°",Bay,PH,1,Philippines,Asia
"BAGNAG AR, the capital of Golconda, in the Hither Peninfula of India, formerly the refidence of the kings of Golconda, now fubjedt to the mogul; in 770 E. long, and 160 30' N. lat",,IN,1,India,Asia
"BAKAL, a great lake in the middle of Siberia, on the road from Mufcovy to China",,CN,1,China,Asia
"BALISTES, in ichthyology, a genus of fifties belong¬ ing to the order of amphibia names. The characters are thefe: The head is flat; there are eight teeth in each fide, and the two anterior ones are longeft ; in the place of gills, the baliftes has an aperture imme¬ diately above the peCtoral fins; the body is flat, the fcales are joined together by the fkin, and the belly is keeled. The fpecies of this genus are eight; viz. the baliftes monoceros, whofe head-fin confifts of but one ray, and the tail rays are carinated. It is called the Unicorn-fijh by Caiefby, and is found in the Afiatic and American feas. 2. The hifpidus, whofe head-fia is uniradiated ; and there is a round black fpot in the tail-fin. The body is rough and briftly towards the tail. The fpine or horn is fituated between the eyes; the fnout is fubulated; and inftead of a belly-fin, it has a jagged fharp fpine. This fpecies is a native of Carolina. 3. The tomentofus, whofe head-fin is bi- radiated, and the body of it towards the hind-part is hairy. It is a native of America. 4. The papillofus, has a biradiated back-fin, and a papillous body. 5., The verrucofus, has a triradiated back-fin; and the tail is full of little warts. In place of a belly-fin this fpecies has a large, thick, warty ray. It has 25 fmall reverfed fharp fpines at the fide of the tail, difpofed in four rows. It is a native of India. 6. The aculeatus has a triradiated back-fin; and the fpines of the tail lean upon each other. It is alfo a native of India. 7. The vetula, has a triradiated back-fin; the belly-fin islongi- tudinal",Carolina,"IN,PR,US",1,"India,Puerto Rico,United States","Asia,North America,North America"
"BALSAM, or Native Balsatvi, an oily, refinous, li¬ quid fubftance, flowing either fpontaneoufly, or by means of incifion, from certain plants. There are a great variety of balfams, generally denominated from the fubftances from which they are obtained. See Chemistry, Of reftris and balfams",Of,TR,1,Turkey,Asia
"BANDA, or Lantor, the chief of the Banda illands in the E. Indies, where nutmegs grew, in 128° E",Banda,IN,1,India,Asia
"BANIANA, a city of India, upon the road from Surat to Agra",,IN,1,India,Asia
"Bantam-work, a kind of painted or carved work, re- fembling that of Japan, only more gaudy",,JP,1,Japan,Asia
"BAROCHE, a port-town of the hither India, in the province of Cambaya; fituated fixty miles north, of Surat, in 720 $ E. long, and 22° 1$ N. lat",,IN,1,India,Asia
"BARUTH, an Indian meafure, containing feventeen gantans : It ought to weigh about three pounds and an half Englifh avoirdupois",,IN,1,India,Asia
"BASELLA, in botany, a genus of the pentandria tri- cegynia clafs.. It has no calix ; the corolla has 6 di- vifions ; and there is but one feed in the caplule. The fpeciss are 3, viz., the rubra, alba, and lucida, all natives of India",,IN,1,India,Asia
"BASKIRI, a country of Mufcovitilh Tartary, bounded on the north by the Tartars of Tumen, on the call by Barabinfkoi, on the fouth by the tnountain Sortora, and on the welt by the dutchy of Bulgaria",Tumen,"BG,CN",1,"Bulgaria,China","Europe,Asia"
"BASSAIM, or BACCEIM, a port-town of the Hither India, fubjedt to the Portuguefe, fituated in 710 j'Ef long, and 190 3c/ N. lat",,IN,1,India,Asia
"Of the three hot European waters of note, viz. Aix- la-Chapelle, Bourbon, and Bath, the firft abounds more eminently in fulphur, which makes its heat, nau- feoufnefs, and purgative faculty fo great, that few fto- machs can bear it","Of, Bath","TR,GB",1,"Turkey,United Kingdom","Asia,Europe"
"Van. I. No. 23. 3 529 ) BAT Artificial baths are various, according to the various occafions ; as aqueous baths, vaporous baths, dry baths, 4sc. Aqueous baths are made from common plants, and other emollient, refolvent, and nervine fubftances ; confiding fometimesof milk and emollient herbs, with rofe-water, fee. when the defign is to humedate, or when it is only to cleanfe, icconfifts of bran and water alone ; and when it is for an exceflive pain or tumour, fee. in thefe cafes it confifts of a decodion of roots, plants, and fome fpirit of wine",Van,TR,1,Turkey,Asia
"In thefe baths there is no part of the patient’s body plunged into the decodion, only thofe parts which re¬ quire it are.properly difpofed to receive the fleams of fome proper fomentation. Of this kind are the bag¬ nios, where perfons are made to fweat by the heat of a room, and pouring on of hot water",Of,TR,1,Turkey,Asia
"BATICALA, in geography, a kingdom of India, upon the coaft of Malabar, to the north of the kingdom of Canara",,IN,1,India,Asia
"BAY, in geography, an arm of the fea {hooting up into the land, and terminating in a nook. It is a kind of lefler gulf, bigger than a creek, and is larger in its middle within than at its entrance. The larged and mod noted bays in the world ate thofe of Bifcay, Bengal, Hudfon’s, Panama, Bay, among farmers, a term ufed to fignify the magni¬ tude of a barn ; as, if a barn confids of a floor and two heads, where they lay corn, they call it a barn of two bays. The bays are from fourteen to twenty feet long.: Bay denotes likewife a pound head, made to keep in",Bay,"PA,PH",1,"Panama,Philippines","North America,Asia"
"Bay is alfo one of the colours of the hair of horfes, in¬ clining to red, and coming pretty near the colour of a, chefnut. There are five different gradations of the bay-colour, viz. chefnut-bay, light-bay, yellow-bay or dun-day, bloody-bay, which is alfo called fcarlet- bay, and the brown-bay",Bay,PH,1,Philippines,Asia
"Bay, among huntfmen. Deer are faid to dand at bay,, when, after being hard runy they turn head againd the",Bay,PH,1,Philippines,Asia
"Beaufort is alfo a town of Savoy, about 30 miles eaft of Chamberry; in 6° 40' E. long, and 450 30^. lat",Beaufort,MY,1,Malaysia,Asia
"BEGONIA, in botany, a genus of the polygamia mo- noecia clafs. The hermaphrodite flower has no calix ; the corolla has 5 petals ; it has many ftamina,. and 3 ftyli, the male has likewife no calix ; the corolla has Vol. I. No. 21. 3 4 petals ; and has a great number of ftamina. There is but one fpecies of begonia, viz. the obliqua, a na¬ tive of India",,IN,1,India,Asia
"BEMBER, a chain of mountains, dividing India from Tartary",,IN,1,India,Asia
"BENCOOLEN, a town and fort on the fouth-weft coaft-of Sumatra, belonging to the E. India company,",,IN,1,India,Asia
"It is one of the mod fertile provinces in India, be¬ ing yearly overflowed by the Ganges, as Egypt is by the Nile",,"IN,EG",1,"India,Egypt","Asia,Africa"
"BENJAEL, the mod confiderable river of the illand Bor¬ neo, which, arifingnear the middle of that ifland, runs fouthwards, and falls into the great South Sea",Bor,TR,1,Turkey,Asia
"BERAR, an inland province of India, on this fide the Ganges, lying wedward of Orixa",,IN,1,India,Asia
"BETLIS, a city in the north of Curdidan, fituated on a deep rock, at the fouth end of the lake Van, on the frontiers f>f Perfia and Turky, in 4.50 E. long. and",Van,TR,1,Turkey,Asia
"BEYLAN, a town of Syria, upon the road from Aleppo to Conllantinople",Aleppo,SY,1,Syrian Arab Republic,Asia
"<3-- IB^KR OKMEJ^TiE IBaRHED CilO S S BIB ( 545 ) BIB BIBIO, in zoology, the trivial name of a fpecies of ti- pula. See Ti pula",IBa,PH,1,Philippines,Asia
"Under the name of Ezra, they comprehend Nehe¬ miah. It is true this order hath not always been obfer- ved, but the variations from it are of little or no moment",Nehe,CN,1,China,Asia
Of this whole work the Pentateuch alone is printed,Of,TR,1,Turkey,Asia
"The gofpel being preached in all nations, there is no doubt, but that the Bible, which is the foundation of the Chridian religion, was tranflated into the refpedive languages of each nation. St Chryfodom and The'odo- ret both tedify, that the books of .the Old and New Te¬ dament had been tranflated into the Syrian, Egyptian, Indian, Perfian, Armenian, AHhiopic, Scythian, and Samaritan languages. Socrates and Sozomen tell us, that Ulphilas bifhop of the Goths, who lived about the middle of the fourth century, had tranflated the holy feriptures into the Gothic language ; and pope John VIIL gave his approbation to the verfion of the holy feriptures made into the Sclavonian",,"SY,EG,IN,AM",1,"Syrian Arab Republic,Egypt,India,Armenia","Asia,Africa,Asia,Asia"
"Armenian and Georgian Bible. The Armenians have an old tranflation of the fcriptures in their language, taken from the Greek of the Septuagint. Three learned Armenians were employed about it, in the time of the emperor Arcadius, viz. Mofes firnamed the Grammarian, David the Philofopher, and Mamproeus. The Arme¬ nians, in 1666, procured an edition of the Bible in their language to be made at Amfterdam, under the direction of an Armenian bifliop. Another was printed at Ant¬ werp in 1670, by the procurement of Theodoras Patraeus, and the New Teftament feparately in 1668",David,"AM,PA,GR",1,"Armenia,Panama,Greece","Asia,North America,Europe"
"The Georgians have likewife a tranflation of the Bible in the old Georgian language: But as this language is known only to a very few perfons,' and the people of the country are extremely ignorant, there is fcarce any one who either reads or underftands this verfipn",,GE,1,Georgia,Asia
"Bilious colic. See Medicine, Of colics",Of,TR,1,Turkey,Asia
"BILLITON, an iftand in the E. Indian ocean, lying fouth-weft of Bornea, in x° xa' S. lat",,IN,1,India,Asia
"BIMLIP AT AN, a port-town of Golconda in India, where the Dutch have a farftory. It is fituated on the weft fide of the bay of Bengal, in 83° E. long, and 180 N. lat",,"IN,NL",1,"India,Netherlands","Asia,Europe"
"BISNAGER, the capital of a province of the fame name in the higher peninfula of India; imyS0 E. long, and ,14° N. lat",,IN,1,India,Asia
"BISSEXTILE, in chronology, a year confifting of ,366 days, being the fame with our leap-year. See Astro¬ nomy, Of the divifton of tbne. ' BISTER. See Bistre",Of,TR,1,Turkey,Asia
"BIZU, a town of Barbary, in Africa, in the kingdom of Morocco- BLACK, a well known colour, fuppofed to be owing to the abfence of light; all the rays thereof being ab- forbed by the black bodies. See Optics Black, among dyers, one of the five fimple and mother colours ufed in dying. It is made differently, ac¬ cording to the feveral qualities of the duffs that are to be dyed. For duffs of a high price, as woolen cloth an ell and a half or an ell and a quarter wide, broad and narrow rattens, fine woollen druggets, they mud ufe a black made of the bed woad and indigo, inclining to a bluilh brown. The goodntfs of the compofition confids in there being not above fix pounds of indigo ready prepared to each ball of woad, when the latter, being in the tub, begins to cad its blue flower; and in not being heated for ufe above' twice; after which it mud be boiled with alum, tartar, or allies of lees of wine, then maddered with common madder, and ladly the black mull be given with gall- nuts of Aleppo, copperas, and fumach. As for more indifferent fluffs, fuch as fmall rattens, and (iialloons, as they cannot pay for the expence of maddering it is fufficient that they be well boiled with woad, and after¬ wards blacked with gall and copperas. There is like- wife jefuits black, which is made with the fame ingre¬ dients as the good black, but without having firft dyed the fluff blue",Aleppo,SY,1,Syrian Arab Republic,Asia
"The fpecies are two, viz. the occidentale, a native of America ; and the occidentale, a native of China",,CN,1,China,Asia
"BLENNIUS, in ichthyology, a genus of-fidies belong¬ ing to the order of jugulares; the characters of which are thefe: The head Hants or declines to one fide; there are fix rays in the membrane of the gills; the body tapers toward the.tail; the belly-fins have only two blunt bones ; and the tail-fin is didindt. The fpe¬ cies are 13, viz. 1. The galeria, with a tranfverfe membranous cred upon the head. It is found in the European feas. 2. The cridatus, with a longitudinal ’ bridly cred betwixt the eyes. 3. The cornutus, with afimple ray above the eyes, and a fingle back-fin. The above two are natives of the Indies. 4. The ocella- ris, with a furrow betwixt the eyes, and a large fpot on the back-fin. 5. The gattorugine, with fmall pal- mated fins about the eye-brows and neck. It is about feven or eight inches long. Thefe two lad are found in the European feas. 6. The fuperciliofus, with fmall fins about the eye-brows, and a curved lateral line. It is a native of India. 7. The phycis, with a kind of creded nodrils, a cirrus or beard on the un¬ der lip, and a double fin on the back. It has feven rays in the gill-membrane; the anus is furrounded with a black ring; and the tail is roundidr. 8. The pholis has a fmooth head, a curve line upon the fides, and thempper jaw is larger than the under one. The two lad are found in the Mediterranean fea. 9. The gunnellus has 10 black fpots on the back-fin. It is found in the Atlantic Ocean. 10. The mudelaris has three rays on the fore-part of the back-fin. It is a native of India. 11. The viviparus has two tentacula at the mduth. 12. The lumpenus has feveral.dulky- coloured areolae running acrofs its body. The two lad are found in the European feas. 13. The rani- nus, with fix divifions in the belly-fins. It is found in the lakes of Sweden. It is remarkable, that when this fifh appears in the lake, all the other filhes retire; and what is worfe, it is not fit for eating",,"IN,SE",1,"India,Sweden","Asia,Europe"
"BLEYME, an inflammation ariiing from bruifed blood between a horfe’s foie and the bone of the foot, to¬ wards the heel. Of thefe there are three forts : The fird being bred in fpoiled wrinkled feet, with narrow heels, are ufually feated in the inward or weaked quar¬ ter. In this cafe the hoof mud be pared, and the matter let out; then let oil de merveille be poured in, and the hoof be charged with a remolade of foot and turpentine",Of,TR,1,Turkey,Asia
"BLINDNESS, a total privation of fight, arifing from an obitru£tion of the fundlions of the organs of fight, or from an intire deprivation of them. See Medi¬ cine, Of the gutla ferena, &c",Of,TR,1,Turkey,Asia
"’B-lwe-Japan. Take gum-water, what quantity you: pleafe, and white lead a fufficient quantity ; grind them well upon a porphyry; then take ifinglafs lize what quantity you pleafe, of the find! and bell fmalt a fuf¬ ficient quantity, mix them well; to which add, of your white lead, before ground, fo much as may give it a fufticient body ; mix all thefe together to the con- filtence of a paint",,JP,1,Japan,Asia
"BOHEA, in commerce, one of the belt kinds of tea . that come from China. There are three forts of it: the firft is bought at Canton for 80 tals per pice ; the fecond for 45 ; and the third for 25. See Tea",Canton,"CN,US",1,"China,United States","Asia,North America"
"x. Armenian bole, when pure, is of a bright red colour, with a tinge of yellow; It is one of the hard- eft and moft compad of the bodies of this clafs, and not fmooth and gloffy like the others, but generally of a rough dufty furface. It does not efFervefce .with acids",,AM,1,Armenia,Asia
"2. French bole is of a pale red colour, variegated with irregular fpecks of,white and yellow. It is much fofter than the Armenian, and flightly effervefces with acids",,"FR,AM",1,"France,Armenia","Europe,Asia"
"BOMBAY, an ifland on the weftcoaft of the hither pe- ninfula of India, fituated in 720 20' E. long, and 18° 30/ N. I at. It is about feven miles long', and twenty in circumference ; and is the property of our Eaft-In- dia company",,IN,1,India,Asia
