Entry,City,Country code,Edition,Country,Continent
Chap. XVI. Of the Transformation of E- quatiom ; and exterminating their interme¬ diate Terms,Of,TR,1,Turkey,Asia
"Chap. XVIII. Of the Limits of Equations, We now proceed to (hew how to difcover the limits of the roots of equations, by which their folutiou is much facilitated, . Let any equation, as x3—/x^+yx—r=o be propofed;, and transform it, as above, into the equation yt+w'+P'y+e —Pj1—2pey—pe + qy + q Where the values of y are lefs than the refpective values of x by the difference e. If you fuppofe <? to be taken fuch as to make all the coefficients of the equation of y pofitive, viz. e1—pe'+qe—r, 3?1—2pefq, —p ; then there being no.variation of the figns in the equa¬ tion, all the values of y muft be negative; and confe¬ quently, the quantity e, by which the values of x are diminifhed, muft be greater than the greateft 'pofitive value of x; ancf confequently muft be the limit of the roots of the equation x3—px:L-\-qx—r=o",Of,TR,1,Turkey,Asia
And “ from this obfervation rules may be deduced for “ difcovering when there are impoffible roots in equa- V tions.” Of which we fhall treat afterwards,Of,TR,1,Turkey,Asia
Chap. XIX. Of the Refolution of Equatlonsr all viboje Root are commenfurate,Of,TR,1,Turkey,Asia
"=—t— 301,2,3,5,6,10,15,30.   8 3 4 .5 9234 ■O I 2 3 Of thefe four arithmetical progreflions having their common difference equal to unit, the firft gives x=9, the others give x——2, x=-^3, x==—4; all which fuc- ceed except x=—3 : fo that the three values of x are +9> —2, —4",Of,TR,1,Turkey,Asia
"Of this cafe we gave examples in the laft chapter; and though it is eafy to reduce an equation whofe higheft: term has a coefficient different from unit, to-one where that coefficient ffiall be unit, by p. ;o6. col. 1. par. 6. ; yet, without that redu&ion, the equation may be refolved by this rule, as in the following Examp",Of,TR,1,Turkey,Asia
"If the propofed equation has no fimple divifor, then we are t© inquire if it has nor fome quadratic divifor (ifitfelf is an equation of more than three dimenfions.) An equation having the divifor wx2—nx-\-r may be -exprefled, as in the firft article of this chapter, by Ey.mx1' — n.\ -f-v ; and if we fubftitute for x any known quantity a, the fum that will refult will.have mu1—na-\~r for one of its divifors; and,' if we fubflitute fucceffively for x the pr ogre (Ron a, a—f, —2?, a—y, &c„ the fums that arife from this fubilitution will have ma'l—ria-\-r -nY.a — e-\-r —nY.a—2e+r m'Aa—y z—«X.;—3?+r, R 4m—2«+r rn — « -1-r . +r ?n + n + r, which fubtrafted from 4;;?, m, o, m, leave 2«—r —n—r, an arithmetical progreflion whofe difference is +«; and whofe term, arifing from the fubftitution of o for x, is —r",Ron,IN,1,India,Asia
"If, for example, we fuppofe the affirmed progr.effion a, a—e. a—2et a—y> See. to be 2, x, o, —x, the di- -vifors will be Chap. XXI. Of the Method* by which yen may approximate to the Roots of Numeri¬ cal Equations by their Limits",Of,TR,1,Turkey,Asia
"Of which the firft two terms, negledting the reft, give 35.329637X^=o.ooo326x374, andg=.^2231^13.13 = ■0.00000953127",Of,TR,1,Turkey,Asia
"“ By affuming equations affedted with general coeffi- “ cients, you may, by this method, deduce general “ rules or theorems for approximating to the roots of “ propofed equations of whatever degree.” Chap. XXII. Of the Rules fer finding the Number of Impojfible Roots in an Equation",Of,TR,1,Turkey,Asia
"ALGOL, the name of a fixed ftar of the third magni¬ tude in the conftellation Perfeus, otherwife called Me- dufa’s head. See Astronomy, Of the fixed Jiars",Of,TR,1,Turkey,Asia
from Mecca,Mecca,SA,1,Saudi Arabia,Asia
"ALMACARRON, a port-town of Spain, in the pro¬ vince of Murcia, at the mouth of the Guadalentin ; W. long. i° 15', N. lat. 370 40,",Murcia,"ES,PH",1,"Spain,Philippines","Europe,Asia"
"ALMEHRAB, in the Mahometan cuftoms, 'a nich in their mofques, pointing towards the kebla or temple of Mecca, to which they are obliged to bow in praying",Mecca,SA,1,Saudi Arabia,Asia
"ALMIGGIM-toW, is thought, to be that of the Indian pine-tree, which being light and white, was greatly efteemed for making-mufical inftruments",,IN,1,India,Asia
"the pratenfis, or meadow fox-tail grafs; the bulbo- fus, or bulbofe fox-tail grafs; the geniculatus, orflote fox-tail grafs; and' the myofuroides, or field fox-tail grafs; the above four grow wild in Britain : the . agredis, the monfpelienfis, the paniceus, and the hor- deiformis, ail native^ of France, and the fouthern parts of Europe, except the laft, which is a native of India",,"FR,IN",1,"France,India","Europe,Asia"
"ALYTARCHA, a pried of Antioch in Syria, who, in the games indituted in honour of the gods, prefided over the officers who carried rods to clear away the crowd, and keep order",Antioch,"SY,US",1,"Syrian Arab Republic,United States","Asia,North America"
"AMACUSA, an ifland of Japan, feparated by a narrow drait from Saicoco, or Ximo",,JP,1,Japan,Asia
"AMADANAGER, a town in the higher peninfula of India, fituated in 74° 15' E. long, and 180 N. lat, AMADIA, a city of Afiatic Turky, in the province of Curdedan, fituated on a high mountain, in 430 E",,IN,1,India,Asia
"AMBO, or Ambon, in ecclefiaftical antiquity, a kind of pulpit or reading-defk, where that part of the divine fervice called the gradual was performed",Ambon,ID,1,Indonesia,Asia
"AMBOYNA, an ifland of theE. Indies, lying between the Molucca ifles and thofe of Banda, in 126°. E",Banda,IN,1,India,Asia
"AMBUBAJiE, in Roman antiquity, were immodeft wo¬ men, who came from Syria to Rome, where they li¬ ved by proflitution, and by playing on the flute","Roman, Rome","SY,RO,US",1,"Syrian Arab Republic,Romania,United States","Asia,Europe,North America"
"However, their colour is ^various : Some have a mixture of yellow, and fome refemble red wine and water ; but the bell kind is tranfparent and colourlefs, and refembling fo much the diamond, that the differ¬ ence can only be diilinguilhed by the foftnefs of the amethyft. This gem is found of various fizes, from the bulk of a fmall vetch, to an inch and an half in diameter. Its ftiape is fometimes foundilh, fometimes oblong, and fometimes flatted a little on one fide; but its moft common figure is that of a cryftal, compofed of four planes, and terminated by a flat Ihort pyra¬ mid. The aniethyft is-found in India, Arabia, Ar¬ menia, Ethiopia, Cyprus, Germany, Bohemia, and Mifhia; but as they are generally as foft as cryftal, they are not much valued. It may be counterfeited many ways ; but the Germans hardly think it worth the counterfeiting",,"IN,ET,CY,DE",1,"India,Ethiopia,Cyprus,Germany","Asia,Africa,Asia,Europe"
"AMIS I A, AMISIA, or Ami AMISS, or drawing Drawing",Ami,JP,1,Japan,Asia
"AMMANNIA, in botany, a genus of the tetrandria monogynia clafs. The corolla confifts of four petals inferred into the calix, v/hich has eight teeth. The capfule has four cells. There are three fpecies of ammannia, viz. the latifolia, and ramofior, both na¬ tives of America; and the baccifera, a native of China",,CN,1,China,Asia
"AMOY, an illand on the fouth-weft coaft of .China, fi- utated in E. long. xi8°, N. lat. 250",,CN,1,China,Asia
"AMPULLACEiE concha, in naturai hidory. See Doha",Doha,QA,1,Qatar,Asia
"AMPUTATION, in forgery, the cutting off a limb, or any part, from the body of an animal. See Sur¬ gery, title. Of amputation",Of,TR,1,Turkey,Asia
"Amsterdam, is alfo the name of a town of the Cura- coes, in America: likewife the name of three ifiands, one of which lies in the Indian ocean, between New Holland and Madagafcar; the fecond between Peru and A ""N A and the iflands of Solomon ; and the third in the . Chinefe fea, between Japan, and the ifland Formofa","Amsterdam, Holland","US,PE,JP,IN",1,"United States,Peru,Japan,India","North America,South America,Asia,Asia"
"Amuy, a city of India, beyond the Ganges, near the lake Chiamai, on the borders.of the kingdom of Kan- duana",,IN,1,India,Asia
",xix. 13, as aifo the circumdances cf our Lord’s bap- ANA ( u tifm in Jordan, Mat. iii. 16. Mark i. 9, 10. and of the eunuch’s, Afts viii. 38, 39. and the reafon of John’s baptizing in Enon, John iii. 23. Hence they affirm, that no other mode can be called baptifm,or fo fitly reprefent communion with (Thrift in his death, burial, and refurre&ion, which is exprefsly the defign of baptifm, Rom. vi. 3,4, 5",,JO,1,Jordan,Asia
"The male is white above, but black below and behind ; the female is greenifti. It is a native of the north of Europe. 13. The mofchata, or Mufcovy duck of Ray, has a naked papillous face, and is a native of India. 14. The bahamenfis, or Bahama duck, is grey, with a lead-coloured bill. It has a tawny fpot on the fides, and a green yellowiftv fpot on the wings",,IN,1,India,Asia
"The autumnalis, or red-billed whirling duck of Ed¬ wards, is of a grey colour, with the prime feathers of the wings, the tail, and belly black; and the area of the wings yellow and white. It is a native of Artie- rica, 33. The bofchas, or common wild-duck of Ray; the intermediate tail-feathers of the drake are turned backward, and the bill is llrait. It frequents the lakes of Europe. This duck feeds upon frogs and feveral forts of infedls.—The wild duck builds its nelt among ruihes or heath, near the water, and lays 12 or 14 eggs;. At moulting-time, when they cannot fly, great numbers of them are taken with nets. Birds with flat bills, that And their food by groping, have three pair of nerves that extend to the end of. their btlls: thefe nerves are remarkably confpicuous in the head 'and bill of the wild-duck; and are larger than thofe of a goofe, or any other bird yet known : This is the reafon they grope for food more than any other bird whatever.—34. The adunca, or hook-billed doraeftic duck of Ray, has the fame characters with the bofchas, excepting that the bill is croaked. 3 5. The galericulata, or Chinefe teal of Edwards, has a hatfging creft; and on the hinder part of the back, on both fides, there is a crooked, flat, elevated feather; the creft is green and red; and the back is brown, and fpotted with blue; the erect feathers on the back are red and blunt; one edge of the inmort wing-feather, when the wings are ilrut, is raifed over the back, and is red, and like a flekle before. It is a native of China. 36. The fpsofa, or fummer-duck of Catefby, has a depending green creft, variegated with blue and white ; the back islikewife variegated with blue and white; the breafi is grey, and fpotted with white; and the throat is white. It is a native of N. America. 37. The ar- borea, or black-billed whiflling-duck of Edwards, is of a reddifli bro wn colour, with a fort of crefl on the head; the belly is fpotted with black and white. It is a native of America. Sloane informs us, that this duck perches on trees; that it is about 20 inches long, from the end of the bill to the point of the tail; that it makes a kind of whUilfng noife, from which cir- cumflance it has received its name. See plate XII. fig",,CN,1,China,Asia
"ANASTATIC A, or rofe of Jericho, in botany, a gemrs of the tetradynamia filiculofa clafs. The flower con- fifls of four roundifli petals, difpofed in the form of a crofs ; the feed is a fhort bilocular pod, containing in each cell a Angle roundifh feed. There are two fpecies of the anaftanca, viz. the hierodruntica, a native of the fandy parts of Paleftine, and the (bores of the Red-fea; and the Syriaca, a native of Syria",Jericho,"SY,PS",1,"Syrian Arab Republic,Palestine, State of","Asia,Asia"
PAR OF THE \ Sect. I. Of the Bones in general,Of,TR,1,Turkey,Asia
"Except where mufcles, cartilages, or ligaments, are inferted into the periofteum, its external furface is con¬ nefted to the furrounding parts by thin cellular mem¬ branes, which can eafily be ftretched confiderably, but Vol. I. No.' 7. ' 3’ In treating this ufeful fubjeft, we lhall divide it into the following parts: I. Of the Bones. II. Of the Musclcs. III. Of the Arteries.- IV. Of the Veins. V. Of the Nerves. VI. Of fuch parts of the body as are not comprehended in any of the above, e. g. The Brain, Thorax, Abdomen, <bc","Of, Of, Of, Of, Of, Of",TR,1,Turkey,Asia
"Though bones fo far agree in their llruchire and an¬ nexed parts, yet we may obferve a confiderable differ¬ ence among them in their magnitude, figure, fituation, fubftance, connexion, ufes, Of thefe we Ihall only mention two, viz. that fome bones are broad and flat, while others are long and round",Of,TR,1,Turkey,Asia
"On the furfaces of a great many of the bones there are cavities, or depreffians: If thefe are deep, with large brims, authors name them cotyla-; if they are fuperficial, they obtain the defignation of glena:, or gle¬ noid. Thefe general clafl'es are again divided into feve- ral fpecics :—Of which pits are fmall roundilh channels funk perpendicularly into the bone;—-furrows are lonn- narrow canals, formed in the furface ;—nit dies or notches, fmall breaches in the bont‘,i—fnuo/iiics, broad, but fu¬ perficial depreflions without brims ;—-fojfa, large deep cavities, which are not equally furrounded by high brims ^—finufes, large cavities within the fubftance of the bones, with filial 1 apertures ■—feramina, or holes, canals that pierce quite through the fubftance of the bones. When this laft fort of cavity is extended any long way within a bone, the middle part retains the name of canal, and its ends are called botes. • The cavities allow the heads of bones to play in them ; they lodge and defend other parts ; they afford fafe paf- fage to veffels, mqfcles, &c",Of,TR,1,Turkey,Asia
S e c t. II. Of the Skeleton,Of,TR,1,Turkey,Asia
"The nafal lamella of this bone.is extremely thin and brittle, and rifes upwards from the upper fide of the ex¬ ternal edge of the fquare bone, and from the narrow ex¬ tremity of the pterygoid procefs; where it is fo weak, and at the fame time fo firmly fixed to the maxillary bone,- as to be very liable to be broken in feparating the bones. From the part where the plate rifes, it runs up broad on the infide of the tuberofity of the maxillary bone, to form a confiderable fhare of the fides of the maxillary finus, and to clofe up the fpace between the fphenoid and the great bulge of the maxillary bone, where there would otherwife be a large flit opening into the noftrils. From the middle internal fide of this thin plate, a crofs ridge, placed on fuch another of the maxil¬ lary bone, is extended; on it the back-part of the os fpongiofum Part L A N A T fpongio/um' inferius rcfts. Along the outfide of this plate, the perpendicular foffa made by the palate-nerve •is obfervable",Along,IN,1,India,Asia
"Between the bodies of each two adjoining vertebra, a fubdance between the nature of ligament and, cartilage is interpofed; which feems to confid of concentrical curve fibres, when it is cut horizontally; but when it is divided perpendicularly, the fibres appear oblique and de- cuffating each other. The outer part of the interver¬ tebral ligaments is the mod folid and hard ; and they gra¬ dually become fofter till they are almod in the form of a glairy liquor in the centre ; and therefore thefe fub- dances were not improperly called muons ligaments by the ancients. Tire external fibrous part of each is capa- bleof being greatly extended, and of being compreffedinto a very fmall fpace, whild the middle fluid part is incom- preflible, or nearly fo ; and the parts mf this ligament between the circumference and centre approach in their properties to either, in proportion to their more folid Part I. ANATOMY. 167 or more fluid texture. The middle point is therefore a fulcrum or pivot, on which the motion of a ball and focket may be made, with fuch a gradual yielding of the fubftance of the ligament, in whichever diredion our fpines are moved, as faves the body from violent (hocks, and their dangerous confequences. This ligamento- cartilaginous fubftance is firmly fixed to the horizontal furfaces of the bodies of the vertebrse, to conned them, in which it is aflifted by a ftrong membranou^igament, which lines all their concave furface, and uy ftill a ftronger ligament, that covers all their anterior convex furface",Tire,TR,1,Turkey,Asia
"Tire third bone is much lefs than the other two, and has only one half of the pit for the feventh rib formed in it; wherefore it might be reckoned only an appendix of the fternum. In young fubjeds it is always carti¬ laginous, and is better known by the name of cartilage y'tpboides, or enfiforntis, than any other; though the an¬ cients often called the whole Jlernum e>:ftforme.—This third bone is feldom of the fame figure, magnitude, or fituation in any two fubjeds; for fometimes it is a plain triangular bone, with one of the angles below, and per¬ pendicular to the middle of the upper fide, by which it U conneded to the fcccnd bone.—■—In other people, the O M Y. 175 point is turned to one fide, or obliquely forwards or back¬ wards.—Frequently it is all nearly of an equal breadth, and in feveral fubjeds it is bifurcated; whence Come wri¬ ters give it the name of furcella, or furcula inferior-, or elfe it is unoflified in the middle. In the greateft number of adults it is oflified, and tipped with a carti¬ lage ; in fome, one half of it is cartilaginous; and in o- thers, it is all in a cartilaginous ftate.—Generally feveral oblique ligaments, fixed at one end to the cartilages of the ribs, and by the other to the outer furface of the xi¬ phoid-bone, conned it firmly to thofe cartilages",Tire,TR,1,Turkey,Asia
"Of the four, the toe next to the great one has the largeft bones in all dimenfions, and more externally the toes are lefs.—The little toe, and frequently that next to it, have the fecond and third bones intimately uni¬ ted into one; which may be owing to their little motion, and the great preffure they are fubjedled to",Of,TR,1,Turkey,Asia
OF THE Sect. T. Of the Muscles in general,Of,TR,1,Turkey,Asia
"From thence all the fibres contrail: in breadth, more Of lefs, in a radiated manner, as they advance toward the great trochanter, and form a fliort thick tendon, which mixes a little anteriorly with the tendon of the glutasus minimus ; and the moft pofterior fibres gradual¬ ly join the fide of the tendon of the pyriformis",Of,TR,1,Turkey,Asia
"The pofterior fibres of the external intercoftals are O M Y. 215 fixed, by their upper extremities, fo near the articulation of the ribs with the vertebras, that they cannot deprefs that rib in which they are fo inferted ; whereas the infertions of their lower extremities in the following rib being at a greater diftance from the articulation, they may move that rib upward. And from thence it follows, that all the remaining part of each external in- tercoftal which terminates at the bony extremity of each rib, can only ferve to raife the Wer rib toward the upper",Wer,IN,1,India,Asia
"Of the tranfverfales antici, the firft only move the head in the manner above mentioned; neither can they perform any other motions, their infertions being confi¬ ned to the os Qccipftis and firft vertebra. The tranfver¬ fales antici fecundi have no (hare in the particular motions ' of the head, but ought rather to be ranked among the mufcles which move the vertebrse of the neck",Of,TR,1,Turkey,Asia
Sect. XV. Of the Vertebral Muscles,Of,TR,1,Turkey,Asia
"Superior Extremity.—Left fide, a, Supra- fpinatus. b, Infra-fpinatus. c, Teres minor, d, Te¬ res major, e. Triceps extenfor cubiti. f f, Exten¬ fores carpi radialis. g, Supinator brevis, h. Indi¬ cator. 123, Extenfores pollicis. i, Abduftor mi¬ nimi digiti. k, Interolfei",Indi,IN,1,India,Asia
"Tire external artery pierces the ligament about three fingers breadth below the articulation, and prefently af¬ terwards gives off a branch, which runs up, like a recur¬ rent, toward the external condyle of the os humeri, un¬ der the utnaris externus and anco.nsaus,minimus, to which it is diftributed, as alfo to the fupinator brevis",Tire,TR,1,Turkey,Asia
"The reft are diftributed to the neighbouring integu¬ ments, to the bulb Of the urethra, and to the corpus oavernofum penis; but the laft of thefe arteries, or ra¬ ther the extremity of this firft ramus, runs from behind foreward, over the neck of the os femoris, and commu¬ nicates with a branch of the-arteria cruralis",Of,TR,1,Turkey,Asia
Sect. I. Of the Nerves in general,Of,TR,1,Turkey,Asia
"248 ANA T Sect, II. Of the particular Nerves",Of,TR,1,Turkey,Asia
"It is generally faid, that there are forty pair of nerves in all; of which ten come out from the encepha¬ lon, and the other thirty have their origin from the fpinal marrow. * Of the ten pair of nerves which come from the ence- phalon, the firji is the Olfactory, which have their origin from the corpora ftriata, near the part where the internal carotid arteries are alrout to fend off their branches to the different parts of the brain; and in their courfe under the anterior lobes of the brain, which have each a depreffion made for lodging them, become larger, till they are extended to the cribriform bone; where they fplit into a great number of fmall filaments, to pafs through the little holes in that bone; and being joined by a branch of the fifth pair of nerves, are fpread on the membrane of the nofe",Of,TR,1,Turkey,Asia
Of fitch Parts ofi the Body as could not properly he deficrihed under any ofi the former general Divifiions,Of,TR,1,Turkey,Asia
Sect. I. Of the common Integuments,Of,TR,1,Turkey,Asia
Sect. II. Of the Abdomen,Of,TR,1,Turkey,Asia
"Of thefe internal elongations or introprefiions of the true lamina of the peritonaeum, fome are fimply folded, like a duplicature • fome are expanded like inverted bags Or facculi to contain fome vifeus ; fome begin by a fimple duplicature, and are^afterwards expanded into a cavity, which contains fome organ; fome are alternately extend¬ ed in the form of fimple duplicatures, and of cavities; and laftly, fome form only a fmall eminence on the inner furface of the great cavity of the peritonaeum",Of,TR,1,Turkey,Asia
"Along the middle of each lateral fide of the fmall extremity, there funs a tendinous or ligamentary flat portion, above a quarter of an inch in breadth, which terminates in the pylorus. Thefe two portions lie be¬ tween the common and mufcular coats, and adhere very ftrongly to the firft",Along,IN,1,India,Asia
"Along the whole circumference of the mefentery, the two laminae are naturally feparated, and applied to the two fides of the final! inteftines, which they inveft by their union, or rather reciprocal continuation on th» great curvature Part VI. A N A T curvature of that canaf, and carry it as in a fcarf or fling",Along,IN,1,India,Asia
"Thefe glands are of the number Of thofe that anato- mifts call glandule conglobate, the ftruCture of which is not as yet fufficiently known. They feem to be of a cellular fubftance, furroundcd by a very fine membrane or coat, on which, by the help of microfcopes, we difco- ver an intertexture Of particular filaments","Of, Of",TR,1,Turkey,Asia
"Along the middle of the anterior fide, a ridge runs from the edge of the inner extremity, a little above the bafis, to the point of the other extremity, and divides this fide into two equal parts, like ihe middle rib of the leaf of a tree; and on the lower fide, under the bafis, there is a kind of raphe or future",Along,IN,1,India,Asia
"Of the three angles of this cavity, the two which terminate the fundus are perforated each by a nar¬ row du<ft, which with diificulty admits a hog’s briftle",Of,TR,1,Turkey,Asia
"Sect. III. Of the Thorax. , By the thorax, we commonly underftahd all that part of the body which anfwers to the extent of the fternum, ribs, and vertebras of the back, bpth outwardly and in¬ wardly",Of,TR,1,Turkey,Asia
"The pulmonary artery goes out from the right ventri¬ cle of the heart; and its trunk having run almoft direftly upward as high as th£ curvature of the aorta, is divided into two lateral branches, one going to the right-hand, called .the right pulmonary artery, the other to the left, termed the left pulmonary artery. The right artery pafles under the curvature of’ the aorta, and is confe- quently longer than the left. They both rUn to the lungs, and are difperfed through their whole fubftance by ramifications neatly like thofe of the brohchia, and lying in the fame directions",Un,IN,1,India,Asia
"3, The gall-bladder. 4, The pancreas. 5, The fpleen. 6 6, The kidneys. 7, The aorta defcen¬ dens. 8, Vena cava afcendens. 9 9, The renal veins covering the arteries. 10, A probe under the fpermatic veffels and a bit of the inferior mefenteric artery, and over the ureters. 11 11, The ureters^ 12 12, Tire iliac arteries and veins. 13 The reftam inteftinum. 14; The bladder of urine",Tire,TR,1,Turkey,Asia
"1, Its fundns. 2, Its cervix, b b. The Fallopian or uterine tubes, which opens into the cavity of the uterus;—but the other end is open within the pelvis, and furrounded by c c. The fimbrise. d d,.The ova- ria. e, The os internum uteri, or mouth of the womb, f f. The ligamenta rotunda, which pafles without the belly, and is fixed to the, labia pudendi. g g. The Sect. IV. Of the and its Appendages",Of,TR,1,Turkey,Asia
Sect. -V.- Of the Eye,Of,TR,1,Turkey,Asia
292 A N A T The broad UgamentS'Of the tarfi are membranous e- I o -gatioHS formed by the union of the peri oft sum of the t-rbits ' and pericranium along both edges of each orbit,Of,TR,1,Turkey,Asia
"Tire third portion feems to belong more particularly to the palpebrse, and thegreateft part of it is Ipent in the palpebrs. fuperior. The fibres of this portion meet at the two angles of the eye, where they, appear to make very acute inflexions without any difcontinuation",Tire,TR,1,Turkey,Asia
