Entry,City,Country code,Edition,Country,Continent
"and wifhed that the Jefuits alone fhould have the con- dud of the million. For this purpofe he reprefented to A B Y [ 87 ] A B AbyiTmia. to Hagi Ali, that Friar Pafchal underftood nothing of commercial intercourfe ; though ^ medicine •, but he promifed to furniih him with ano- Difappoint- ^her, whofe {kill he extolled above all thofe of ancient MaiUet^"" or rno<^ern times. Hagi Ali, who knew nothing of the matter, readily agreed to Maillet’s propofal} and Poncet and Charles Poncet a Frenchman, who had been bred a Breyedent chemift and apothecary, was appointed to the office appointed. o£ with Father Brevcdent to attend him as his fervant. Thus the fcheme of the Francilcans was for the prefent overthrown : but unluckily Maillet em¬ ployed one Ibrahim Hanna, a Syrian, to write letters to the Abyffinian monarch and fome of his principal nobility, which he defired him to fubmit to the in- fpeftion of one Francis, a Capuchin or monk of the Holy Land, and confequently -an enemy to the Fran- cifcans. Ibrahim, not being acquainted with the monk he mentioned, and thinking any other wmuld anfwer as well, carried the letters to one of the fame Xhe Fran- name, but of the Francifcan order. Thus the whole cifcans re- fecret was divulged at once } and the Francifcans, with folve the the malevolence effential to fuch religious miicreants, deftrudtion j-gfoiygd ori the deftruftion of Poncet and his attend fionaries!"" dants- At Prefent> however, their Sanguinary- inten- Poncet fets tions were defeated ; Poncet fet out immediately after out on his he had received his commiffion, and arrived fafe at return after Gondar the capital of Abyffinia, with his attendant -^Ya- Father Brevedent, on the 21ft of July 1699. Breve- dent died on the 9th of Auguft •, but Poncet lived to execute his commiffion, by making a full cure of his royal patient. On the zd of May 1700, he fet out on his return for Europe, and arrived at Mafuah without any bad accident",Gondar,"ET,SY",4,"Ethiopia,Syrian Arab Republic","Africa,Asia"
"He is not   _ o' whatever friendlhip Abyffmnn' or good-will might take place, it was evident that """"v 1 * there was not a ftngle article that could be exchan¬ ged between them, nor was there any ready com¬ munication betwixt the two countries either by fea or land. The perfon pitched upon as ambaffador m. de was M. de Roule, vice-conful at Damietta. He isRoule fent charafterized by Mr Bruce as “ a young man of fome j^affador merit, who had a confiderable degree of ambition, p^ce> and a moderate {kill in the common languages fpo- ken in the eaft \ but abfolutely ignorant of that of the country to which he was going, and, what was worfe, of the cuftoms and prejudices of the nations through which he was to pafs. Like moft of his countrymen, he had a violent predileftion for the drefs, carriage, and manners of France, and a hearty con¬ tempt for thofe of all other nations: this he had not addrefs enough to difguife j and this endangered his life.” Beftdes thefe difadvantages, he had the mil- fortune to-be under the difpleafure of all thofe of hid own nation who refided at Cairo ; fo that the mer* chants were very much averfe to his embaffy; and, as the Francifcans and Capuchins were his mortal enemies; he had not a ftngle friend in the world except Maillet and the Jefuits. Unluckily the conful milled him in one of the moft material articles, and which was un¬ doubtedly of the utmoft confequence to him in the ac- compliffiment of his purpofe, viz. the prefents necef- fary to be taken with him for the barbarous people through whofe country he wras to pafs. Brocades, fatins, and trinkets of various kinds, according to Mr Bruce, were the proper wares ; but, inftead of this, he had taken along wdth him mirrors of various kinds, with the pictures of the king and queen of France, wrearing crowms upon their heads. The former ot thefe fubje<fted him to the imputation of being a ma¬ gician ; while the latter, if ftiown to a Mahometan, would bring upon him the charge of idolatry. The worft misfortune of ail was the malice and treachery of the Francifcans, who had already prejudiced againft him the people of the caravan with wffiom he wTas to go, the governors of the provinces through which his road lay, and the brutal and barbarous inhabitants of Sennaar, wffio lie in the way betwixt Egypt and Abyf¬ finia. The confequence of all this was, that he was He is mur- murdered at the laft-mentioned place with all his reti-clerec!- nue. The Francifcan friars, who had preceded him to Sennaar, left it before his arrival, and returned im¬ mediately after. There cannot therefore be the leaft doubt that they wrere the authors of his murder; though the bigotted difpofition of Louis XIV. pre¬ vented all inquiry into the matter ; fo that the parti¬ cular fteps they took to accomplilh their defigns were never publiffied to the w’orld","Damietta, Cairo","EG,FR",4,"Egypt,France","Africa,Europe"
"The affaffination of De Roule wras preceded by that Yafous af~"" of Yafous emperor of Abyffinia, who-fell by a conipi-faffinatecL racy of his wife and fon, occafioned by a fit of jealou- fy in the former. He wras fucceeded by his fon 1 e- cla Haimanout, wffio had confpired againft him. Be¬ fore his death, he had difpatched a meffage to the king of Sennaar, requiring him to afford M. de Roule protection at his court, and a fafe conduct from it ; but wffien the meflenger was within three days journey of the capital of that kingdom, he received news of the affaffination of Yafous, On this he re¬ turned-- A B Y Abyulma. turned In gteat hafte to Gondar, in order to have the w ^ ^ letters of proteftion renewed by Tecla Haimanout the reigning prince. This was readily done : but before the meiTenger could reach Sennaar, he was in¬ formed that JDe Roule was already affaffmated 5 on which he returned with Hill greater haite than be- The new fore. The AbyfTmian monarch, provoked at fuch a emperor in-fCandalOUs violation of the law of nations, declared his intention of commencing hoftilities againft the death; ' ic if mur¬ dered",Gondar,ET,4,Ethiopia,Africa
"After this, the emperor undertook an expedition againft the Shangalla, according to the barbarous cu- ftom of the Abyffmian monarchs, who hunt thefe poor people merely for the fake of making Haves; flaugh- tering the men without mercy as well as many of the women, and carrying off only the boys and girls into captivity. In this he met with perfect luccefs 5 and was about to attempt the conqueft of the whole coun¬ try, when he was called back by the news that his prime minifter Tafa Chriftos was dead. While the The em- emperor remained in his capital at Gondar, he was ta- peror fails ken fuddenly ill ; which he at firft imputed to witch-hck- craft, and therefore ufed fome antidotes ; among which the fmokiixg of the palace with gunpowder was one",Gondar,ET,4,Ethiopia,Africa
"At laft the principal officers came to pay him a vifit of condolence, as they pretended *, but in reality to ob- ferve the nature of his diftemper, and to confult whe¬ ther or not it was likely to continue till they could fall upon means to deprive him of the government. Ou¬ ftas underftood their intentions, and therefore fummon- ed all his ftrength to affume for a moment the appear¬ ance of health ; fo that the officers found him as ufual engaged in bufinefs. Being thus difconcerted, it be¬ came neceffary to make fome apology for a vifit fo ex¬ traordinary and formal ; for which they were at firft fomewhat at a lofs : on recolleftion, however, they told him, that, hearing he had been fick, which they happily found was not the cafe, they had come to make a propofal concerning the fucceffion; profeffmg a de¬ fire that he would quiet the minds of his own family, and of the people in general, by appointing his fon Fa- fil fucceffor to the throne after his deceafe. Ouftas gave them an equivocal anfwer $ but the difeourfe con- cerning Fafil happening to be overheard by the fol- jjavid pro- diers, a violent mutiny enfued, and all the officers who claimed had come to vifit Ouftas were killed. Part of theemPeror* towm was fet on fire in the confufion ; and at laft a proclamation was made, that David fon of Yafous was king of Abyffmia. The prince was then fent for from the mountain, and arriving at Gondar, tvas crowned on the 30th of January 1714. The diftemper of Ouftr.s in the mean time continuing to increafe, he died on the j>eatjj 0f loth of February the fame year. Ouftas","David, Gondar","PA,ET",4,"Panama,Ethiopia","North America,Africa"
"The new emperor was a rigid Alexandrian in prin- ^ ^ ciple } but Ouftas had been fo far favourable to the -Da^id> 1 Catholics, as to entertain fome of their priefts, though in a private manner. As it was the cuftom, horvever, to call a convocation of the clergy on the acceffion of every new emperor, the monks and others infilled up¬ on one being called on the prefent occafion 5 the more efpecially that a new Abuna was come from Egypt, and the lenity fhown to the Catholics by Ouftas had excited the jealoufy of the AbyfTmian clergy in the hightfl Three Ro- iniih priefts put to death",,EG,4,Egypt,Africa
"David was fucceeded by his brother Bacuffa •, wno Reign of in the beginning of bis reign proved very levere and ’aa,“A- cruel, cutting off almoft all the nobility who could be fuppo’fed to have had any ffiare in the confpiracies and feditions of former reigns. In tne latter patt cn it he became much more mild, and was beloved by his fubjecls. He was fucceeded in 1729 by his fon Ya-O-^; fous II. who continued long under the regency of hxs ' mother j and as foon as he took the management of affairs upon himfelf, was difturbed with continual iedi- tions and rebellions. In one of thefe the city of Gondar was made a field of battle, and was io fre¬ quently fet on fire, as to be almoft entirely reduced to ruins.' Having at laft fucceeded in reducing all his Cukivates enemies to obedience, he encouraged and promoted the A arts of peace, repairing and ornamenting his palaces, in which he employed iome Greek artifts. lor this lie renounced the diverfion of hunting, and the barbarous expeditions againft the Shangalla ; but this way of life Is lampoGh","David, Gondar","PA,ET,GR",4,"Panama,Ethiopia,Greece","North America,Africa,Europe"
"As he ft ill went on, the king Baady being affifted byAdivifioti Hamis prince of a territory named Dar Poor, furprifed ^10sftarmy one divifion of his army fo effeaually, that they were all cut off to the number of 18,000. Yafous, how¬ ever, ftill continued his deftru&ive progrefs 5 though he gave over all thoughts of reducing the capital, or fubduing the kingdom. He returned triumphant to Gondar, making a great fhow of the plunder he had acquired ; though the deje&ed countenances of many of his army ft)owed that they were by no means plea- fed with expeditions of this kind. The king himfelf Was fiippofed to behold the diftrefs of his fubjefts on this occafion with a malicious pleafure, on account of their impatience and turbulence in times of peace, and their forcing him into a war when he had no inclina¬ tion for it. In a fliort time, however, the people were perfectly comforted for the lofs of their brethren. In Religious the late unfortunate adlion they had loft all thofe ^°ly deemedTt utenftls, which it is ufual in Abyffinia to carry into the an extrava- field of battle in order to enfure vidlory. Among gant rate, thefe was a pidlure of the crown of thorns which was put upon our Saviour’s head ; fome pieces of the true crofs upon which he fuffered ; a crucifix which had fpoken on many occafions *, with many other facred re¬ lics of equal value. Soon after the battle all thefe were redeemed by the priefts at an extravagant rate ; no lefs than 8000 ounces of gold having been given M for A B Y [ Abyffima. for tne ipeaking crucifix j and for the reft, we are to ftippofe a proportional price had been paid. On the arrival of this trumpery at Gondar, the greateft rejoi¬ cings were made, and Yafous was aftoniihed at the people having fo foon forgot the lofs of their country¬ men and relations","Gondar, Gondar",ET,4,Ethiopia,Africa
"Soon after thefe tranfaftions the abuna died j but though it was cuftomary for the Abyffinian monarclis to advance the money neceffary to bring a new one from Alexandria, Yafous found himfelf obliged to lay a tax upon the churches for defraying it at this time, having fpent all his ready money in repairing and orna- The mef- menting his palaces. Three priefts, configned to the fengers fent care of as many Mahometan factors, were fent to ahuna^n-^ ^gypt f°r_the new patriarch 5 but they were detained fulted'and ^or ^ome t5me by ^ naybe or prince of Mafuah, who fobbed. extorted from them one half of the money given by the emperor for bringing the abuna from Cairo. Yafous no fooner heard that they were detained at Mafuahg than he fent orders to Suhul Michael governor of Ti- gre to refufe provifions to the inhabitants of Mafuah, which would foon reduce the naybe to obedience : but as Michael intended foon to quarrel with the king himfelf, he was not in any hafte to obey the orders he received. The travellers were therefore detained fo long, that on their arrival at Jidda,' they found they had loft the monfoon ; and, what was wwrfe, the fche- rifif of Mecca would not allow them to pafs without a frefh extortion. Their money was now- exhaufted ; but the rapacious fcherif put one of their number in pri- fon ; where he continued for a twelvemonth till the mo¬ ney arrived : and from this time thefe extortions w-ere changed into a ftated tribute ; 75 ounces of gold (about 1861. fterling) being granted for leave of paf- fage to Cairo for the abuna ; 90 ounces to the fche¬ rif, and as many to the naybe, for allowing the abuna to pafs from Cairo : an agreement wftiich fublifts to this day. Several other infults of this kind being received from the naybe, Yafous at laft difcovered that there was a ftritft alliance betwixt him, the governor of Ti- , gre, and the Baharnagalh ; any one of whom, had he thought proper, could have crufhed this pitiful prince The empe- with the fmalleft effort. On this the emperor deter¬ ror deter- m;neq to march againft him in perfon j but was pre- puniih the ventetl by a rebellion which had been purpofely excited naybe of i11 the country of Azab and that of the Dobas. The Mafuah, rebels were eafily overthrown : and thus the expedition buttTe- againft the naybe was delayed for a year ; during which War with b'rtervA the emperor fent for Michael to Gondar. This Michael order was politively refufed, and a war enfued. Mi- governor of chael, unable to contend with the emperor in the open Tigrc. field, took to a high mountain, the ufual refuge of Abyffinian rebels. Here alfo his bad fortune purfued him ; all his pofts were taken by ftorm excepting one, which, it was evident, would likewife have been carried, though not without a very great expence of men. Here Michael Michael requefted a capitulation ; and to enfure favour- obliged to able terms, he defired to put into the hands of Yafous ™ u a ^ a great quantity of treafure, which would, otherwife be diiiipated among the common foldiers. This being done, Michael defeended with a ffone upon his head, as confeffmg himfelf guilty of a capital crime, w ith a defign to make fubmiffion to the emperor. This was prevented for erne day by a violent ftorm of wind and rain j from which moment the Abyffinians believe he A ftated tribute for the paflage of the abu- aa","Alexandria, Cairo, Mecca, Cairo, Cairo, Gondar","EG,US,SA,ET",4,"Egypt,United States,Saudi Arabia,Ethiopia","Africa,North America,Asia,Africa"
"The Galla On the acceffion of the young king a party oi Galla Introduced horfe faid to be about 1200 in number, were lent as into Abyf- ^ 0’ortion of bis mother •, and thefe were quickly fmia- followed by a number of private perfons from motives of curiofity, or hopes of preferment, who were embo- » died to the number of 600 into a troop of infantry, the command of which was given to Wooflieka. The great favour in which thefe people were at court loon induced many others*to make their appearance. T wo Two of of the king’s uncles were fent for by bis exprels dehre ; the king’s Rnq ^gy brought along with them a troop of IOOQ undes ar- the time they arrived the queen was dead *, cngrofs all but’her two brothers, named Brulhc and Labo, finding the power, that the king put an entire confidence in them, deter¬ mined to make a party at court. This was eafily ef- fefted i every thing was governed by Gallas 5 even the king himfelf affecfed to fpeak their language ; while the Abyffinians were to the laft degree mortified at fee¬ ing their inveterate enemies thus eftablilhing a domi¬ nion over them in the heart of their own country. At laft the king thought proper to appoint his uncle Lubo to the government of Amhara ; but this produced fuch exceftive difcontent, that be was fain to letracf bis no¬ mination, left a civil war fliould have enfued. While the empire was thus divided into two paities, Suhul SulmlMi- Michael came to Gondar in a very fplendid manner, chad ar- on an application from the exiled prince of Sernaar to be reftored to his kingdom. When conduced mto the prefence of the emperor, be proftrated himielt be¬ fore him, owned himfelf bis vafial, and was put in poffeflion of the government of Ras el Feel upon the frontiers, with a large revenue, where he was advifed to ftay till the difputes which fubfifted at that time ihould fubftde. This falutary advice, however, he had not prudence to comply with ^ but fuftering himfelf to be decoyed from his afylum in Atbara, ivas taken pri- foner and murdered. , ","Labo, Gondar, Atbara","PH,ET,SD",4,"Philippines,Ethiopia,Sudan","Asia,Africa,Africa"
"was not the leaft doubt, that, immediately on the ac- ceflion of Brulhe to his new office, it would be over¬ run by that race of barbarians, remarkable for their favage manners almoft beyond all the other nations m Africa. This was the more dangerous as _ there was not above a day’s journey betwixt the frontiers of Be gemder and Gondar, the capital of the whole empire",Gondar,ET,4,Ethiopia,Africa
"He returned a fcoffing anfwer, announcing the fpeedy arrival of Brulhe, whom he thought fare of viftory : but, at the fame time, to (how that he did not put his confidence entirely in his proweft, he created Suhul Michael governor of Samen, which lay next to Tigre in the way to Samen, fo that no obftruftion might lie in the way of that officer’s march to Gondar, in cafe there ffiould be any occafion for him. Mariam, pro¬ voked at the manner in, which he was undervalued in the king’s melfage, gave an ironical reply, in which he alluded to the name of Bru/he, in the Abyffinian lan¬ guage fignifying a kind of bottle; this he told him would be broken on the rocks of Begemder, if fent into that country","Tigre, Gondar","AR,ET",4,"Argentina,Ethiopia","South America,Africa"
"1 owns, villages, and buildings of every kind, were fet on fire as he paffed along ; the people fled from all quarters to the capital for refuge, as from the face of the moft inveterate enemy 5 and loas himfelf was now fenfible of his having been in the wrong to inveft him with fuch unlimited power. On his arrival at the ca- Arrives at pital, Michael took poffeffion of all the avenues, as if Gondar",Gondar,ET,4,Ethiopia,Africa
"he meant to befiege it ; fo that an univerfal confterna- tion enfued. Inftead of offering any hoftility, how¬ ever, he waited with the utmoffl refpeft on the empe¬ ror, proceeding immediately from the royal prefence to his own houfe, where he fat in judgment, as the nature of his office required him to do. No fooner Executes had he taken upon him this new office, however, than juftice im- he executed juftice in fuch a rigorous and impartial PartialIy* manner as made the boldeft offenders tremble. Some parties of his own foldiers, prefuming upon the licence that had hitherto been granted them, entered Gondar and began to plunder as they had done in other places j but, on the very firft complaint, their commander cau- fed 12 of them to be apprehended and hanged. Their execution was followed by 50 others in different quar¬ ters of the city ; after which he gave the charge of the capital to three officers who were to preftde over three quarters, himfelf taking care of the fourth. Two ci¬ vil judges were appointed to affift each officer in a di- ftrift, two were left in the king’s houfe, and four of them held a court of judicature in his own. Thus the inhabitants, finding, that inltead of bloodflied and maf- facre, they were to expedt nothing but ftridt equity and moderation, became reconciled to Michael the day after his arrival, and lamented only that he had not come fooner to relieve them from the anarchy and eonfufion in which they had been held fo long. To fo great a degree of periedlion indeed did he bring his legiflation, that a very ihort time after he entered the city, a loaf of bread, a bottle of water, and an ounce of gold, were expofed in the market-place on the head of a drum night and day for fome time, with¬ out any one offering to take them away. This was the more remarkable as there was then a fcarcity of pro- vifions, and Michael himfelf would allow but a very fcanty fupply of water to be carried into the city ; thereby giving the inhabitants to underftand, that if he fhould fet fire to it as he had done to other places,s it would not be in their power to quench the flames",Gondar,ET,4,Ethiopia,Africa
"deftruftion of this worthy nobleman would be attend¬ ed with a great degree of odium, he was refolved that none of it, or at leaft as little as poffible, Ihould fall' upon himfelf. For this purpofe, he infilled that the emperor Ihould march in perfon from Gondar, and carry all his foldiers along with him. Thus he had an opportunity of throwing the whole blame upon loas,",Gondar,ET,4,Ethiopia,Africa
"Same of his The 12 officers, who were taken along with him, officers pro- fou„bt proteftion in the tent of Ras Michael, to which MichaeL they were fuffered to efcape by Woofheka their keep¬ er. Lubo, however, intended likewife to have facri- ficed them as he had done Mariam, and therefore lent Wooffieka to demand them : but no fooner had he un¬ folded his errand, than Michael in a rage, called to his attendants to cut him in pieces before the tent door •, which would certainly have been done, had he not fled with the utmoft precipitation",Same,TZ,4,"Tanzania, United Republic of",Africa
"Fafil abfolutely refufed to obey any fuch jurifdiftion ; and the affair being laid before the other judges, it vTas > given in favour' of Michael, and b afil declaied to be in rebellion. This was followed by a proclamation de-Final quar- priving him of his government of Damot, and every «Hetwixt other public office he held.. Fafil, however, had nognH Fafit mind to fubmit to this difgrace j and therefore, aiter holding a long conference with the king, departed with his army, encamping on the high road betwixt Damot A To c fire el¬ and Gondar, where he intercepted the provtfions com- ing from the fouthward to the capita*, I his n.'as paiace win_ followed by an attempt to affaffinate the Ras. A ffiotdow",Gondar,ET,4,Ethiopia,Africa
"94 ] A B Y garded her former huiband, lire entirely forgot her Abyffinia, charafrer. The night on which this miferable viftim was deftroyed, ihe appeared, in the king’s tent dreffed like a bride 5 and in a little time returned in triumph to Gondar",Gondar,ET,4,Ethiopia,Africa
"On the 15th of November 1769 Mr Bruce left Ar-Sets out keeko, and the eaftern coaft of Africa, and proceeded fr°m Ar- fouthwards ^for Gondar the capital of Abyffinia. keeko",Gondar,ET,4,Ethiopia,Africa
"In this journey he told him that he would be obliged to crofs the mountain of Taranta, the higheft in Abyf- linia 3 but the fatigue of this woulfi be more than re- compenfed by the affurance of fafety and the curiofity of the place. Taking leave of Achmet in a very friendly manner, therefore, Mr Bruce with his com¬ pany finally fet out on their journey the evening of the 16th. For the ftiort fpace they had travelled, the Account of ground was covered with grafs broader in the leaf thant,ae country ours 3 but in a little time the foil became hard, dry, v,e gravelly, and full of acacia or Egyptian thorn. Next pa|Tccq day (the 17th) they changed their courfe from fouth to weft 3 and foon arrived at a range of mountains Hand¬ ing fo clofe to oire another, that there was no pet ffage between them excepting what was worn by torrents of water 3 the bed of one of which confequently now be¬ came their road. In the evening they pitched their tent at fome diftance from this torrent, which had fcarcely any water in it when they left it 3 but all tire afternoon there had been an appearance of rain, with much A B Y [ 95 ] Notes of AbyiTmia. mucli thunder and lightning, at a didance. On a fudden they heard a noife among the mountains louder than thunder j and inftantly faw the torrent, fwelled immenfely by the diiiant rains, now running like a rapid river, and the foremoft part of it advancing in its bed in a body of water about the height of a man",,EG,4,Egypt,Africa
