Entry,City,Country code,Edition,Country,Continent
"There are medals in commemoration of this faft, in which he is reprefented holding a flambeau in his hand, to fet fire to all thofe bonds which he had made void. He went to vifit all the provinces ; and did not return to Rome till the year 118, when the fenate de¬ creed him a triumph and honoured him with the title of Father of his country ; but he refufed both, and de- fired that Trajan’s image might triumph. No prince travelled more than Adrian 5 there being hardly one province in the empire which he did not vifit. In 120 he went into Gaul; from thence he went over to Britain, in order to fubdue the Caledonians, who were making continual inroads into the provinces. Upon his arrival they retired towards the north : he advanced, however, as far as York, where he was diverted from his intended conqueft by the defeription fome old foldiers he found there, who had ferved under A- .jrricola, gave him of the country. In hopes, there- rore, of keeping them quiet by enlarging their bounds, he delivered up to the Caledonians all the lands lying between the two friths and the Tyne j and, at the fame time, to fecure the Roman pro- ""vince from their future incurflons, built the famous wrall which fliill bears his name (a). Having thus fet¬ tled matters in Britain, he returned to Rome, where he wTas honoured wdth the title of Rertorer of Britain, as appears by fome medals. He foon after went into Spain, to Mauritania, and at length into the Ealt, where he quieted the commotions raifed by the Par- thians. After having vifited all the provinces of Afia, he returned to Athens in 125, where he palled the Von. I. Part L 93 ] ADR winter, and was initiated in the myfteries of Eteufinian Ceres. Pie went from thence to Sicily, chiefly to viewT ' Mount Attna, contemplate its phenomena, and enjoy the beautiful and extenfive profpe£l afforded from its top. He returned to Rome the beginning oi the year 129 ; and, according to fome, he went again, the fame year, to Africa j and, after his return from thence, to the call. He w^as in Egypt in the year 132, revifited Syria the year following, returned to Athens in 134, and to Rome in 135. The perfecution again!! the Chriftians was very violent under his reign 5 but it was at length fufpended, in confequence of the remonftrances of Quadratus biffiop of Athens, and Ariftides, two Chri- llian philofophers, who prefented the emperor with fome books in favour of the Chriftian religion. He con¬ quered the Jews; and, by wray of infulf, eredled a temple to Jupiter on Calvary, and placed a ftatue of Adonis in the manger of Bethlehem \ he caufed alfo the images of fwine to be engraven on the gates of Je- rufalem. At laft he w^as feized with a dropfy, which vexed him to fuch a degree, that he became almoi! raving mad. A great number of phyficians were fent for, and to the multitude of them he aferibed his death","Rome, Adrian, York, Roman, Rome, Athens, Ceres, Rome, Athens, Rome, Athens, Jupiter, Bethlehem","US,ZA,ES,MR,EG,SY,RO",4,"United States,South Africa,Spain,Mauritania,Egypt,Syrian Arab Republic,Romania","North America,Africa,Europe,Africa,Africa,Asia,Europe"
"ADULE, or Adulis, \\\ Ancient Geography,p.lovtn of Egypt built by fugitive Haves, diftant from its port on the Red fea 20 ftadia. Pliny calls the inhabitants Aduliter. The epithet is either Aduhtanus; as. Mo- numentum Adulitanum, on the pompous infeription of the ftatue of Ptolemy Euergetes, publilhed by Leo Alatius at Rome in 1631, and to be found in Spon and Thevenot: or, Adulicus y as, Adulicus Sinus, a part of the Red fea",Rome,"EG,US",4,"Egypt,United States","Africa,North America"
"To eafe thefe four firft aediies, Caefar created a new- kind, called cediles cereales, as being deputed chiefly tcr take care of the corn, which was called donum Cereris ;<■ for the Heathens honoured Ceres as the goddefs wrho prefided over command attributed to her the invention- of agriculture. Thefe aediles cereales w-ere alfo taken- out of the order of patricians. In the municipal ci¬ ties there were aediles, and with the fame authority as* at Rome","Ceres, Rome","ZA,US",4,"South Africa,United States","Africa,North America"
"AlGIMURUS, in Ancient Geography, an illand in- the bay of Carthage, about 30 miles diilant from that city, (Livy); now the : This ifland being after¬ wards funk in the Tea, two of its rocks remained above water, which were called yfrayand mentioned by Vir¬ gil, becaufe the Romans and Carthaginians entered in¬ to an agreement or league to limit their refpeflive boundaries by thefe rocks",Carthage,TN,4,Tunisia,Africa
"Alt eric, furnamed Bata, pupil of the former, was promoted to the archbilhopric of York in 1023, and died in 1051","Bata, York","GQ,US",4,"Equatorial Guinea,United States","Africa,North America"
"AEM, Am, or Ame, a liquid meafure ufed in moft parts of G ermany; but different in different towns : the aem commonly contains 20 vertils, or 80 maffes; that of Heidelberg is equal to 48 maffes ; and that of Wirtemberg to 160 maffes. See Aam",Heidelberg,ZA,4,South Africa,Africa
"AERIA, or Eeria, in Ancient Geography, the an¬ cient name of Egypt. The fcholiaft on Apollonius Rhodius, fays, that not only Theffaly, but Egypt, was called by the Greeks, which Eufebius alfo con¬ firms : and hence Apolliuarius, in his tranilation of the 114th Pfalm, ufes it for Egypt. Hefychius applies this name to Ethiopia",,"EG,ET",4,"Egypt,Ethiopia","Africa,Africa"
"Some fpeak of this as a common praflice of his j but others mention his falling into this excefs only on a particular day, when he was treating his friends. Ho¬ race ^ fpeaks only of one pearl of great value, which JEftlnjatio he dilTolved in vinegar, and drank. Atfop, notwith- II Handing his expences, is faid to have died worth above iEther- 16o,oool. W hen he tvas upon the flage, he entered ",Ho,GH,4,Ghana,Africa
"On M. Houel’s arrival at Jaci Catena, he inquired for the phyfician of the place ; it being cuflomary for flrangers to do fo who want to learn any thing con¬ cerning the curiofities of the country, as the phyfi- cians there are generally thofe wdio have any preten- fions to literature. By this guide he was fhown a Account of? v7ell which they call Ho/y Water. There is a flight a remark- of Heps from the furface of the ground to that of the aUlL we water. The well itfelf is 20 feet vdde and 40 feet deep. It is fupplied by three different fprings, each of wdrich is faid to have a peculiar tafle. The phy¬ fician informed our author, that one of them refem- bled milk in its tafle j another tafled like foap •, and the third had the tafle of common vrater : but our au¬ thor, after tailing each of them, could not find any re¬ markable difference",Ho,GH,4,Ghana,Africa
"In his way to La Trizza, our author difeovered ^cient fome very ancient baths with ftoves. They had been built here on account of a fpring of warm fulphureous water, fuppofed to be excellent for the cure of cuta¬ neous diforders 5 and for which purpofe they are ftill made ufe of. They are now called the Springs of 67 Springs of Venera, of whom there is an image here. The loun-®1 Venera' tain from which they flow is on a level with the furface of the ground. The water taftes very difagreeably of fulphur ; and depofites a quantity of white impalpable powder, adhering to herbs and Hones, over which it paffes. This fubftance our author calls the cream of fulphur; though it is probably a felenitic fubftance formed by the decompofition of the fulphur, and the union of its acid with fome calcareous matter which held it in folution before","Springs, Springs",ZA,4,South Africa,Africa
"Its bafe, the vaft trails of level ground which lie adja¬ cent, the cities of Sicily, its parched Ihores, with the daftiing wraves and vaft expanfe of the ocean, gradual¬ ly prefented themfelves, while fome fleeting vapours, which moved fvviftly before the wind, fometimes veiled part of this vaft and magnificent profpeft.” In a ftiort time every thing was difplayed fo diftinftly, that they could plainly recognize all thofe places with which they were before acquainted. On the fouth wrere feen the hills of Camerata and Trapani $ on the north, the mounts Pelegrino and Thermini, with the celebrated Enna once crowned with the temples of Ceres and Proferpine. Among thefe mountains were feen a great many rivers running down, and appearing like as many lines of glittering filver winding through a variety of rich and fertile fields, walking the walls of 28 cities, while their banks wrere otherwife filled with villages, hamlets, &c. rifing among the ruins of the moft illu- ftrious republics of antiquity. On the fouth and north were obferved the rivers which bound by their courfe the vaft bafe of Mount Etna, and afford a delightful profpefl to the eye ; while at a much greater dirtance ■were feen the ifles of Lipari, Alicudi, Felicocide, Pa- rinacia, and Stromboli","Trapani, Enna, Ceres","IT,ZA",4,"Italy,South Africa","Europe,Africa"
"■—By them it was alfo called Libya. Since the difco- very of America, it has been confidered by the mo¬ derns as one of the four quarters of the globe",,LY,4,Libya,Africa
"The knowledge of the ancients concerning Africa feems to have been, in a great degree, limited to the countries adjoining to the Mediterranean or to the Red .fea. The ideas, howTever, wdiich Herodotus en¬ tertained of this great continent are by no means in- .-correft upon the wdiole : and it has been referved for our own.times to verify a part of the delcription wdiich he has given of the interior of Africa. Previous to his time, the whole fea coaft of this continent had been explored by the conduftors of an expedition fitted out by Mecho one of the kings of Egypt. It is to be Expedition oblerved that this TSecho took Sidon, and reduced of Necho Phoenicia and Paleftine. He muft therefore have pof- kmg °f E- felfed confiderable maritime power : Nor was he lefs IT? ■ powerful by land j for he marched through Paleftine |wnicia, and Syria to attack the Alfyrians near the Euphrates, and, in his way, defeated and flew Jofiah the king of Judah, who oppofed his march at Megiddo (2 Kings xxiii. 29.) Having defeated the Affyrians (or Baby¬ lonians) he placed a ftrong garrifon in Carchemifh, a fortified city on the Euphrates which he had taken j and, in his return, he took poffeflion of Jerufalem, call¬ ed Cadytis by Herodotus. This enterprizing prince employed a body of Phoenician mariners to circumnavi-circumna gate Africa, an undertaking which they accompliflied vigates A- with fuccefs. The following is the fliort narrative gi- trica",Sidon,"EG,SY,LB",4,"Egypt,Syrian Arab Republic,Lebanon","Africa,Asia,Asia"
"ven by Elerodotus of this remarkable tranfaftion : “ Except in that particular part which is contiguous to Herodotus’s Afia, the whole of Africa is furrounded by the fea. account <4 The firft perfon who has proved this, was, as far as we ’*• are able to judge, Necho king of Egypt. When he had defifted from his attempt to join by a canal the Nile with the Arabian gulf, he difpatched fome veffels under the conduft of Phoenicians, with direftions to pafsby the Columns of Hercules, and, after penetrating the Northern ocean, to return to Egypt. Thefe Phoe¬ nicians, taking their courfe from the Red fea, entered into the Southern ocean. On the approach of autumn they A F R [ 255 ] A F R Africa, tliey landed at Libya, and planted feme corn in the v——V""-""’ place where they happened to find themfelves : when this was ripe, and they had cut it down, they again de¬ parted. Having thus confumed two years, in the third they paffed the Columns of Hercules, and returned to E- gypt. Their relation may obtain attention from others, but to me it feems incredible 5 for they affirmed that, having failed round Africa, they had the fun on their right hand. Thus was Africa, for the firft time, known.” Many of the mofl eminent of the ancient kiftorians and geographers regarded this account of the circum¬ navigation of Africa as altogether fabulous, chiefly in confequence of the llory concerning the appearance affumed by the great celeftial bodies in the courfe of the voyage, which was then unintelligible, from the imper- feft ftate of the fcience of aftronomy. But the very cir- cumftances which, among the ancients, excited a doubt about the exiftence or fuccefs of fuch a voyage, mull now be regarded as affording the molt fatisfadtory in¬ ternal evidence of the veracity of the ancient Phoeni¬ cian navigators","Hercules, Hercules","EG,US,LY",4,"Egypt,United States,Libya","Africa,North America,Africa"
"The Carthaginians were the rivals of the Egyptians in commerce, and muff undoubtedly have explored a great part of the coaft of Africa j but, according to the ufual cautious and monopolizing fpirit of com¬ mercial Hates, it is probable that they concealed their difeoveries from other nations. As almofl no monu¬ ments of their literature now exift, we are deprived of the means of invefligating the full extent of their geo¬ graphical knowledge. One important document has, however, reached our times, which demonftrates the enterprizing fpirit of that people. This is, an appa¬ rently abridged journal of a voyage to the weftern coaft of Africa, undertaken by Planno the Carthaginian, about 30 or 40 years after the expedition above men¬ tioned under Necho king of Egypt. Herodotu^does not feem to have been informed of this undertaking of Han- no ; nor does Pliny appear to have feen the journal of the voyage, though he is no ftranger to its contents",,EG,4,Egypt,Africa
"Voyage of Planno is faid to have depofited, at his return, Hanno. the journal of his voyage in the temple of Saturn ; which may perhaps account for the means of its pxefer- vation. It begins by Hating, that “ it was decreed by the Carthaginians that Planno fliould undertake a voy¬ age beyond the Pillars of Plercules, and found Liby- phoenician cities. He failed, accordingly, with 60 (hips of 50 oars each, and a body of men and women to the number of 30,000, and proviftons and other neceflaries.” From the extent of this plan of colonization, or rather of eftablifhing permanent garrifons, upon the w’eftern coafts of Africa, it is evident that thefe coafts muft, in fome meafure, have been previoufly examined. Major Rennel, who has inveftigated the fubjedt with great ac¬ curacy, with a reference to the journal of the voyage, is of opinion that the Carthaginian or Libyphoenician cities founded by Planno, were all fttuated to the fouth of the ftrait of Gibraltar, and to the northward of the river Senegal j and that all of them, excepting one at Cerne, now called Arguin, were placed to the north of Cape Bojador. To the fouthward of Cerne, Hanno during his voyage made two expeditions; but it does not appear that he made any attempt to fix an eftablifti- ment beyond the limits now mentioned. On his firft expedition, he feems to have failed into the river Sene¬ gal, as may be fuppofed from the defeription given j for it is faid to be “ large and broad, and full of cro- Africa, codiles and river horfes”. During the fame voyage, ' ^ Hanno made a fecond expedition louthward, apparent¬ ly for the fake of difeovery. He appears to have doubled Cape Verd, and to have failed acrofs the mouth of the Gambia. His voyage is faid to have terminated at a place which he calls the Southern Horn, fuppofed to be either at Sierraleona, or, at a little diftance to the fouth of it, at Sherbro. It is evident, from the general ftyle of the journal, that the Carthaginians, at the time of this voyage, wrere altogether unacquaint¬ ed wuth the interior ftate of the country on this wreftern quarter of Africa. Excepting the mere defeription of the coaft, and its windings and bays, every thing is marvellous, and apparently fabulous. They talk of having caught two women covered with hair, whofe {kins they brought to Carthage, meaning, in all pro¬ bability, two monkeys of fome of the unknow n fpecies which abound in the country of the Negroes. They alfo talk of ftreams of fire, and of rivers of fire which feem- ed to be running into the fea. At one place, during the night, they faw a country which w as on fire: and af¬ terwards they faw another country full of fires ; in the middle of which was a lofty fire, larger than the others, wEich feemed to touch the ftars. When day came, they difeovered this elevated fire to be a large hill, which they called the chariot of the gods. Thefe wonders have been explained to us by later travellers; who remark that it is the cuftom, at certain feefons cf the year, in the country of the Negroes, to fet fire to the dry grafs 5 and that on thefe occafions, during the night, the whole territory feems to be a ftieet of flame. Defeription With regard to Africa in general, Herodotus de-of Africa feribes it in this fummary w ay : “ All that part of by Herodo- Libya towards the northern fea (Mediterranean), from Egypt to the promontory of Soloeis (now Cape Cantin on the coaft of Morocco) which terminates the third divifion of the earth, is inhabited by the different nations of the Libyans ; that diftridt alone excepted in poffeffion of the Greeks and Phoenicians. The remoter parts of Libya beyond the fea coaft, and the people who inhabit its borders, are infefted by various beafts of prey.—The country yet more difant is a parched and immeafarable defert.'"" Here this ancient hiftorian clearly diftingunhes three belts or regions parallel to the Mediterranean, the northernmoft of which we muft conceive to have been that which extended along the fea coaft, and was bounded on the fouth by Mount Atlas, and other ridges. The middle one is nowr called the Country of Dates, becaufe the inhabitants chiefly live on that fruit ; and the third is the great African defert. Beyond thefe, however, Herodotus had heard of a fourth region, belonging to the negroes : for, in- another place he divides the inhabitants of Africa ge¬ nerally into two races (with the exception of ftrangers, viz. the Phoenicians and the Greeks). The natives (fays he) are the Africans and Ethiopians, one of which poffeffes the northern, and the other the fouthern part of Africa.”—By thefe nations are evidently intended the Moors and the Negroes, which two claffes are as dif- tinft at the prefent day as they were in ancient times",Carthage,"GI,LY,SN,GM,EG,MA,TN",4,"Gibraltar,Libya,Senegal,Gambia,Egypt,Morocco,Tunisia","Europe,Africa,Africa,Africa,Africa,Africa,Africa"
"This author, whofe account of the ancient nations will always be a matter of much curiofity, becaufe he has juftly""been called the Father of Hi/lory, as being the earlieft authentic hiftorian whofe waitings have been APR [ 25 Africa, been trtmfmitted to us, gives a detailed account of the tribes that in his time inhabited the northern coaft of Africa, upon the borders of the Mediterranean j be¬ ginning with Egypt and proceeding weftward to the leffer Syrtis, mentioning only in general terms, the reft of the country to the promontory of Soloeis, (Gape Cantin), which was erroneoufly regarded by him as the moft welterly point of the coaft of Africa. The people •of this coaft he reprefents generally as Nomades, from Egypt weftward to the lake Tritonis, by which he means the leffer Syrtis, or gulf of Kabes ; and the country, he fays juftly, is low and fandy. The coun¬ try farther to the weft, called Africa Proper, or Nu- thidia by the Romans, including the prefent ftates of Morocco, Algiers, and Tunis, he. defcribes as moun¬ tainous and interfperfed with wood, and infefted by wild beafts and ferpents of an enormous fize. With¬ in this traft, however, he reprefents the inhabitants as hufbandmen who cultivate the ground and live in houfes. Mount Atlas is mentioned by him in the fame magnificent terms in which all the ancient waiters fpeak of it. “ At every approach it appears round and fteep, and fo lofty that its fummit can never be diftinguifhed by reafon of the clouds that envelope it.” Egypt was, in the days of Herodotus, a rich and po¬ pulous ftate, from which the Greeks had derived a great part of their arts and of their religion. Begin¬ ning from Egypt and proceeding weftward, he enu- Inhabitants merates the Africans in the following manner. The of Africa, are tbe Adyrmachidee, whofe manners were in toHerodo eveiT relpe£l Egyptian, that is to fay, civilized. He tus> imputes to them, however, a barbarous cuftom, that their king poffeffed the privilege of fleeping the firft night with every new married woman. They inhabi¬ ted the coaft between Egypt and the port of Pleunos, adjoining to what is now called the defert of Barca","Algiers, Tunis","EG,MA,DZ,TN",4,"Egypt,Morocco,Algeria,Tunisia","Africa,Africa,Africa,Africa"
"6 1 A F R The Nafamones, according to Herodotus, were the A moft powerful of the Nomadic tribes upon this coaft."" They bordered upon the greater Syrtis, now called the gaff of Sort. He fays, that during the fummer feafon they leave their cattle on the coaft, and go up into the country to gather dates at a place called Augela, wduch will be aftenvards noticed. The Na¬ famones are faid to have feized upon the territories of the Pfylli. Thefe wrere a people who poffeffed the repu¬ tation of being able to charm ferpents, and to cure the wounds occafioned by their ftings. Cato is faid by Plu¬ tarch to have carried fome of the Pfylli with him for that purpofe, in his memorable march round the greater Syr¬ tis. It is certain that, in modem times, in Egypt, Abyf- finia, and India, certain perfons are believed to poffefs the power of completely fubduing ferpents of the moft venomous kinds, fo as to have them entirely under their command. They are faid to feize on them with their naked hands, without apprehenfion of mifehief, and this, not only on ferpents they have already been accuftomed to, but on fuch as they never faw before",,"EG,IN",4,"Egypt,India","Africa,Asia"
"With regard to the interior of Africa the know¬ ledge of Herodotus was very indiftinft. He mentions Ethiopia in a w^ay that in fome meafure correfponds with Nubia, and Abyflinia: “ Ethiopia, (fays he), “ which is the extremity of the habitable world, is contiguous to Arabia on the fouth-weft. It produces gold in great quantities, - elephants with their prodigi¬ ous teeth, trees and (hrubs of every kind, as wrell as ebony. Its inhabitants are alfo remarkable for their * fize, their beauty, and their length of life.” To Ethiopia, however, he gives a wide extent, fo as to in¬ clude A F R [ 257 [ A F R Africa, elude the whole region inhabited by men of a black complexion, as he calls it, the “ extremity of the ha¬ bitable world.” The remoteft fource of the Nile was pire",,ET,4,Ethiopia,Africa
"unknown in his days } and after all the efforts that have been made for its difeovery, it may be regarded las having hitherto been vifited by no European. He fuppofes, however, that the courfe of the Nile, “ with¬ out reckoning that part of it which flowTs through Egypt, was known to the extent of four months jour¬ ney, partly by land, partly by w^ater 5” but beyond this its courfe was unknown, though he fays “ it is certain that the Nile rifes in the well.” The moll remarkable fa cl, however, mentioned by Herodotus concerning^ the inveftigation of the interior of Africa conlifts of the adventures of certain Nafamones w'ho came from the neighbourhood of Gyrene, now called Kurin. He fays that they made an expedition into the interior of Africa, with a viewT to extend their difeoveries beyond all preceding adventurers. No attempt is made to Hate the dillance to which they penetrated ; but it mull have been very great, “ firll proceeding through the region w'hich wTas inhabited, they next came to that which was infelled by wdld beads 5 leaving which, they diretted their courfe welhvard through the defert, and w’ere finally taken prifoners by black men of a di¬ minutive llature, and carried to a city walked by a great river, which flowed from wrell to call, and abounded in crocodiles.” Of this great river nothing farther was ever difeovered by the ancients. Hero¬ dotus thought that it w^as probably the Nile, and Pliny calls it the river Niger, or the river of the blacks or Ethiopians",Of,"EG,NE,TR",4,"Egypt,Niger,Turkey","Africa,Africa,Asia"
"Irruption of Thefe barbarians crolfed the llraits of Gibraltar, and the Van- foon became mailers of the country. About a century thereafter, their defeendants, in a fertile and enervating climate, having loll their military charadler, were vanquilhed by the celebrated Belifarius under Julli- nian, then at the head of the eallern divifion of the Roman empire. At a later period, when Mahomet had roufed his countrymen to war and conquell, under the influence of a furious fanaticifm, Egypt and the rell of the north of Africa wrere overrun by the Arabs, or, as they are called, the Saracens, A. 13. 647",Roman,"GI,EG,RO",4,"Gibraltar,Egypt,Romania","Europe,Africa,Europe"
