Entry,City,Country code,Edition,Country,Continent
"Sir Ifaac Newton is of opinion, that the Egyptian Of Menes princes Menes, Memnon, and Amenophis, w*ere the and his fuc- fame perfon ; and that by him Memphis was eithercel ors* originally built or fir ft fortified, in order to prevent the Egyptians from entering Ethiopia. He is alfo fuppofed to have been the fon of Zerah, and to have died at a very advanced age about 90 years after the deceafe of Solomon. Thus, according to Sir Ifaac Newton’s chronology, the moft remarkable tranfac- tions of antiquity will be brought lower by ages than by the ufually received computations. According to this, the Argonautic expedition happened in the time of Amenophis 5 though fome Greek wuiters inform us, that the fame prince affifted Priam king of Troy with a body of forces. He was fucceeded by Ramafles, al¬ ready mentioned, who built the northern portico of the temple of Vulcan at Memphis. The next was Moeris } who adorned Memphis, and made it the capital of his empire, about two generations, after the Trojan war","Newton, Memphis, Newton, Troy, Vulcan, Memphis, Memphis","US,ET,RO,GR",4,"United States,Ethiopia,Romania,Greece","North America,Africa,Europe,Europe"
"Cheops, Caphrenus, and Mycerinus, fucceeded in order to Moeris; the laft being fucceeded by his fifter Ni- tocris. In the reign of Afychis her fucceffor, both Ethiopia and Affyria revolted from Egypt*, which, being now divided into feveral fmall kingdoms, w*as quickly fubdued by Sabacon or So, the emperor of Ethiopia. This monarch, foon after his acceffion. to the throne of Egypt, allied himfelf with Hoffiea king of Ifrael; by which means the latter was induced to o revolt A B Y [ 55 ] Abyfilnia",,"ET,EG",4,"Ethiopia,Egypt","Africa,Africa"
Ethiopia fubdued by • Efarh ad¬ don,,ET,4,Ethiopia,Africa
"revolt from tlie Aflyrians j and in conrequence of this, an end was put to the kingdom of Ifrael by Shalma- nefer king of Affyria, in the 24th year of the era of Nabonaffar, and 720th before the commencement of the Chrilcian era. According to Herodotus, this mo¬ narch voluntarily refigned the crown of Egypt after he had enjoyed it $o years j but Africanus relates, that after a reign of eight years, he died in Egypt, in the ninth year of Hezekiah king of Judah. His fuccefior Sethon, fuppcfed to be the Sevechus of Manetho, ad¬ vanced to Pelufmm with a powerful army againft Sen¬ nacherib king of Affyria ; when the bowftrings of the Affyrians were gnawed in pieces by a great numoer of rats or mice, and thus they were eaftly defeated with great daughter by the Egyptians. Hence Herodotus informs us, that the ftatue of Sethon which he faw in Egypt, had a moufe in its hand. Sir Ifaac Newton, however, explains the whole in an allegorical mannei",Newton,"EG,US",4,"Egypt,United States","Africa,North America"
"In the 78th year of the era of Nabonaffar, the em¬ pire of Ethiopia was fubdued by Elarhaddon king of Affyria-, who held it three years, committing enor¬ mous cruelties both in that country and in Egypt",,"ET,EG",4,"Ethiopia,Egypt","Africa,Africa"
"After his death the Ethiopians (hook off the yoke, and maintained their independency till the time of Cyrus the Great, the firft king of Perfia 5 who, according to the Greek hiftorian Xenophon, feems to have alfo been fovereign of Ethiopia. After nis death they revolted, and his fon Cambyfes unfuccefsfully attempted to re¬ duce them. Herodotus informs us, that before he un¬ dertook this expedition, he fent fome of the^Ichthya- phagi ambafladors to the king of the Macrobii or long- lived Ethiopians, under pretence of foliciting his friend- ftiip, but in reality to obferve the ftrength of the coun¬ try. Of this the Ethiopian prince was aware, and told the ambaffadors that he knew their defign, reproached Cambyfes with his injuftice and ambition, and gave them his bow 5 telling them at the fame time, that the Perfians might think of invading Ethiopia when they could eafily bend it ; and in the mean time, that their mafter ought to thank the gods who had never in- fpired the Ethiopians with a defire of extending their territories by conqueft. Cambyfes had fent by the ambaffadors a rich purple robe, gold bracelets, a box of precious ointment, a veffel full of palm wine, and other things, which he imagined would be acceptable to the Ethiopian monarch. But all thefe, excepting the wine, were defpifed. This,_he owned, was fuperior to any liquor produced in Ethiopia ; and he did not fcruple to intimate, that the Perfians, (hort-lived as they were, owed moft of their days to the ufe of this excellent liquor. Being informed by the ambaffadors that a confiderable part of the food made ufe of by the Perfians was bread, he faid that it was no wonder to find people who lived on dung unable to attain the longevity of the Macrobian Ethiopians. In Ihort, the A B Y whole of his anfwer was fo contemptuous and' aifguft- ^.byfcp'iu ing, that Cambyfes was filled with the greateft indig- ‘ "" """"Y '~""'a nation ; in confequence of which, he inftantly began his march without taking time to make the neceffary preparations, or even to procure provifions of afty kind for his army. Thus a famine enfued among them 5 which at laft became fo grievous, that the foldiers were obliged to eat one another: and Cambyfes himfelf, finding his life in great danger, was obliged to give orders, for marching back again \ which was not ac~ compliftied without the lofs of a great number _ of men. Another army which he lent on an expedition againft Ammonia, in order to deftroy the celebrated oracle of Jupiter Ammon, perifhed entirely in the de- ferts, being overwhelmed with the vaft clouds ox fand frequently raifed there by the wind",Of,"ET,TR,GR",4,"Ethiopia,Turkey,Greece","Africa,Asia,Europe"
"At this time, it is doubtful whether Cambyfes would Ethiopia at have accomplilhed his purpofe even if he had found a pra£hcable to march into the heart of Ethiopia. 1 his gj-jjpije",,ET,4,Ethiopia,Africa
"once to the emperor of Ethiopia, who placed them in a country difaffefted to him 5 ordering them to expel the inhabitants, and take poffeflion of their lands. Not- Ethiopia withftanding this, however, Sir Ifaac Newton hints, b7 that Cambyfes conquered Ethiopia about the 223d or Newton to 224th year of the era of Nabonaflarbut his opinion have been in this reipeft does not appear to be well founded, conquered We are told indeed, that the Perfian monarch, not- JT Camby- withftanding the misfortunes he met with in the expe¬ dition above mentioned, did really make himlelf ma¬ fter of fome. of the Ethiopic provinces which bordered on Egypt 5 and that thefe, together with the Troglo¬ dytes, 'fent him an annual prefent of two choenixes of unrefined gold, 200 bundles of ebony, five Ethiopian boys, and 20 elephants teeth of the largeft fize : but it appears improbable to the laft degree, that even though. Cambyfes had employed the whole of his reign in the attempt, he could have conquered the vaft .re- gionsof Ethiopia Proper, Sennaar, and Abaflia, which were all included m the Ethiopia of the ancients","Newton, Newton","ET,US,EG",4,"Ethiopia,United States,Egypt","Africa,North America,Africa"
"The latter were alfo differently armed, having darts lighted at one end and covered with leather.. We are not informed particularly from what nations theie troops were brought, nor whether they were naturae fubjecls of the king of Perfia, or only auxiliaries : of confequence we can conclude nothing certain concern¬ ing the dominion of the Perfian monarchs at this time over Ethiopia, farther than that they might poff-ft fouie of the provinces next to Egypt 3 while the mam body A B Y AbyfTirmi. body of tlic empire being in a Rate of independence, ' and unconnecled with other parts of the world, is not taken notice of by the hiftorians of thofe times",,"ET,EG",4,"Ethiopia,Egypt","Africa,Africa"
"Though Alexander the Great had a defire to know the fources of the Nile, he did not fuffer himfelf to be diverted by this curiofity from purfuing his grand ex- Ethiopia pedition into Perfia. Ptolemy Euergetes, however, conquered appears to have carried this curiofity to fuch an extre- by Ptolemy m;ty as to invade Ethiopia for no other purpofe. It ^ ' is furprifing that the particulars of this expedition are not recorded by any hiftorian, as it appears by an in- fcription that he penetrated to the fartheft parts of the empire, and conquered the mod powerful nations in it",,ET,4,Ethiopia,Africa
"Of this we have the following account, which is looked upon by the bed hidorians to be authentic. It was copied on the fpot (being the wedern entrance to A- dule, one of the cities of Ethiopia) by Cofmas Egypti- us, or, as fome call him, Cofmas Indicopleudes, in the time of the emperor Judin I. by order of Eled)aan king of the Axumites, and of which the following ac¬ count is given by the perfon who copied it. “ Here (fays he), facing the road to Axuma, dood a chair of white marble, confiding of a fquare bafe, a fmall thin column at each angle of this bafe, with a larger wreathed one in the middle, a feat or throne upon thefe, a back and two fides. Behind this chair there xvas a large done three cubits high, which had fudain- ed confiderable injury from time. This done and chair contained an infcription to the following pur¬ pofe : ‘ Ptolemy Euergetes penetrated to the farthed parts of Ethiopia. Pie fubdued Gaza, Agame, Signe, Ava, Tiamo or Tziamo, Gambela, Zingabene, An- gabe, Tiama, Athagaos, Calaa, Semene, Lafine, Zaa, Gabala, Atalino, Bega, the Tangaitae, Anine, Metine, Sefea, Raufo, Solate, the territory of Raufo, and feve- ral other kingdoms. Among the nations he reduced, were fome inhabiting mountains always covered with a deep fnow ; and others feated upon the ridges of hills, from whence iflued boiling deams, and craggy preci¬ pices, which therefore feemed inaccedible. Having finally, after all thefe conqueds, affembled his whole army at Adule, he facrificed to Mars, Neptune, and Jupiter j for his great fuccefs, he dedicated this chair or throne to Mars.’ 'Conqueft From the time of this conqueror to that of the em- «f Ethiopia peror Augudus, we meet with nothing of any confe- •ty the Ro- qUence relating to Ethiopia Proper. The Roman forces having about this time been drawn out of E- gypt, in order to invade Arabia, Candace queen of E- thiopia, or perhaps rather of the ifland or peninfula of Pvleroe, took the opportunity of their abfence to make an irruption, with a numerous army, into the province of Thebais. As there was at that time no force to oppofe her, fhe met for fome time with great fucccfs; but hearing at lad that Petronius, governor of Egypt, was in full march to attack her, die retired into her own dominions. Petronius purfued her as far as Pfelcha, where with 10,000 men he gained an eafy vi&ory OA'er 30,000 undifciplined Ethiopian favages, armed only with poles, hatchets, and other clumfy or infignificant weapons of a fimilar nature. This vic¬ tory was foon followed by the reduftion of feveral fortreffes ; however, as the Roman foldiers were ex- ceffively incommoded by the heat of the climate, Pe- .i-fonius, notwithftarxling his fuccefs, was obliged at [ 56 ] A B Y lad to retire. Soon after, Candace fent ambafiadors Abyfllnin to Augudus himfelf with fuch magnificent prefents,""V—*■' that the emperor is faid to have been thereby induced to grant her a peace on her own terms. From this time the Remans accounted themfelves maders of Ethiopia. Augudus was complimented on the great glory he had acquired ; and that he had, by reducing a country till that time unknown even to the Romans, finidied the cpnqued of Africa. No material altera¬ tion, however, took place in the adairs of Meroe, in confequence of this conqued, whether real or pretend¬ ed. Pliny informs us that it had been governed by queens, who bore the title of Candace, for feveral ge¬ nerations before that time ; and fo it continued to be afterwards, as we learn from Scripture, where we are informed that, in the reign of Tiberius, the fovereign of Ethippia was dill named Candace. Some indeed are of opinion that the Candace mentioned in the Adds of the Apodles was the fame with her who had been conquered by Augudus ; but this feems by no means probable, as the interval of time is by far too long to be allorved for the reign of a dngle princefs","Of, Gaza, Jupiter, Roman","ET,EG,TR,PS,US,RO",4,"Ethiopia,Egypt,Turkey,Palestine, State of,United States,Romania","Africa,Africa,Asia,Asia,North America,Europe"
"From an anecdote of the debauched emperor Helio- gabalus who was accudomed to confine his favourites, by way of diverfion, with old Ethiopian women, we may learn that fome interccurfe took place between the two empires, and probably that the Ethiopians owned fome kind of fubjedHon to the Romans. The Blemmyes,~a gang of mondrous banditti, who inhabited Account of the frontiers of Thebais, were vanquifhed by the em-^16^63^* peror Probus : but, towards the clofe of the third cen-' tury, we find them again become fo powerful, that in conjunclion with another nation called Nabate?, who inhabited the banks of the Nile near Upper Egypt, they committed fuch depredations in the Roman ter¬ ritories, that Dioclefian was obliged to affign lands to the latter, and to pay both of them a confiderable fum annually, to defid from their former pradlices. Thefe expedients did not anfwer the purpofe •, the favages continued their depredations till the time of the em¬ peror Tudinian, who treated them with more feverity, and obliged them to remain at peace. We are told by Procopius, that before the time of Diocledan, the Roman territories extended fo far into Ethiopia, that their boundaries were not 23 days journey from the capital, fo that probably the whole empire had been in a date of dependence on them","Roman, Roman","ET,RO",4,"Ethiopia,Romania","Africa,Europe"
"From the time of this emperor to that of their con- veriion to Chridianity, we find nothing remarkable in the hidory of the Ethiopians. Three hundred and twenty feven years are counted from the time of our Saviour to that of Abreha and Atzbeha, or from A- bra and Afba, who enjoyed the kingdom when the Ethiopians gofpel was preached in Ethiopia by Frumentius. Thd converted man was a kinfman and companion of a philofopher j° named Meropius, a native of Tyre ; who having tra- ^rumen- velled all over India, died on an ifland of the Red fea. this",Tyre,"ET,IN,LB",4,"Ethiopia,India,Lebanon","Africa,Asia,Asia"
"After his death Frumentius, with another named /E- defius, who had alfo been his companion, were brought before the king of Ethiopia, to wham that idand was fabjeft. He took them into his fervice ; making the one his treafurer and the other his butler. On the death of this prince, the queen conceived fuch a favour for them, that fhe refufed to allow them to depart out of the kingdom 3 but committed the management of her ' /• A B Y the ele- fhaxit",,ET,4,Ethiopia,Africa
"The two princes Abra and Afba, who reigned joint¬ ly in Ethiopia in the time of Frumentius, lived in fuch harmony together, that their friendlhip became almoft The two proverbial. After being converted to Chriftianity, kings re- they adhered llriftly to the orthodox doftrine, refufing fufe to ad- to admit an Arian bifhop into their country. In the t'rae ^ie emperor Conftantius, however, this herefy wras introduced, and greatly favoured by that monarch; and an attempt was made to depofe Frumentius on ac¬ count of his refufal to embrace it",,ET,4,Ethiopia,Africa
"Miraculous The termination of the w7ar, according to the Arabian tfeftruxftion hiltorians, was miraculous. A vaft number of birds ®i the E- named Ababil came from the fea, having faces like ^ lions; each carrying in its claws a fmall ftone about the fize of a pea, which they*let fall upon the Ethio¬ pian army in fuch numbers, that every one of them was deftroyed. At this time it is faid that the fmall- pox firrt made its appearance ; and the more probable account of the deftruftion of the Ethiopian army is, that they perilhed by this diftemper",,ET,4,Ethiopia,Africa
"with. In the time of this prince a violent perfecution chnftians of the Chriftians took place in Arabia. The Jewifh perfecuted religion had now fpread itfelf far into that peninfula ; in Arabia, and in many places the profeflbrs of it were become abfolute mafters of the country, infomuch that feveral Jewifli principalities had been eredted, the fovereigns of which commenced a fevere perfecution againft the Chriftians. Among the reft, one Phineas diitinguilh- Cruelty of ed himfelf by his cruelty, having prepared a great Phineasa number of furnaces or pits filled wuth fire, into w ’hich Jewiih he threw thofe who refufed to renounce Chriftianity. ijU‘x"" The Chriftians applied for relief to the emperor Juftin ; but he being at that time engaged in a war with the Perfians, could not interfere : however, in the year 522, he fent an embafly to Elefbaan, who wTas now alfo a member of the Greek church, intreating him to exert himfelf for the relief of the Chriftians of Ara¬ bia. On this the emperor commanded his general A- breha, governor of the Arabian province Yemen, to march to the afliftance of Aretas, fon to a prince of the fame name whom Phineas had burnt; while he himfelf prepared to follow wuth a more confiderable force. But before the arrival of the Ethiopian mo- He is tie- narch, young Aretas had marched againft Phineas, feated",Ara,"YE,IN,GR,ET",4,"Yemen,India,Greece,Ethiopia","Asia,Asia,Europe,Africa"
"and entirely defeated him. In a fliort time afterwards the emperor himfelf arrived, and gave Phineas a fe- cond defeat ; but notwuthftanding thefe misfortunes, it does not appear that either the principality of Phineas or any of the other Jewifti ones, wTas at this time over¬ turned, though it feems to be certain, that at the time we fpeak of, the Ethiopians poffefled part of the Ara¬ bian peninfula. According to the Arabian hiftorians, the wTar of the elephant, with the miraculous deftruc- tion of the Ethiopian army, already mentioned, took place in the reign of Elelbaan",Ara,"IN,ET",4,"India,Ethiopia","Asia,Africa"
"Some hiftorians mention, that the Ethiopian mo- narchs embraced the doiftrines of Mahomet foon after the impoftor mode his appearance ; but this feems not to be well-founded ; though it is certain that the Najajhi or Ethiopian governor of Yemen embraced Mahommedanifm, and that he w7as related to the royal family. On this occafion, however, the Ethiopians loft all the footing they once had in Arabia ; the go¬ vernors being expelled by Mohammed and his fuccef- foi-s. They fled to the African fide of the Red feaEtKi0p[am with numbers of their fubjefts, where they erefted fe- driven out veral fmall kingdoms, as Adel, Wypo, Hadea, Mara, of Arabia, and others, which ftill continue",,"ET,YE",4,"Ethiopia,Yemen","Africa,Asia"
"During the conquefts of the caliphs, the Jewrs were for fome time everywhere driven out of their domi¬ nions, or opprefled to fuch a degree that they volun¬ tarily left them. Ethiopia offered them an afylum : Krurnber of and in this country they became fo powerful, that a jews in E- revolution in favour of Judaifm feemed ready to take thiopia in- place. One family had ahvays preferved an indepen- creaf£h dent fovereignty on a mountain called Samen, the royal refidence being on the top of a high rock ; and feveral other high and rugged mountains were ufed by that people as natural fortreffes. Becoming by de- H grees A B Y [ 58 ] A B Y Royal fa¬ mily of E- thiopia mafl'acred by Judith",,ET,4,Ethiopia,Africa
"Abyffinia. grees more and more powerful, Judith the daughter of one of their kings formed a defign of overturning the Ethiopian government, and fetting afide the family of Solomon, who had hitherto continued to enjoy the fovereignty. This defign was facilitated by feveral cir- cumftances. The empire had been weakened by an un- fuccefsful war, famine, and plague ; the throne was poffeffed by an infant •, and the abfurd cuftom of con¬ fining the whole royal family on a rock named Damo, gave her an opportunity of cutting them all off at once by furprifing that place. Fortunately, however, the king himfelf efcaped the general catailrophe, and was conveyed by feme of the nobility of Amhara to the province of Xoa or Shoa; by which means the line of Solomon was preferved, and aftemards reftored, though not till after a very confiderable interval",,ET,4,Ethiopia,Africa
"Judith having by this maffacre eftablifhed her own powder, aflumed the imperial dignity, though in direct oppofition to an eltablifhed and fundamental law of the empire already mentioned, that no woman fhould enjoy the fovereign authority. The people, however, feem to have fubmitted quietly to her government, as (he fat on the throne for 40 years, and afterwards tranfmitted the fovereignty to her pofterity; five of whom reigned fucceiTively in this country. We are not furnifhed with any particulars concerning their reigns ; farther than that, during them, the people were greatly oppreffed. By fome means, of which hiftorians have not given any account, another revolution took place } and a new fet of ufurpers, related to the family of Judith, but not their direct lineal defeendants, fucceed- ed to the throne. Thefe were Chriftians, and govern¬ ed with much greater lenity than the Jewifh foyereigns had done ; but ftill, being ufurpers, none of their tranf- aftions are recorded in the Abyfiinian annals, excepting thofe of Lalibala, who was accounted a faint. He lived in the end of the 12th or beginning of the yjth century, and proved a great prince. At that time the Chriftians in Egypt were grievoufty perfecuted by the Saracens, who had a particular abhorrence at ma- fons, builders, and ftone-cutters; looking upon them as the chief promoters of idolatry by the ornaments they put upon their works. Thefe wrere joyful¬ ly received by Lalibala j who by affording them an afylum in his dominions, foon collected a great num¬ ber. -They were employed by him in hewing churches out of the folid rock, after the example of the an¬ cient Troglodytic habitations; and many works of this kind remain in the country to this day. He under¬ took, however, a ftill more difficult and arduous talk; no lefs than that of leffening the ftream of the Nile, undertakes and thus ftarving the whole kingdom of Egypt, now to diminifh jn han(ls Gf his enemies, and who perfecuted thofe the ftream ^ ^ reiigion> From the account given by Mr Bruce of this projedl, it appears that there really is a poffibili- ty in nature of accomplilhing it ; not indeed by turn¬ ing the courfe of the Nile itfelf, but by diverting that of many of its branches, which are the means of con¬ veying into it the water fupplied by the tropical rains, and by wffiich it overflows its banks annually. We are like wife affured by the fame author, that Lalibala fuc- ceeded in his enterprife fo far as to divert the courfe of two large rivers from the Nile, and that they have ever fince flowed into the Indian ocean. He next pro¬ ceeded to carry a level towards a lake named Zacvia, A new re¬ volution",,"EG,IN",4,"Egypt,India","Africa,Asia"
Chriftians perfecuted in Egypt f’ y to E- thiopia,,EG,4,Egypt,Africa
"into which many rivers, whofe ftreams contribute to Aby«iirfia^ increafe that of the Nile, empty themfelves; and had * this been accompliffied, there is no doubt that the lofs of fo much water would have been very fenfibly felt by the Egyptians. According to moft hiftorians, this enterpriftng monarch was prevented by death from pul¬ ing his defign in execution ; though Mr Bruce informs us&of a written account at Shoa, in which it was a;- ferted, that he wras diffuaded from it by ceitain monks, who told him, that by fending down fucb a quantity of water to the eaftern and dry parts of Africa, theie countries would loon become, fo fertile and populous that they would rival the empire of Ethiopia, oj' at ^eaiJ withdraw their allegiance from it entirely. I he re¬ mains of thefe works were feen by the Portuguefe am- baffador in 1522 Lalibala W the Nile",,ET,4,Ethiopia,Africa
"In this treaty, however, the good monk did not for¬ get his own intereft. He had founded a famous mo- naftery in Shoa, and was primate of the whole empire under the title of Abuna. He now infilled that one third of the kingdom Ihould be abfolutely ceded to bimfelf for the maintenance of his own dignity, and the fupport of the clergy, convents, &c» throughout the country ; he alfo infilled that no native Abyffi- nian fhould ever enjoy the fame dignity with himfelf, even though he ffiould have been chofen and ordained at Cairo, as was the cuftom with the Abyffinian pre- lates",Cairo,EG,4,Egypt,Africa
"Theie extraordinary terms were complied with, and uncertain* Icon Amlac raifed to’the throne of Ethiopia. He did ty of the not, however, remove the feat of government from the Abyffinian province of Shoa ; but continued at Tegulat the capi- hlkolT tal of that province during the whole of his lifetime, which continued 15 years after nis acceffion to the throne. We are ignorant of the tranfaftions of his reipn, as well as that of feveral of his fucceffois ; fi\c of whom afeended the throne in as many.years. From this quick fucceffion Mr Bruce is of opinion, tnat a ci¬ vil war had taken place among the candidates for the throne \ but the A.byffiruan annals make no mentu.?i of this ; neither have we any particular account of .the tranfaftions of the empire till the time of Amda Sion, who began to reign in 1312. . He was the fon of We- Reign of dem Araad, the youngeft brother of Icon. Amlac, Amda Sioa> and fucceeded to the throne on the death of his father",,ET,4,Ethiopia,Africa
