Entry,City,Country code,Edition,Country,Continent
"Of this we have the following account, which is looked upon by the bed hidorians to be authentic. It was copied on the fpot (being the wedern entrance to A- dule, one of the cities of Ethiopia) by Cofmas Egypti- us, or, as fome call him, Cofmas Indicopleudes, in the time of the emperor Judin I. by order of Eled)aan king of the Axumites, and of which the following ac¬ count is given by the perfon who copied it. “ Here (fays he), facing the road to Axuma, dood a chair of white marble, confiding of a fquare bafe, a fmall thin column at each angle of this bafe, with a larger wreathed one in the middle, a feat or throne upon thefe, a back and two fides. Behind this chair there xvas a large done three cubits high, which had fudain- ed confiderable injury from time. This done and chair contained an infcription to the following pur¬ pofe : ‘ Ptolemy Euergetes penetrated to the farthed parts of Ethiopia. Pie fubdued Gaza, Agame, Signe, Ava, Tiamo or Tziamo, Gambela, Zingabene, An- gabe, Tiama, Athagaos, Calaa, Semene, Lafine, Zaa, Gabala, Atalino, Bega, the Tangaitae, Anine, Metine, Sefea, Raufo, Solate, the territory of Raufo, and feve- ral other kingdoms. Among the nations he reduced, were fome inhabiting mountains always covered with a deep fnow ; and others feated upon the ridges of hills, from whence iflued boiling deams, and craggy preci¬ pices, which therefore feemed inaccedible. Having finally, after all thefe conqueds, affembled his whole army at Adule, he facrificed to Mars, Neptune, and Jupiter j for his great fuccefs, he dedicated this chair or throne to Mars.’ 'Conqueft From the time of this conqueror to that of the em- «f Ethiopia peror Augudus, we meet with nothing of any confe- •ty the Ro- qUence relating to Ethiopia Proper. The Roman forces having about this time been drawn out of E- gypt, in order to invade Arabia, Candace queen of E- thiopia, or perhaps rather of the ifland or peninfula of Pvleroe, took the opportunity of their abfence to make an irruption, with a numerous army, into the province of Thebais. As there was at that time no force to oppofe her, fhe met for fome time with great fucccfs; but hearing at lad that Petronius, governor of Egypt, was in full march to attack her, die retired into her own dominions. Petronius purfued her as far as Pfelcha, where with 10,000 men he gained an eafy vi&ory OA'er 30,000 undifciplined Ethiopian favages, armed only with poles, hatchets, and other clumfy or infignificant weapons of a fimilar nature. This vic¬ tory was foon followed by the reduftion of feveral fortreffes ; however, as the Roman foldiers were ex- ceffively incommoded by the heat of the climate, Pe- .i-fonius, notwithftarxling his fuccefs, was obliged at [ 56 ] A B Y lad to retire. Soon after, Candace fent ambafiadors Abyfllnin to Augudus himfelf with fuch magnificent prefents,""V—*■' that the emperor is faid to have been thereby induced to grant her a peace on her own terms. From this time the Remans accounted themfelves maders of Ethiopia. Augudus was complimented on the great glory he had acquired ; and that he had, by reducing a country till that time unknown even to the Romans, finidied the cpnqued of Africa. No material altera¬ tion, however, took place in the adairs of Meroe, in confequence of this conqued, whether real or pretend¬ ed. Pliny informs us that it had been governed by queens, who bore the title of Candace, for feveral ge¬ nerations before that time ; and fo it continued to be afterwards, as we learn from Scripture, where we are informed that, in the reign of Tiberius, the fovereign of Ethippia was dill named Candace. Some indeed are of opinion that the Candace mentioned in the Adds of the Apodles was the fame with her who had been conquered by Augudus ; but this feems by no means probable, as the interval of time is by far too long to be allorved for the reign of a dngle princefs","Of, Gaza, Jupiter, Roman","ET,EG,TR,PS,US,RO",4,"Ethiopia,Egypt,Turkey,Palestine, State of,United States,Romania","Africa,Africa,Asia,Asia,North America,Europe"
"From the time of Theodorus to that of Zara Jacob who began his reign in 1434, the Abyflinian annals fur- nilh us with little or nothing of any confequence. The zara jaco^ character of this prince is reprefented as by no means in- faid to e- ferior to that of Theodorus, or indeed of any monarch qu£d Solo- that ever fat on the throne of Ethiopia, or any othermon* kingdom in the world. He is, in ftiort, fet forth as another Solomon, and a model of what fovereigns ought to be; though, from feme particulars of his reign, his charatter ftiould feem to be rather exag¬ gerated. The firft remarkable tranfa&ion of this Sends an great monarch was his fending an embaffy to the embafly to council of Florence. The ambaffadors wTere certain ''f priefts from Jerufalem, who in that aflembly adhered0 * to the opinions of the Greek church; and the em¬ baffy itfelf was judged to be of fuch confequence as to be the fubjefl of a pitfture in the Vatican. This prince obtained alfo a cbnvent at Rome from the pope for the ufe of the Abyffmians; which is ftill preferved, though very feldom vifited by thofe for whom it was defigned. He feems to have been very defirous of keeping up a correfpondence with the Europeans as well as the Afiatics ; and in his time we firft read of a difpute in Abyflinia with the Frangi or Franks on the fubjeft of religion. This was carried on in pre- a party for fence o""f the king between one Abba George and a Ve-the church netian painter, Francifco de Branco Lone, in which „ the former confuted and even convinced his antago- orme nift ; but from this time we find a party formed for the church of Rome, and which probably took its rife from the embaffy to the council of Florence","Florence, Rome, Rome, Florence","US,ET,VA,GR",4,"United States,Ethiopia,Holy See (Vatican City State),Greece","North America,Africa,N/A,Europe"
"The prince of whom wre now treat was the firft who introduced perfecution on a religious account into his dominions 5 and for this reafon, moft probably, he is fo highly commended by the ecclefiaftics. The ft ate Religious of religion in Abyffmia was now indeed very corrupt, perfecution 1’he Greek profeflion had been originally eftabliftiedintro<iuce^ from the church of Alexandria; but in the low pro¬ vinces bordering on the coaft of Adel, the Mahome¬ tan fuperftltion prevailed. Many of that perfuafion had alfo difperfed themfelves through the towns and villages in the internal parts of the empire, fthile in not a few places the groffeft idolatry ftill took place; fuch as the worftiip of the heavenly bodies, the wind, trees, cows, ferpents, &c. All this had hitherto paffed un¬ noticed ; but in the reign of Zara Jacob, fome fami- _ lies A B Y [ 63 ] A B Y Abyflinia. Hcs being accufed of worfhipping tbe coT.v and fer- pent, were brought before the king, who pronounced fentence of death upon them. Their execution -was followed by a royal proclamation, that whoever did not carry on his right hand an amulet with thefe words upon it, “ I renounce the devil for Chrift our Lord,” fhould not only forfeit his perfonal eftate, but Amda Sion be liable to corporal puniftiment. The fpirit of per- a cruel in- fecution thus begun, quickly diffufed itfelf, and an in- giuiitor. quifitor wTas appointed to fearch for criminals. This was one Amda Sion, the king’s chief confidant, who pretended to all that abfurd and auitere devotion com¬ mon to religious hypocrites. In this he was flattered with uncommon parade and attendance, the ufual re¬ wards of people of that flamp ; as he never appeared abroad but with a great number of foldiers, trumpets, drums, and other enfigns of military dignity waiting upon him. He kept alfo a number of fpies, who brought him intelligence of thofe who were fecretly guilty of any idolatrous or treafonable practices ; after which, proceeding with his attendants to the houfe of the delinquent, he caufed the family firfl fupply him- felf and his party with refrefhments, and then ordered the unhappy wretches to be all put to death in his pre- Murderof fence. Among thofe'who fuffered in this barbarous manner were the two fons-in-law of the king himfelf, la— who had been accufed by their wives, the one of adul¬ tery, and the other of inceft ; on which flight ground they were both put to death in their own houfes in fuch a manner as defervedly threw an odium on the Perfecution king. His conduct was afterwards fo feverely con- fyppreU'ed. demneq by acertain clergyman from Jerufalem, that a re¬ formation feems to have been produced ; and no men¬ tion is afterwards made of the inquifltor or perfecution during this reign",Alexandria,"US,GR",4,"United States,Greece","North America,Europe"
"Affairs of The attention of the king was now called off from the king- religion to the hate of his affairs in the different pro- ^reSu- vinces of the kingdom. As .the Moorifh provinces were very rich, by reafon of the extenfive trade they carried on, and frequently employed their wealth in exciting rebellions, it became neceffary that the fove- reign himfelf fhpuld examine into the circumhances and diipofitions of the feveral governors ; which was likewife proper on another account, that he might af- fign to each the fum to be paid. On this occanon he divided the empire more dihinctly, and increafed the number of governments confiderably ; which being Churches done, he fet about repairing the churches throughout repaired, the country, which had fallen into decay, or been de- flroyed in the war with the Mahometans. So zealous was he in this refpeft, that having heard of the de- flruflion of the church of the Virgin in Alexandria by fire, he inftantly built another in Ethiopia, to repair the lofs which Chrilfianity might have fuffered",Alexandria,"ET,US",4,"Ethiopia,United States","Africa,North America"
"Abyflinia. tlie Jalofles, a nation on the weftern coaft of Africa, had affured the Portugueie navigators of the exiftence of fuch a prince fo ilrongly, that the king determined to fend ambafladors to him ; and the difcovery was of the greater confequence, that a paflage to the Eaft In¬ dies was now attempted both by land and fea. The ambaffadors were named Peter Covillan and Alphonfo de Paiva. Thefe were fent to Alexandria in Egypt, from whence they were to fet out on their journey j the intent of which was, to explore the fources of the In¬ dian trade, the principal markets for the fpice, &.c",Alexandria,"EG,US",4,"Egypt,United States","Africa,North America"
"Account of In the profecution of this fcheme our two travellers ^211 tra~ went from Alexandria to Cairo 5 from thence to Suez Ve i* at the bottom of the Red fea } from Suez they took their route to Aden, a wealthy and commercial city beyond the ftraits of Babel Mandel. Covillan now fet fail for India, and De Paiva for Suakem. The latter loft his life without making any difcovery; but Covil¬ lan pafled over to Calicut and Goa. From thence he returned to the continent of Africa, vifiting the gold mines of Sofala, and pafling from thence to Aden and Cairo ; at which laft place he was informed of the death of his companion. In this city he was met by two Jews with letters from the king of Abyffinia. One of thefe Jews was fent back with letters to the Abyflmian monarch 5 but with the other he proceeded to the iiland of Ormus in the Perfian gulf. Here they fepa- rated ; the Jew returning home, and Covillan repafling the ftraits of Babel Mandel, whence he proceeded to Aden, and afterwards entered the Abyflinian domi¬ nions","Alexandria, Cairo, Suez, Suez, Aden, Goa, Aden, Cairo, Aden","EG,YE,IN,US,PH",4,"Egypt,Yemen,India,United States,Philippines","Africa,Asia,Asia,North America,Asia"
David III,David,PA,4,Panama,North America
"Naod having thus freed his country from the dan¬ ger of any foreign invafion, applied himfelf to the cul¬ tivation of the arts of peace, and reforming the man¬ ners of his fubjefts, in which he fpent the remainder of his days. He died in 1508, after a reign of 13 years ; and was fucceeded by his fon David III. a child of 11 years of age. Though the affairs of the empire were at prefent in fuch a Hate as required a very pru¬ dent and active adminiftration, the emprefs Helena, widow of Baeda hlariam, had interefl: enough to get the crown fettled on the infant juft mentioned. This proceeded partly from her defire of engroffing all the power into her own hands, and partly from a wilh to keep peace with Adel her native country. Thefe ends could not be accomplilhed but by keeping a minor on the throne of Abyflinia ; which was therefore her con- ftant objeft as long as Ihe lived. But though this might not have been attended with any very bad con- fequence had the two nations been left to decide the quarrel by themfelves, the face of affairs was now quite changed by the interference of the Turks. That peo¬ ple having now conquered almoft the whole of Arabia to the Indian ocean, being likewife on the point of re¬ ducing Egypt, and having a great advantage over their adverfaries in ufing fire-arms, now projected the con- queft of India alfo. In this indeed they were always difappointed by the fuperior valour of the Portuguefe ; but as this conqueft remained a favourite objeff with them, they did not abandon their attempts. In the countries which they had conquered, they exacted ilich enormous contributions from the merchants, that vaft numbers of them fled to the African fide of the Red fea, and fettled on the coaft of Adel. The Turks, furprifed at the mcreafe of trade in this country, which they themfelves had occafioned, refolved to ftiare in the profits. For this purpofe they took poffeftion of Zeyla, a fmall ifland in the Red fea, diredlly oppofite to the coaft of Adel ; and erefted a cuftomhoufe in it, where they oppreffed and ruined the trade as in other places","David, Helena","IN,EG,PA,US",4,"India,Egypt,Panama,United States","Asia,Africa,North America,North America"
"] A B Y defire of poflefling India conftantly prevented the Turks ""Abyflima> from directing their ftrength againft thefe countries. v— Helena wras lenfible enough of the dangerous fituation ^ embafl’y of the empire, but preferred the gratification of Iter Por~ ambition to the good of her country ; however, that flie might preferve herfelf from the attacks of fuch a formidable enemy, it wns now thought proper to enter into an alliance with the Portuguefe. The ambafla- dor from Portugal, Peter Covillan, was denied the li¬ berty of returning to his own country, as has been al¬ ready related ; and as, for fome time paft, it had not been obvious how he could be of much ufe, he had begun to fall into oblivion. The prefent emergency, however, recovered his importance. The emprefs wTas fenfible of the neceffity Ihe lay under of having fome perfon wdro underftood both the Abyffinian and Por¬ tuguefe languages before fhe could open any correfpon- dence with that nation, and who might likewife in¬ form her of the names of the perfons to wiiom her let¬ ters ought to be addreffed. By him flie was now' in- ftnnfted in every thing neceffary to the fuccefs of her embaffy. The meffage wras committed to one Matthew an Armenian merchant, with whom a young Abyffi- nian was joined ; but the latter died by the way. The letters they carried are by Mr Bruce fuppofed to have been partly the work of Covillan and partly of the lefs experienced Abyffinian confidants of the emprefs",Helena,"IN,PT,US,AM",4,"India,Portugal,United States,Armenia","Asia,Europe,North America,Asia"
"They began with telling the king, that Matthew wmuld give him information of her whole purpofe, and that he might depend on the truth of what he laid ; but in the latter part the whole fecret of the embaffy was difcloied, and a force fufficient to deftroy the Turkifti power was exprefsly folicited. Among the other par¬ ticulars of this embaffy alfo it is laid, that a third part of Abyflinia w'as offered in cafe her requifitions were complied with ; but this, as well as the embaffy itfelf, was always denied by David when he came of age",David,PA,4,Panama,North America
"Maffudi re- In the mean time, Maffudi having recovered from news his the defeat given him by Naod, and formed alliances with the Turks in Arabia, had renewed his depreda¬ tions on the Abyffinian territories with more fuccefs than ever. Such a number of Haves had been, by his afliduity, fent to Mecca, that he was honoured with a green filk ftandard (an emblem of the true Mahome¬ tan faith), with a tent of black velvet embroidered with gold, and he was likewife made Sheykh of Zey- la ; fo that, as this ifland was properly the key to the Abyflinian empire, he could neither be rewarded with greater honour nor profit. This happened when David had attained the age of 16} and in confequence of fuch furprifing fuccefs, the king of Adel, never a hearty friend to Abyflinia, determined to break the peace with that empire and make an alliance with Maffudi. Having taken this refolution, the two princes invaded Abyfiinia with their joint forces, and in one year carried off 19,000 Chriftian Haves, fo that a ge¬ neral terror was fpread over the whole empire. David, already impatient of the injuries his people had fuftain- ed, determined to raife an army, and to head it in per- fon as his anceftors had done, contrary to the advice of the emprefs, who confidering only his youth and in¬ experience in military affairs, wifhed him to have em¬ ployed fome of his veteran officers. A very powerful David army was raifed, and ample fupplies of all kinds were marches a- procured. With one part of his forces the emperor gainft him. t00k_ the road to Auffa the capital of Adel j fending the other under the command of an officer named the Be- tivudet, to meet the Mooriffi army, which was then ra¬ vaging part of Abyffinia. It was natural to be ima¬ gined, that the Moors, on hearing that an army was marching to deftroy the capital of their country, wTould abandon the thoughts of conquefi: or plunder to pre- ferve it. In doing this, David knew that they had certain defiles to pafs before they could reach Adel","Mecca, David, David, David, David","PA,SA",4,"Panama,Saudi Arabia","North America,Asia"
"The fame day that this victory was gained over the ^ ia ta Moors by David, being in the month of July 1516, ken by the the ifland-of Zeyla in the Red fea was taken and the Portuguefe",David,PA,4,Panama,North America
"This deftruftive war continued till the year 1537 j when Gragne fent a meffage to the emperor, exhorting him not to fight any longer againft God, but to make peace while it was in his power, and give him his daughter in marriage : on which condition he would withdraw his army j but otherwife he would reduce his empire to fuch a ftate that it fhould be capable of pr@ducing nothing but grafs. David, however, ftill refufed to fubmit; replying, that he put his confidence in God, who at prefent only chaftifed him and his He reffifes people for their fins $ but that Gragne himfelf, being to fubmit",David,PA,4,Panama,North America
"By the death of Ammer and the fmall fuccefles which David himfelf had obtained, the affairs of Abyf- finia feemed to revive 5 but ftili there was no probabi¬ lity of their being ever brought to a fortunate iffue",David,PA,4,Panama,North America
"A new em- An embaffy to Portugal was therefore thought of in bafly to good earneft, as the mifehievous effefts of flighting the Portugal, proffered fnendlhip of that power were now fufticient- ly apparent. One of the attendants of Roderigo, na¬ med John Bermudes, who had been detained in Abyf- ftnia, was chofen for this purpofe } and to his tempo¬ ral character of ambaffador rvas-added that of Abuna, primate or patriarch. John, who was not a clergy¬ man originally, had received all the inferior ecclelia- tlical orders at once, that the fupreme one might be thus conferred upon him 5 but happening to be a great bigot to the popifh religion, he would not accept of his new dignity but with a provifo, that his ordination ihould be approved by the pope. This was indireftly fubmitting the church of Abyffinia to that of Rome $ to which David would never have agreed, had it not been for the defperate fttuation of his affairs at that time. John was therefore allowed to do as he thought proper : when palling through Arabia and Egypt to Italy, he had his ordination confirmed by the pope } after which he fet out on the bufinefs of his embaffy","Rome, David","PT,EG,IT,US,PA",4,"Portugal,Egypt,Italy,United States,Panama","Europe,Africa,Europe,North America,North America"
"On his arrival at Lifbon, he was acknowledged by the king as patriarch of Alexandria, Abyffmia, and of the fea ; for this laft title had alfo been conferred upon him by his Holinefs. Entering then upon the pur¬ pofe of his embaffy, he began by putting Zaga Zaab in irons for having wafted fo much time, and done no- A body of thing effeclual lince he had left Abyffinia. I hen he PcfuS»ele reprefented to the king the diftreffes of the Abyftinians affifTthe0 in fuch a ftrong %ht, and infilled fo violently for re¬ emperor. hef to them, that an order was very foon procured for 400 mulketeers to be lent by Don Garcia de Noronha to their relief. To accelerate the progrefs of the in¬ tended fiiccours, John himfelf propofed to fail in the fame fleet with Don Garcia ; but his voyage was de¬ layed for a whole year by ficknefs, occaftoned, as he fuppofed, by poifon given him by Zaga Zaab, the monk whom he had imprifoned, and who had been fet at li¬ berty by the king. After his recovery, however, he fet fail for India, where he arrived in fafety. The death of Don Garcia, which happened in the mean time, occafioned another delay j but at laft it was re- folved, that Don Stephen de Gama, who had fucceed- ed to Don Garcia, fhould undertake an expedition to the Red fea, in order to burn fome lurkilh galleys which then lay at Suez. But intelligence having in the mean time been received of the intended voyage, thefe veffels had withdrawn themfelves. Anchoring then in the port of Mafuah, Don Stephen fent over to Arkeeko on the continent to procure fiefh water and Abyffinia<","Alexandria, Suez","IN,US,EG",4,"India,United States,Egypt","Asia,North America,Africa"
"already feen that David had been reduced to great di- aum)g thi* ft refs 5 but afterwards met with fome little fuccefles,intxna ~ which feemed to indicate an approaching change of fortune. In thefe, however, he was foon difappoint-R j fa_ ed. A Mahometan chief called Viz-ir Mvgdid made mily maf- an attack upon the rock Geihen, where the royal fa- facied",David,PA,4,Panama,North America
"mily were kept 5 and finding it entirely unguarded, ai- cended without oppofition, and put every perfon to the fword. This laft difafter feems to have been too great Death of for the refolution even of this heroic prince, as he died David, and the fame year 1540. He was fucceeded by his fon of Claudius, who, though then but about 18 years of age, was endowed with all the great qualities neceffary for managing the affairs of the empire in fuch a dreadful crifis, and had made conftderable progrefs before the arrival of the Portuguefe",David,PA,4,Panama,North America
"This cruelty of Gragne proved more detrimental to his caufe than a complete victory gained by the other party could have been. On the one hand, the Portu- guefe were fo exafperated by the lofs of their leader, that they were ready to embark in the moll defperate undertakings, in order to revenge his death ; on the other, the Turks, on whom he principally depended, were irritated to the laft degree at the difappointment of fharing his ranfom, which they imagined would have been an immenfe fum 5 and therefore abandoned their leader to return to their owm country. Gragne, thus left to decide the quarrel with his Africans, was quick¬ ly defeated by Claudius 5 and in another engagement which took place on the 10th of February 1543, his troops -were defeated and himfelf killed. This lafl misfortune was owing to his boldnefs in advancing be¬ fore his army which was giving wray, fo that he be¬ came known to the Portuguefe. On this he wTas ■fingled out by a Portuguefe named Peter Lyon, •who had been valet de chambre to Don Chriftopher. This man, to make his aim more fure, crept for a confider- able wray along the bank of a river towards the place where Gragne was 5 and when come fufficiently near, fhot him quite through the body. Finding himfelf mortally wounded, he quitted the field of battle j and v.ras followed by Lyon, who in a fhort time faw him fall from his horfe. He then came up to him, and cut off one of his ears, which he put in his pocket, and returned to the battle to do what further fervice he could. The next day Gragne’s body was found by an Abyflinian officer, who cut off his head and claim¬ ed the merit of killing him j but Lyon having pulled out the ear which he carried in his pocket, vindicated his own right to the reward which was to be given to the other. On this occafion the Moorifli army was al- moft entirely deftroyed \ Gragne’s wife and fon were taken prifoners, with N.ur the fon of Mugdid, who deftroyed the royal family 5 and it had been happy for Claudius, as we (hall afterwards fee, that he had put ■thefe prifoners to death. Very foon after this engage¬ ment, the emperor had intelligence that Joram, a rebel chief who had once reduced his father David to great diftrefs, was advancing rapidly in hopes of being ftill able to be prefent at the battle. This was the laft of his father’s enemies on whom Claudius had to revenge bimfelf 5 and this was effe&ually done by a detachment of his army, who polled themfelves in his way, fell up- Joram a re bel chief defeated and killed","Lyon, Lyon, David","FR,PA",4,"France,Panama","Europe,North America"
