Entry,City,Country code,Edition,Country,Continent
"A, in the ancient inferiptions of marbles, &c. oc- cafionally Hands for Augufus, ager, aiunt, &c. When, double it denotes Augufli; when triple aurum, argen¬ tum, ecs; and fometimes its meaning can only b® known by the reft of the infeription. Ifidore adds, that wdren it occurs after the word miles, (foldier), it denotes him young. On the reverfe of ancient medals, it denotes that they were ftruck by the city of Argos, fometimes by that of Athens } but on coins of modern date, it is the mark of Paris","Athens, Paris",US,4,United States,North America
"A AM, or Haam, a liquid meafure in common ufe among the Dutch, containing 128 meafures called mingles, each weighing nearly 36 ounces avoirdupois ; vrhence the 'Jlam contains 288 Englifli, and 148-j-pints Paris meafure",Paris,"US,NL",4,"United States,Netherlands","North America,Europe"
"A ARSENS, Francis, Lord of Someldyck and Spyck, was one of the greateft minifters for negotia¬ tion the United Provinces could ever boaft of. His father, Cornelius Aarfens, was regifter to the States ; and being acquainted with Mr Pleffis Mornay, at the court of William prince of Orange, he prevailed up¬ on him to take his fon under him, with whom he con¬ tinued fome years. John Olden Barneveldt, who pre- fided over the affairs of Holland and all the United Provinces, fent him afterwards agent into France, where he learned to negotiate under thofe profound politicians Henry IV. Villeroy, Silleri, Roffie, Jaon- nin, &c. and he acquitted himfelf in fuch a manner as to obtain their approbation. Soon after, he was in¬ verted with the charafter of ambaffador, and was the firft; who was recognized as fuch by the French court; at which time Henry IV. declared, that he Ihould take precedence next to the Venetian minifter. He refided in France 15 years; during which time he received great marks of efteem from the king, who created him a knight and baron; and for this reafon he was re¬ ceived among the nobles of the province of Holland","Orange, Holland, Holland","FR,US",4,"France,United States","Europe,North America"
"However, he became at length fo odious to the French court, that they defired to have him recalled. He was afterwards deputed to Venice, and to feveral Ger¬ man and Italian princes, upon occafion of the troubles in Bohemia. He was the firft of three extraordinary ambaffadors fent to England in 1620, and the fecond in 1641 ; in which latter embaffy he was accompanied by the lord of Brederode as firft ambaffador, and Heemfvliet as third, to negotiate the marriage of Prince William^ £bn of the prince of Orange, with a daughter ABA [ Aafar daughter of Charles I. He was likewlfe ambaflador extraordinary at the French court in 1624, at the be- , ginning of Cardinal Richlieu’s adminiftration, who had a high opinion of him. The memoirs which he has left, of the negotiations in which he was engaged, ftiow him to have been one of the ableft men of his time, and worthy of the confidence and truft repofed in him by his country. But his charadler is not altogether without ftain. His enmity to the remonflrants was bit¬ ter and unrelenting; and he is fuppofed to have great¬ ly encouraged the violent meafures purfued by Prince Maurice againfl the venerable Barneveldt, and to have been the principal advifer for affembling the fa¬ mous and perfecuting fynod of Dordrecht. He died at a very advanced age } and his fon, who furvived him, was reputed the wealthieft man in Holland","Venice, Orange, Dordrecht, Holland","US,FR,NL,IT",4,"United States,France,Netherlands,Italy","North America,Europe,Europe,Europe"
"AB, the eleventh month of the civil year of the Hebrews, and the fifth of their ecclefiaftical year, which begins with the month Nifan. It anfwers to the moon of July} that is, to part of our month of the fame name, and to the beginning of Auguft: it confifts of thirty days. The Jews faft on the firft of this month, in memory of Aaron’s death ; and on the ninth, becaufe on that day both the temple of Solomon, and that erefted after the captivity, were burnt 5 the former by the Chaldeans, and the latter by the Romans. The fame day is alfo remarkable among that people for the publication of Adrian’s edift, wherein they were for¬ bidden to continue in Judea, or even to look back when at a diftance from Jerufalem, in order to lament the de- folation of that city. The 18th of the fame month is alfo a faft among the Jews ; becaufe the lamp in the fanctuary was that night extinguiflied, in the time of Ahaz",Adrian,US,4,United States,North America
"ABADIR , a title which the Carthaginians gave to gods of the firft order. In the Roman mythology, it, is the name of a ftone which-Saturn fwallowed, by the contrivance of his wife Ops, believing it to be his new¬ born fon Jupiter : hence it became the objeft of reli¬ gious wTorfhip","Roman, Jupiter","RO,US",4,"Romania,United States","Europe,North America"
"ABANO, a town of the Paduano, in the republic of Venice, famous among the ancients for its hot baths",Venice,US,4,United States,North America
"AB ANTES, a people who came originally from Thrace, and fettled in Phocaea, a country of Greece, v/here they built a town which they called Aba, after the name of Abas their leader ; and if we may credit fome ancient authors, the Abantes went afterwards in¬ to the illand Eubcea, now called Negropont: others lay the iVbantes of Euboea came from Athens. The A bantes were a very warlike people, clofing with their enemies, and fighting hand to hand","Aba, Athens","GR,NG,US",4,"Greece,Nigeria,United States","Europe,Africa,North America"
"With regard to the occafion of his leaving his native1 country, Harpocration t tells us, that the whole earth 1 Under the being infefted with a deadly plague, Apollo, upon be-wor^A”“£/iV: ing confulted, gave no other anfwer, than that the Athenians fhould offer up prayers in behalf of all other nations; upon which, feveral countries deputed ambaf- fadors to Athens, among whom was Abaris the Hy¬ perborean. In this journey, he renewed the alliance between his countrymen and the inhabitants of the ifland of Delos. It appears that he alfo went to La- cedcemon ; fince, according to fome writers jj, he there !| Paufanias, built a temple confecrated to Proferpine the SalutaryT'5-in",Athens,US,4,United States,North America
"ABAUZIT, Fir min, a learned Frenchman, was born at Ufez, in Languedoc, in November 1679. His fa¬ ther died when he was but two years of age. In confe- quence of the revocation of the edict of Nantz, in the time of Louis XIV. to avoid the rigours of perfecution to which the Proteftants of France were expofed, young' Abauzit’s mother, who was a Proteftant, not without difficulty, efcaped with her fon to Geneva, where he remained fecure from danger, and enjoyed the benefit of education. From his 10th to his 19th year, his time was wholly devoted to' literature y and having made great progrefs in languages, he ftudied mathematics, phyfics, and theology. In the year 1698, he travelled into Holland, where he became acquainted with the learn¬ ed Bayle, with Bafnage and Jurieu. Thence he pafs- ed over into England, and was introduced to Sir Ifaac Newton, who entertained a very high opinion of his merit. For this philofopher afterwards fent him his Commercium Epiftolicum, accompanied with a very ho¬ nourable teftimony. “ You are well worthy, fays Nevcton, to judge between Leibnitz and me.” The reputation of Abauzit reached the ears of King Wil¬ liam, who encouraged him by a very handfome offer to fettle in England ; which he declined, and returned to Geneva. In 1715 he entered into the fociety form¬ ed for the purpofe of tranflating the New Teftament into the French language, and contributed valuable affiftance to this work. The chair of philofophy in the univerfity was offered to him by that body in 1723, which he refufed on account of his health and diffidence of his talents. Butin 1727 he accepted of the office of librarian to the city, the duties of which were nei¬ ther burdenfome, nor fubjected him to any particular reftraint","Geneva, Holland, Newton, Geneva","US,FR",4,"United States,France","North America,Europe"
"Abauzit, who was deeply converfant in phyfical and mathematical knowledge, wTas one of the firll who em¬ braced the grand truths which the fublime difcoveries of Newton exhibited to the world. He defended the doctrines of that philofopher againff Father Caftel 5 and difcovered an error in the Principia, which was corrected by Newton in the fecond edition of his work","Newton, Newton",US,4,United States,North America
"A very fine compliment is faid to have been paid to Abauzit by Voltaire. A ftranger having addreffed the poet in a flattering manner, by faying he had come to Geneva to fee a great man, Voltaire aiked him, whether he had feen Abauzit ? This excellent man having enjoyed that otium cum dignitate, fo much talked of, and fo eagerly fought af¬ ter, but rarely obtained, having thus lived univerfally refpefted to the great age of 87 years, died in the year 1767, lamented by the republic, and regretted by the learned",Geneva,US,4,United States,North America
"The writings which Abauzit left behind him are chiefly on religious fubjects. He wrote an “ Effay on the Apocalypfe,” in which he endeavoured to ffiow, that the predictions in that book were to be applied to the deftruction of Jerufalem. This work was tranflated into Englilh} to which a refutation was added, which fatisfied Abauzit fo much that he was miffaken in his views, that he ordered an edition then ready for pub¬ lication in Holland to be flopped. His other works are, “ Reflections on the Eucharift j On Idolatry $ On the Myfteries of Religion ; Paraphrafes and Ex¬ planations of fundry parts of Scripture ; Several Criti¬ cal and Antiquarian Pieces 5 and various Letters.” ABA VO, in Botany, a fynonyme of the A dan son 1 A",Holland,US,4,United States,North America
"Abba, in the Syriac and Chaldee languages, lite¬ rally fignifies a father} and figuratively, a fuperior, reputed as a father in refpeCt of age, dignity, or af- feCtion. It is more particularly ufed in the Syriac, Coptic, and Ethiopic churches, as a title given to the biftiops. The bilhops themfelves beftow the title Abba more eminently on the biffiop of Alexandria 5 which occafioned the people to give him the title of Baba, or Papa, that is Grandfather; a title which he bore before the bifliop of Rome. It is a Jewifh title of ho¬ nour given to certain rabbins called Tanaites: and it ii alfo particularly ufed, by fome writers of the middle 8 ] ABB age, for the fuperior of a monaftery, ufually called Abbadie ABBOT1. It ABBADIE, Jambs, an eminent Proteftant divine, A born at Nay in Bern in 1654 5 firft educated there un¬ der the famous John la Placette, and afterwards at the univerfity of Sedan. From thence he went into Hol¬ land and Germany, and was minifter in the French church of Berlin. He left that place in 1690 •, came into England *, wras fome time minifter in the French church in the Savoy, London 5 and was made dean of Killalo in Ireland. He was ftrongly attached to the caufe of King William, as appears in his elaborate de¬ fence of the Revolution, and his hiftory of the affafli- nation-plot. He had great natural abilities, which he improved by true and ufeful learning. He was a moft zealous defender of the primitive doctrine of the Pro- teftants, as appears by his writings 5 and that ftrong nervous eloquence for which he was fo remarkable, enabled him to enforce the doftrines of his profeflion from the pulpit with great fpi-rit and energy. He pof- feffed uncommon powers of memory. It is faid that he compofed his wrorks without committing any part to writing, till they were wanted for the prefs. He died in London in 1727, after his return from a tour in Holland. He publilhed feveral works in French that were much efteemed ; the principal of which are, A Treatife on the Truth of the Chriftian religion} The Art of Knowing one’s Self; A Defence 6f the Britiffi Nation 5 the Deity of Jefus Chrift effe’ntial to the Chriftian Religion ; The Hiftory of the laft Con- fpiracy in England, written by order of King William III. j and The Triumph of Providence and Religion, or the opening the Seven Seals by the Son of God","Alexandria, Rome, Bern, Sedan, Berlin, London, London, Holland, Providence","US,FR,DE,GB,IE,CH",4,"United States,France,Germany,United Kingdom,Ireland,Switzerland","North America,Europe,Europe,Europe,Europe,Europe"
"ABBEYHOLM, a town in Cumberland, fo called from an abbey built there by David king of Scots. It Hands on an arm of the fea. W. Long. 2. 38. N. Lat","Cumberland, David","US,PA",4,"United States,Panama","North America,North America"
"Abbot, George, archbifhop of Canterbury, was born O&ober 29. 1562, at Guildford in Surrey. He^ was the fon of Maurice Abbot a cloth-worker. He ftudied at Oxford, and in 1597 was chosen principal of Univerfity college. In 1599, he wras inftalled detm of Winchefler : the year following, he was chofen vice- chancellor of the univerfity of Oxford, and a fecond time in 1603. In 1604, the tranflation of the Bible p.ow in ufe was begun by the direction of King James j J ABB [ i AMjof. and Dr Abbot \vas the fecond of eight divines of Ox- ««-V-«wf0rd, to whom the care of tranflating the whole New 'i'eftament (excepting the Epiftles) was committed","George, Canterbury, Guildford, Surrey, Oxford, Oxford","GB,US,ZA,CA",4,"United Kingdom,United States,South Africa,Canada","Europe,North America,Africa,North America"
"It is not however improbable, that his extravagant adulation of his royal mailer, in which he went as far as any other court-chaplain could do, contributed not a little to his rapid preferment. In the preface to a pamphlet which he publilhed, the following fpecimen of ridiculous flattery occurs: Speaking of the king, he lays, “ whofe life hath been fo immaculate and un- tpotted, &c. that even malice ixfelf, which leaves no¬ thing unfearched, could never find true blemilh in it, nor call probable afperfion on it.—Zealous as a Da¬ vid ; learned and wife, the Solomon of our age ; reli¬ gious as Jolias ; careful of fpreading Chrilt’s faith as Conftantine the Great •, jull as Mofes j undefiled in all his ways as a Jehofhaphat and Hezekiah 5 full of clemency as another Theodolius.”—If Mr Walpole had been this pafiage, he certainly would not have faid, that “ honeit Abbot could not flatter.” His great zeal for the Protellant religion made him a ftrenuous promoter of the match between the Eledlor Palatine and the Princefs Elizabeth 5 which was ac¬ cordingly concluded and folemnized the 14th of Fe¬ bruary 1612, the archbilhop performing the ceremony on a llage erected in the royal chapel. In the follow¬ ing year happened the famous cafe of divorce between the lady Frances Howard, daughter of the earl of Suf¬ folk, and Robert carl of Effex’, which has been confi- dered as one of the greateft blemilhes of King fames’s reign. The part which the archbifliop took in the hu- linefs, added much to the reputation he had already acquired for incorruptible integrity. It was referred by the king to a court of delegates, wfliofe opinion the king and court wiflied and expelled to be favourable to the divorce. But the archbifhop, unawed by roval authority, with inflexible firmnefs refilled it, and pub- liflied his reafons for perfifting in bis opinion, to which the king, difappointed in his views, thought fit to re¬ ply : Sentence was given in the lady’s favour. In 1618, the king publilhed a declaration, which he or¬ dered to be read in all churches, permitting fports and pailimes on the Lord’s day : this gave great uneafinefs to the archbilhop j who, happening to be at Croydon on the day it was ordered to be read, had the courage to forbid it",Palatine,US,4,United States,North America
"Abbot, Robert, elder brother to the former, was born at Guildford in 1560, and completed his ftudies at Baliol college, Oxford. In 1582, he took his de¬ gree of mafter of arts, and foon became a celebrated preacher; and to this talent he chiefly owTed his pre¬ ferment. Upon his firft fermon at Worcefter, he was chofen leflurer in that city, and foon after reftor of All-faints in the fame place. John Stanhope, Efq","Guildford, Oxford","GB,US",4,"United Kingdom,United States","Europe,North America"
"In 1597, he took his degree of dodftor in divinity: and, in the beginning of King James’s reign, was ap¬ pointed chaplain in ordinary to his Majefty j who had fuch an opinion of him as a writer, that he ordered the doftor’s book De Antichrifto to be printed, wflth his owrn commentary upon part of the Apocalypfe. In 1609, he w^as ele&ed mafter of Baliol college ; which truft he difcharged with the utmoft care and afliduity, by his frequent leisures to the fcholars, by his conti¬ nual prefence at public exercifes, and by promoting temperance in the fociety. In November 1610, he was nfade prebendary of Normanton in the church of Southwell j and, in 1612, his Majefty appointed him regius profeffor of divinity at Oxford. The fame of his leftures became very great; and thofe which he gave upon the fupreme powrer of kings, againft Bellar- snine and Suarez, fo much pleafed his Majefty, that wflien the fee of Saliftmry became vacant, he named him to that bifhopric, and he was confecrated by his own brother at Lambeth, December 3. 1615. When he came to Salisbury, he found the cathedral falling to decay, through the avarice and negligence of the cler¬ gy belonging to it •, however, he found means to draw five hundred pounds from the prebendaries, wdiich he applied towards repairing it. Here he devoted him- felf to the duties of his function with great diligence and afiiduity, viflting his -whole diocefe in perfon, and preaching every Sunday. But his fedentary life, and clofe application to ftudy, brought upon him the gra¬ vel and ftone ; of wdiich he died on the 2d of March 1618, in the 58th year of his age; having filled the fee only two years and three months. Dr Fuller *, fpeaking of the two brothers, fays, “ that George was “ the more plaufible preacher, Robert the greateft “ fcholar; George the abler ftatefman, Robert the “ deeper divine: gravity did frown in George, and “ fmile in Robert.” He publilhed feveral pieces ; and left behind him fundry manufcripts, which Dr Corbet prefented to the Bodleian library","Oxford, Salisbury, March, George, George, George","ZA,US,GB",4,"South Africa,United States,United Kingdom","Africa,North America,Europe"
"ABBOTSBURY, a fmall town in Dorfetfhire, in ¥7» Long. 1. 17. N. Lat. 50. 40. The abbey near 2 ] ABB this town was founded by a Norman lady, about the Abbots* year 1026. Edward the Confeffor and William the Langley- Conqueror were confiderable benefactors to it. Abbrevia-' ABBOTS-Langley, a village in Herts, four miles tion","Norman, Langley","US,CA",4,"United States,Canada","North America,North America"
"from St Alban’s, famous as the birthplace of Pope —y-** Adrian IV",Adrian,US,4,United States,North America
"I. Junius, Julius, Jupiter, ibx, ideft,_ immortalis, impe- rator, inferi, inter, invenit, invictus, ipie, iterum, judex, juflit, jus, &.c",Jupiter,US,4,United States,North America
"Abereviators, a college of 72 perfons in the chan¬ cery of Rome, who draw up the pope’s brieves, and reduce petitions, when granted by him, into proper form for being converted into bulls",Rome,US,4,United States,North America
"• ABCOURT, a towrn near St Germains, four leagues from Paris. Here is a brilk chalybeate water, which is alfo impregnated with carbonic acid and foda ; and refembling the waters of Spa and Ilmington",Paris,US,4,United States,North America
"felf mailer of Medina and Mecca. Under his reign the Greek language and character were excluded from the accounts of the public revenue. If this change, fays Gibbon, wras produ&ive of the invention or fami¬ liar ufe of the Arabic or Indian cyphers, which are eur prefent numerals, a regulation of office has promot¬ ed the moft important difcoveries of arithmetic, alge¬ bra, and the mathematical fciences. His extreme ava- *ice expofed him to the contempt and derifion of his fiibjefts, who gave him the appellation of the fweat of a Jlone; and his fetid breath, it is faid, poifoned the fies which accidentally lighted on his lips, whence he was called the father of fies. He began his reign in *he 65th of the Hegira, A. D. 684 ; reigned 15 years 5 And four of his fons fucceffively enjoyed the caliphate","Medina, Mecca","US,SA,GR,IN",4,"United States,Saudi Arabia,Greece,India","North America,Asia,Europe,Asia"
"ABDARA, or Abdeka, in Ancient Geography, a town of BoeticainSpain, a Phoenician colony; wow Aar a, to the weft of Almeira in the kingdom of Granada",Granada,NI,4,Nicaragua,North America
"After having thus enriched his own mind, and con¬ tributed fo fuccefsfully to the improvement of others, fentiments of devotion induced him to undertake a pil¬ grimage to Mecca. In the mean time, however, he leems to have experienced the full force of that de¬ lire, which in the native of Switzerland has often been known to fuperfede every other,—the defire of once more beholding the place which gave him birth. He wifhed alfo to prefent the fruits of his travels, and of his {Indies, to the caliph A1 Moftanfer Billah. He therefore eagerly journeyed towards Bagdad, -which, after fo long an abfence, he no doubt beheld with emotions of tender exultation :—but all his hopes were difappointed! Scarcely had he reached his native city, when he was fuddenly taken ill, and died in his 63d year, A. D. 1223. Of 150 treatifes which he compofed on various fubje&s of medicine, natural phi- lofophy and polite literature, only one, entitled HiJIo- rice JEgypti Compendium, has furvived the ravages of time. This manufeript, the only one which has been difeovered, was brought to Europe by the celebrated orientalift Pococke, and is now preferved in the Bod¬ leian library. Dr White of Oxford published an edi¬ tion of the original Arabic, with an elegant Latin verfion in 410, in 1800. {Month. Rev."") ABDOMEN, in Anatomy, is that part of the trunk of the body which lies between the thorax and the bottom of the pelvis. See Anatomy","Mecca, Of, Oxford","CH,SA,TR,US",4,"Switzerland,Saudi Arabia,Turkey,United States","Europe,Asia,Asia,North America"
"ABEL-Kerarnim, or Vinearum, beyond Jordan, in tfte country of the Ammonites, where Jephthah defeated them, feven miles diftant from Philadelphia, abounding in vines, and hence the name. It was alfo called Abela",Philadelphia,"JO,US",4,"Jordan,United States","Asia,North America"
"Having fpent fome time in vifiting the fchools of fe- veral provinces, after the example of the ancient phi- lofophers who travelled in fearch of wifdom, in the twentieth year of his age, he fixed his refidence in the imiverfity of Paris, then the firft feat of learning in Europe. The mailer, William de Champeaux, was at that time in high repute for his knowledge of philofo¬ phy, and his Ikill in the dialectic art; to him he com¬ mitted the dire£iion of his ftudies, and wras at firft con¬ tented with receiving inftruftion from fo eminent a preceptor. De Champeaux wras proud of the talents of his pupil, and admitted him to his friendlhip.. But the afpiring youth ventured to contradict the opinions of his mailer, and in the public fchool held deputations with him, in which he wTas frequently viftorious.. The iealoufy of the mailer and the vanity of the pupil na¬ turally occafioned a fpeedy feparation",Paris,US,4,United States,North America
"Elated by fuccefs, and confident of his own powers, Abelard, without hefitation, at the age of twenty-two, opened a public fchool of his own. “ I was young in¬ deed,” fays he, “ but confident of myfelf, my ambi¬ tion had no bounds : I afpired to the dignity of a pro- fefibr, and only waited till I could fix on a proper place to open my ledftures.” Melun, a town ten leagues from Paris, where the court frequently refided, wras the place which die chofe for this bold difplay of his talents. But it was not without confiderable diffi¬ culty that Abelard executed his plan } for de Cham¬ peaux, who regarded him as a rival, openly employ¬ ed all his intereft againft him. Abelard at length prevailed, his fchool wras opened, and his leisures wrere attended by crowded and admiring auditories. Em¬ boldened by this fuccefs, and perhaps ftimulated by unworthy refentment, Abelard refolved to maintain an open conteft with his mafter, and for this purpofe re¬ moved his fchool to Corbeil near Paris. The difpu- tants frequently met in each other’s fchools } and the conteft wTas fupported on each fide with great fpirit, amidft crowds of their refpeftive fcholars. The young champion wras in the end victorious, and his antagonift was obliged to retire","Melun, Paris, Cham, Paris","US,FR,DE",4,"United States,France,Germany","North America,Europe,Europe"
"belard was informed of the flight of his adverfary, he returned towards Paris, and took a newr ftation at the abbey on Mount St Genevieve. His rival, the new profeffor, was unequal to the conteft, and w as foon deferted by bis pupils, who flocked to the leftures of Abelard. De Champeaux too, returning to his mo- naftery, renewed the ftruggle; but fo unfuccefsiully, that Abelard was again victorious",Paris,US,4,United States,North America
