Entry,City,Country code,Edition,Country,Continent
"But Sir Ifaac Newton overturns this opinion, from divers confiderations •, by fhowing, that the celeffial fpaces are void of all fenfible refiffance : and, hence it follows, that the matter contained therein muff be im- menfely rare, in regard the refiftance of bodies is chief¬ ly as their denfity ; fo that if the heavens were thus adequately filled with a medium or matter, how fubtile foever, they would refill the motion of the planets and comets much more than quicklilver or gold. But it has been fuppofed that what Newton has faid of aether is to be confidered only as a conjeClure, and efpecially as no new proofs of its exillence have been adduced fince his time",Newton,US,4,United States,North America
"jE T N [ Concerning the produds and general appearance of this volcano, authors are much better agreed.—'I'he ■ journey from Catania to its fummit has been lately de- feribed by feveral travellers, M. D’Orville, Mr Bry- done, Sir William Hamilton, M. Houel, and the Abbe Spallanzani. They all agree, that this fingle mountain affords an epitome of the different climates throughout the whole world : towards the foot, it is extremely hot; farther up, more temperate ; and grows gradually more and more cold the higher we alcend","Catania, Hamilton","IT,US",4,"Italy,United States","Europe,North America"
"In the middle of the fnowy region Hands the great crater, or mouth of iEtna ; from which, though con¬ trary to the ufual method of travellers, we lhall begin ■ our particular account of this mountain. Sir William Hamilton deferibes the crater as a little mountain, about a quarter of a mile perpendicular, and very fteep, fituated in the middle of a gently inclining plain, of about nine miles in circumference. It is entirely form¬ ed of Hones and afhes j and, ^ he was informed by feveral people of Catania, had been thrown up about 25 or 30 years before the time ('1769) he vi- fited Mount iEtna. Before this mountain was thrown up, there was only a prodigious large chafm, or gulf, in the middle of the above-mentioned plain } and it has been remarked, that about once in 100 years the top of iEtna falls in j which undoubtedly muH be the cafe at certain periods, or the mountain behoved continually to increafe in height. As this little mountain, though emitting fmoke from every pore, appeared folid and firm, Sir William Hamilton and his companions went up to the very top. In the middle is a hollowq about two miles and a half in circumference, according to Sir William Hamilton ; three miles and a half, according to Mr Bry- done *, and three or four, according to Mr D’Orville","Catania, Hamilton, Hamilton","US,IT",4,"United States,Italy","North America,Europe"
"The infide is crufled over with falts and fulphur of dif¬ ferent colours. It goes Hielving down from the top, like an inverted cone 5 the depth, in Sir W. Hamilton’s opinion, nearly correfponding to the height of. the little mountain, from many places of this fpace iltue volumes of fulphureous fmoke, which being much hea¬ vier than the circumambient air, inHead of afeending in it, roll down the fide of the mountain, till, coming to a more denfe atmofphere, it fhoots off horizontally, and forms a large track in the air, according to the di- redlion of the wind j wdiich, happily for our travellers, carried it exadlly to the fide oppokte to which they 35 1 i£ T N wrere placed. In the middle of this funnel is the tre- iE’ng- ^ mendous and unfathomable gulf, fo much celebrated in all ages, both as the terror of this life, and the place of punilhment in the next. From this gulf continually iffue terrible and confufed noifes, which in eruptions are increafed to fuch a degree as to be heard at a Pro¬ digious diilance. Its diameter is probably very differ¬ ent at different times: for Sir W. Hamilton obferyed, by the wind clearing aw7ay the fmoke from time to time, that the inverted hollow7 cone was contracted almoff to a point •, while Mr D’Orville and Mr Brydone found the opening very large. Both Mr Brydone and Sir \\ ","Hamilton, Hamilton",US,4,United States,North America
"Hamilton found the crater too hot to defeend into it ■, but Mr D’Orville was bolder : and accordingly he and his fellow traveller, faflened to ropes which two 01 three men held at a diffance for fear of accidents, de- feended as near as pofhble to the brink of the gulf ; but the fmall flames and fmoke which iffued from it on every fide, and a greenifli fulphur, and pumice ftones, quite black, which covered the margin, would not permit’ them to come fo near as to have a full view7",Hamilton,US,4,United States,North America
"On the fummit of Mount iEtna, Sir W. Hamilton ob- ferves, that he was fenfible of a difficulty in refpiration from the too great fubtility of the air, independent of what arofe from the fulphureous fmoke of the moun¬ tain. Mr Brydone takes no notice of this : which pro¬ bably arofe from the air being in a more rarefied Hate at the time of Sir W. Hamilton’s obfervation than of Mr Brydone’s 5 the barometer, as obferved by the foimer, {landing at 18 inches and 1 o lines, by the latter at 19 inches 6-i lines","Hamilton, Hamilton",US,4,United States,North America
"tioae, that ii tliefe bodies move in regions much be¬ yond the bounds that fome philofophers have affigned to our atmofphere.” ° To have a full and clear profpea: from the fummit of Mount -/Etna, it is neceffary to be there before fun- •V frthe vaPours raiPed by the fun, in the day time, via ooicure every ebjefl : accordingly, our travellers took care to arrive there early enough; and all ao-ree tiiat the beauty of the profpeft from thence cannot be exp re {led.—Here Mr Brydone and Sir W. Hamilton nad a view of Calabria in Italy, with the fea beyond it : the Lipari iflands, and Stromboli, a vo1cano at about 70 miles diflance, appeared juft under their feet ; the whole iliand of Sicily, with its rivers, towns, harbours, See. appeared diftinft, as if feen on a map. Maffa a Sicilian author, affirms, that the African coaft, as well as that of Naples, with many of its idands, have been uncovered from the top of JEtm. The vifible horizon here is not lefs than 8 or 900 miles in diameter. The pyramidal fhadow of the mountain reaches acrofs the whole ifland, and far into the fea on the other fide forming a vifible track in the air, which as the fun rifes above the horizon, is fhortened, and at laft confined to the neighbourhood of VEtna. The moft beautiful part of the feene, however, in Mr Brydone’s opinion is the mountain itfelf, the ifland of Sicily, and the nu¬ merous iflands lying round it. Thefe laft feem to be clole to the fleirts of zEtna 3 the diftances appearing re¬ duced to nothing. *"" ° .This mountain is divided into three zones, which might properly enough be diftinguiffied by the names ox torrid, temperate, and frigid: they are, however, known by the names of the Piedmontefc, or Regions cul- ta, the cultivated,, or fertile region 3 the Syhofa, T°0 r •’ •°i temPerate zone ; and the Regions deferta, the. frigid or defert zone or region. All thefe are plainly diftinguiffied from the fummit. The Regions aejejta is marked out by a circle of fnow and ice, which extends on all fides to the diftance of about eight miles, beginning at the foot of -the crater. Great pa t Ox this region is ftnooth and even. This is imme¬ diately fucceeded by the Sylvofa, or woody region j which forms a circle of the moil beautiful green, fur¬ rounding the mountain on all fides. T his region is va¬ riegated with a vaft number of mountains of a conical fonn, thrown up by ./Etna in thofe eruptions which burft out from its fides. Sir W. Hamilton counted 44 on ffie Catania fide, each having its crater, many with large trees flouriffiing both within and without the crater. All thefe, except a few of late date, have ac¬ quired a wonderful degree of fertility. The circum¬ ference of this zone, or great circle, according to Re- cupero, isxfT&t lefs than 70 or 80 miles. It is every¬ where fucceeded by the Regions culta ; which is much broader than the reft, and extends on all fides to the foot of the mountain. Here terrible devaftations are fometimes committed by the eruptions 3 and the whole region is likewife full of conical mountains thrown up by them. The circumference of this region is, by Re- cupero, reckoned 183 miles 3 but we have'already gi¬ ven our.reafons for reje&ing thefe dimenfions. This region is bounded by the fea to the fouth and fouth- eaft ; and on all other fides, by the river Semetus and Alcantara, which ioxm the boundaries of Mount vEtna","Hamilton, Naples, Hamilton, Catania","US,IT",4,"United States,Italy","North America,Europe"
"low the Regions deferta, but differs greatly in the tem- ' v— perature of its climate. Sir W. Hamilton obferved a gradual decreafe of the vegetation as he advanced 3 the under part being covered with large timber trees, which grew gradually lefs as he approached the third region at laft they degenerated into the fmall plants of the northern climates. He alfo obferved quantities of ju¬ niper and tanfy 3 and was informed by his guide, that later in tne feafon (he vifited riEtna in June 1769) there are a great many curious plants, and in fome places mubarb and faftron in great plenty. Tn Carre ra’s hiftory of Catania, there is a lift of all the plants and herbs of ./Etna","Hamilton, Catania","US,IT",4,"United States,Italy","North America,Europe"
"j£ T N [ 237 ] iE T N JEtna. lages, monaderies, &c. and is well peopled, notwitli- '■-‘—V—^ {landing the danger of fuch a lituation ; hut the ferti¬ lity of the foil tempts people to inhabit that country; and their fuperftitious confidence in the faints, with the propenfity mankind have to defpife danger which they do not fee, render them as fecure there as in any other place. Here, Sir William Hamilton obferves, they kept their vines low, contrary to the cuftom of thole who inhabit Mount Vefuvius j and they produce a llronger wine, but not in fuch abundance : here alfo many terrible eruptions have burft forth j particularly Subterra- one in 1669. At the foot of the mountain railed by neous ca- that eruption, is a hole, through which Sir William Hamilton defeended, by means of a rope, into feveral fubterraneous caverns, branching out, and extending much farther than he chofe to venture ; the cold there was exceffive, and a violent wind extinguifhed fome of the torches. Many other caverns are known in this and the other regions of /Etna ; particularly one near this place called La Spelonca della Palumba, (from the wild pigeons building their nefts there.) Here Mr Brydone was told that fome people had loft their fenfes, from having advanced too far, imagining they faw de¬ vils and damned fpirits",Hamilton,US,4,United States,North America
"Travelling through very difficult roads, and often incommoded with dangerous precipices, our author at lall arrived at the celebrated chefnut tree, which was the chief object of this journey. He obferves, that, Great mini, all over this fide of the mountain the chefnut trees bersorchef- thrive very well, and are carefully cultivated by the in- nut trees* habitants. 1 hey are worked into hoops for calks, and a confiderable trade is carried on in this article. The Particular great one which he came to vifit, exceeds the fize of account of other trees fo much that it cannot fail to excite thethe great greatell admiration. It has its name from the follow- tree‘ ing circumilance. Jean of Arragon fpent fome time in Sicily on her way from Spain to Naples. While here, lire viiited Mount /Etna, attended by her princi¬ pal nobility j and happening to be overtaken by a ilorm, they took Ihelter under this tree, whofe branch¬ es were fufficiently extenfive to cover them all. By others, however, this Itory is treated as a mere fable",Naples,"ES,US",4,"Spain,United States","Europe,North America"
"der to take a view of the great crater 5 in which journey ~~v “""V (our author fays) it would be difficult to make people, who have never engaged in fuch enterprifes, compre¬ hend all the obftacles they had to encounter. This cone (the little mountain mentioned by Sir William Hamilton) is compofcd of allies, fand, and pozzolana, thrown up at different times by the volcano. The ma¬ terials are fo loofe, that the adventurous traveller finks about mid-leg at every ftep, and is in conflant terror of being fwallowed up. At laid, w hen the fummit is reached, the fulphureous exhalations, which are con¬ tinually emitted from the pores of the mountain, threa¬ ten fuffocation, and irritate the fauces and lungs in fuch a manner as to produce a very troublefome and incef- fant cough. The loofenefs of the foil, wdiich gives way under the feet, obliges the traveller, every now and then, to throw himfelf flat on his belly, that fo he may be in lefs danger of finking. In this pofture our author viewed the wide unfathomable gulf in the middle of the crater j but could difcover nothing ex¬ cept a cloud of fmoke, which iffued from a number of fmall apertures fcattered all around, and accompanied with a kind of noife. Another and more dreadful Horrid found, however, Iffues from the bowels of the volcano, -0lfes !‘1uc and which, according to our author, “ ftrikes the heart with terror, fo that all the ftrength of reafon is necef-gulf",Hamilton,US,4,United States,North America
"3. The third, which is the fecond of the three men¬ tioned by Thucydides, happened in the-65 th Olym¬ piad, , JE T N [ 246 ] ^ T N tna. plad, in the 477th year before the ChrifHan aera, when Xantippus was archon at Athens. It was in this fame year the Athenians gained their boafted viftory over Xerxes’s general Mardonius near Plataea. Both the eruption of the volcano and the viftory of the Athe¬ nians are commemorated in an ancient infcription on a marble table which Hill remains. An ancient medal exhibits a reprefentation of an aftonifhing deed to which that eruption gave occafion. Two heroic youths boldly ventured into the midit of the flames to fave their parents. Their names, which well deferved to be tranfmitted to future ages, were Amphinomus and Anapius. The citizens of Catania rewarded fo noble a deed with a temple and divine honours. Seneca, Silius Italicus, Valerius Maximus, and other ancient authors, mention the heroifm of the youths with juft applaufe","Athens, Catania","US,IT",4,"United States,Italy","North America,Europe"
"The new mount of Nicolofi continued to emit allies 48 ] & T N for the fpace of three months j and the quantity dif- JEtn;1 charged was fo great as to cover all the adjoining tra£T of country for the fpace of 15 miles: fome of thefe afhes were conveyed by the winds as far as Medina and Calabria 5 and a nortn wind arifing, covered all the fouthern country about Agofta, Lentini, and even be¬ yond that, in the fame manner","Medina, Lentini","US,IT",4,"United States,Italy","North America,Europe"
"A defeription of the lava ifluing from Mount /Etna Lord Win* in 1669 was fent the court of England by Lord chelfea’s Winchelfea, vrho at that time happened to be at Ca-accounto^ tania in his way home from an embafly at Conftanti-jnenip* nople. Sir W. Hamilton gives the following ex- j^",Hamilton,US,4,United States,North America
"AETOLIA, a country of ancient Greece, compre¬ hending all that traft now called the Defpotat, or Little Greece. It was parted on the eab by the river Evenus, now the Fidari, from the Locrenfes Ozolte ; on the web, from Acarnania, by the Achelousj on the north, it bordered on the country of the Dorians and part of Epirus; and, on the fouth, extended to the bay of Corinth",Corinth,"GR,US",4,"Greece,United States","Europe,North America"
"They dibinguibied themfelves above all the other na¬ tions of Greece, in oppobng the ambitious debgns of the Macedonian princes ; who, after having reduced mob of the other bates, were forced to grant them a peace upon very honourable terms. The conbitution of the AEtolian republic was copied from that of the Achceans, and with a view to form, as it were, a coun¬ ter alliance ; for the AEtolians bore an irreconcileafcle hatred to the Achaeans, and had conceived no fmall jealoufy at the growing power of that bate. The Cleomenic war, and that of the allies, called the facial war, were kindled by the AEtolians in the heart of Peloponnefus, with no other view but to humble their antagonibs the Achaeans. In the latter, they held out, with the abibance only of the Eleans and Lace¬ demonians for the fpace of three years, againb the united forces of Achaia and Macedon 5 but were obliged at lab to purchafe a peace, by yielding up to Philip all Acarnania. As they parted with this pro¬ vince much againb their will, they watched all oppor¬ tunities of wreiling it again out of the Macedonian’s hands; for which reafon they entered into an alliance with Rome againb him, and proved of great fervice to the Romans in their war with him : but growing in- folent upon account of their fervices, they made war upon the Remans themfelves. By that warlike nation they were overcome, and granted a peace on the fol¬ lowing fevere terms; 1. The xnajeby of the Roman peopls JS T O JBtolia-. people iliall be revered in all iEtolxa. 2 ■y—***-' not fuffer the armies of fuch as are at war with Rome to pafs through her territories, and the enemies^ of Rome ihall be likewife the enemies of /Etolia, 3. She {hall, in the fpace of 100 days, put into the hands of the magiftrates of Corcyra all the prifoners and defert- ers fire has, whether of the Romans or their allies, ex¬ cept fuch as have been taken twice, or during her al¬ liance with Rome. 4. The vEtolians (hall pay down in ready money, to the Roman general in /Etoiia, 200 Euboic talents, of the fame value as the ,A.thenian ta¬ lents, and engage to pay 50 talents more within the lix years following. 5. They (hall put into the hands of the conful 40 fuch hoilages as he {hall choofe ; none of whom fhali be under 12, or above 40 years of age : the praetor, the general of the horfe, and luch as have been already hollages at Rome, are excepted out of this number. 6. iEtolia {hall renounce all preten- fions to the cities and territories which the Romans have conquered, though thefe cities and territories had formerly belonged to the iEtolians. 7. The city -of Oenis, and its diftridl:, lhall be fubjeft to the Acar- nanians","Rome, Roman, Rome, Rome, Rome, Roman, Rome","US,RO,MK,GR",4,"United States,Romania,North Macedonia,Greece","North America,Europe,Europe,Europe"
"After the conqueft of Macedon by /Emilius Paulus, they were reduced to a much worfe condition } for not only thofe among them who had openly declared for Perfeus, but fuch as were only fufpedled to have fa¬ voured him in their hearts, were fent to Rome, in or¬ der to clear themfelves before the fenate. There they were detained, and never afterwards fuflfered to return into their native country. Five hundred and fifty of the chief men of the nation were barbaroufly alfafli- nated by the partifans of Rome, for no other crime -but that of being fufpetted to wifh well to Perfeus","Rome, Rome",US,4,United States,North America
"The iEtolians appeared before ALmilius Paulus in mourning habits, and made loud complaints of fuch inhuman treatment; but could obtain no redrefs : nay, ten commiflioners, who had been fent by the fenate to fettle the affairs of Greece, enafted a decree, declaring, that thofe who were killed had fuffered juftly, fince it appeared to them that they had favoured the Macedo¬ nian party. From this time thofe only were raifed to the chief honours and employments in the ALtolian re¬ public who were known to prefer the intereft of Rome to that of their country j and as thefe alone were coun¬ tenanced at Rome, all the magiftrates of yEtolia were the creatures and mere tools of the Roman fenate. In this ftate of fervile fubjeclion they continued till the deftrudlion of Corinth, and the diffolution of the A- chaean league 5 when iEtolia, with the other free ftates of Greece, was reduced to a Roman province, com¬ monly called the province of Achaia. Neverthelefs, each ftate and city was governed by its own laws, un¬ der the fuperinteridency of the praetor whom Rome fent .annually into Achaia. The whole nation paid a cer¬ tain tribute, and the rich were forbidden to polfefs lands anywhere but in their own country","Rome, Rome, Roman, Corinth, Roman, Rome","US,GR,RO",4,"United States,Greece,Romania","North America,Europe,Europe"
"The former he left to Michael his fon; who maintain¬ ed it againft Michael Fakeologus, the firft emperor of the Greeks, after the expulficn of the Latins. Charles, the laft prince of this family, dying in 1430 without lawful iffue, bequeathed iEtolia to his brother’s fon, named alfo Charles; and Acarnaniato his natural fons, Memnon, Turnus, and Hercules. But, great dii- putes arifing about this divifion, Amurath II. aftet* the reduction of Thefialonica, laid hold oi fo favour¬ able an opportunity, and drove them all out in I432, The Mahometans were afterwards difpoffeire'd of this country by the famous prince of Epirus, George Ca- ftriot, commonly called Scanderbeg; who, with a imall army, oppofed the whole power of the Ottoman em¬ pire, and defeated thefe barbarians in 22 pitched bat¬ tles. That hero, at his death, left great part of iEto¬ lia to the Venetians } but, they not being able to make head againft fuch a mighty power, the whole country was foon reduced by Mohammed II. whofe fucceftors hold it to this day",Hercules,US,4,United States,North America
"AFER, Domitius, a famous orator, born at Nif- mes, flourifiied under Tiberius and the three fucceed- ing emperors. Quintilian makes frequent mention of him, and commends his pleadings. But he difgraced his talents, by turning informer againft fome of the moft diftinguiftied perlonages in Rome. Quintilian, in his youth, cultivated the friendfhip of Domitius very afliduoufly. He tells us that hrs pleadings abounded with pleafant ftories, and that there were public col- leftions of his witty fayings, fome of which he quotes",Rome,US,4,United States,North America
"AFFORAGE, in the French cuftoms, a duty paid to the lord of a diftrict, for permiffion to fell wine, or other liquors, within his feigniory. Afforage is alfo ufed for the rate or price of proviftons laid and fixed by the provoft or fheripis of Paris",Paris,"US,FR",4,"United States,France","North America,Europe"
"Saul, whofe defcent, according to fome of them, was of Judah, and according to others of Benjamin, had, they fay, two fons, Berkia and Irmia, who ferved David, and were beloved by him. The fons of Berkia and Irmia were Afghan and Ulbec, wffio, during the reigns of David and Solomon, diftinguiftied themfelves, the one for ftrength of body, and the other for learn¬ ing. The ftrength of Afghan, we are told, fttuck ter¬ ror even into the demons and genii","David, David","PA,AF",4,"Panama,Afghanistan","North America,Asia"
"ven by Elerodotus of this remarkable tranfaftion : “ Except in that particular part which is contiguous to Herodotus’s Afia, the whole of Africa is furrounded by the fea. account <4 The firft perfon who has proved this, was, as far as we ’*• are able to judge, Necho king of Egypt. When he had defifted from his attempt to join by a canal the Nile with the Arabian gulf, he difpatched fome veffels under the conduft of Phoenicians, with direftions to pafsby the Columns of Hercules, and, after penetrating the Northern ocean, to return to Egypt. Thefe Phoe¬ nicians, taking their courfe from the Red fea, entered into the Southern ocean. On the approach of autumn they A F R [ 255 ] A F R Africa, tliey landed at Libya, and planted feme corn in the v——V""-""’ place where they happened to find themfelves : when this was ripe, and they had cut it down, they again de¬ parted. Having thus confumed two years, in the third they paffed the Columns of Hercules, and returned to E- gypt. Their relation may obtain attention from others, but to me it feems incredible 5 for they affirmed that, having failed round Africa, they had the fun on their right hand. Thus was Africa, for the firft time, known.” Many of the mofl eminent of the ancient kiftorians and geographers regarded this account of the circum¬ navigation of Africa as altogether fabulous, chiefly in confequence of the llory concerning the appearance affumed by the great celeftial bodies in the courfe of the voyage, which was then unintelligible, from the imper- feft ftate of the fcience of aftronomy. But the very cir- cumftances which, among the ancients, excited a doubt about the exiftence or fuccefs of fuch a voyage, mull now be regarded as affording the molt fatisfadtory in¬ ternal evidence of the veracity of the ancient Phoeni¬ cian navigators","Hercules, Hercules","EG,US,LY",4,"Egypt,United States,Libya","Africa,North America,Africa"
"The events now7 alluded to, w7ere the difeovery of A- Caufes that merica by Columbus in 1492, and the eafy communi-^e^Pted cation with the Eaff Indies, opened up by the difeo- coverie,« ;a very of the paffage, round the Cape of Good Hope. Africa",Columbus,US,4,United States,North America
